,subreddit,author,domain,title,num_comments,score,timestamp
1145,nottheonion,ManualWind,salon.com,"Squirrel privilege is real: Intergenerational wealth drives animal inequality, study says",1,1,1640162205
1146,nottheonion,Le_Burg,npr.org,"A hospital offered a payment plan for baby's NICU stay — $45,843 a month for a year",1,1,1640161886
1147,nottheonion,TonyTomato9000,washingtonexaminer.com,DC librarian who allegedly told elementary students to act out Holocaust has prior criminal record,1,1,1640158826
1148,nottheonion,kiwiloverbutallergic,theguardian.com,Barrister sues for harassment after his colleague asked him to stop continuously farting in their small office.,0,1,1640157075
1149,nottheonion,JohnHwagi,keprtv.com,"12-year-old tries to rob 17-year-old at gunpoint, gets shot instead, deputies say",0,1,1640154571
1150,nottheonion,AJ-Naka-Zayn-Owens,independent.co.uk,"Texas QAnon cult is now drinking bleach, member’s family says",1,1,1640153898
1151,nottheonion,Kurzwhile,dtnpf.com,North Dakota Farmer Accused of Trying to Hire Hitmen to Kill Ukrainian Minister of Agriculture,0,1,1640153367
1152,nottheonion,ghostpepperwings,twitter.com,The New York Times offers instructions on how to use a stool,1,1,1640151889
1153,nottheonion,ghostpepperwings,mobile.twitter.com,NYTimes provides much needed instructions on how to use a stool.,1,1,1640151806
1154,nottheonion,Manijab,sbs.com.au,McDonald's Japan rations chips despite emergency airlift,0,1,1640150711
1155,nottheonion,Quintentark,usukservice.com,Buy Verified PayPal Accounts - 100% Full Verified And Best Quality,0,1,1640150288
1156,nottheonion,SuperAlloyBerserker,infosecurity-magazine.com,Nintendo of America president Doug Bowser sues hacker Gary bowser for creating and selling Nintendo Switch hacks,0,1,1640149653
1159,nottheonion,Clear_Can_9836,youtu.be,2021.12.22早，小圓子，開播!,1,1,1640148827
1160,nottheonion,Mpeterwhistler83,nbcnews.com,"Utah billionaire leaves Mormon church, donates $600K to LGBTQ group",0,1,1640147080
1161,nottheonion,redditesgarbage,twitter.com,"[Charania] The Mavericks are signing guard Charlie Brown of NBA G League Delaware to a 10-day hardship deal, sources tell @TheAthletic @Stadium.",1,1,1640146628
1162,nottheonion,geekman20,thestreet.com,'Zombie' RadioShack Reborn As Crypto Company,0,1,1640145309
1163,nottheonion,geekman20,pcmag.com,RadioShack Returns as a Crypto Company,1,1,1640145259
1164,nottheonion,Other_Somewhere6908,theguardian.com,US quidditch leagues to change name in effort to break from JK Rowling,0,1,1640144901
1165,nottheonion,Other_Somewhere6908,theguardian.com,US quidditch leagues to change name in effort to break from JK Rowling | US news,0,1,1640144162
1166,nottheonion,dude463,katu.com,Driver dies after his involvement in three crashes near Lake Samish,0,1,1640143329
1167,nottheonion,mbe8819,avclub.com,Box office experts try to solve the mystery of why Spider-Man: No Way Home made so much money,0,1,1640143078
1168,nottheonion,TotallyWafflez,videogameschronicle.com,Cyberpunk designer responds to lack of police chases: ‘Elden Ring won’t have them either’,0,1,1640142343
1169,nottheonion,Kao_Soy_Hoe,reddit.com,Pakistan Air Force makes a commercial mall above the communication tower located in one of their base.,0,1,1640142086
1170,nottheonion,rtgurley,theverge.com,Tom Brady’s best throw of the night destroys Microsoft tablet,1,1,1640141671
1171,nottheonion,KimCureAll,universalhub.com,"Slutcracker throws in the vibrator, cancels remainder of performances due to Covid-19",0,1,1640140076
1173,nottheonion,Dull_Tonight,insider.com,A Twitch streamer said obese people should be 'shamed' because 'it's bad for them' while vaping during a livestream,0,1,1640139152
1175,nottheonion,Stress--Reliever,youtube.com,Relaxing &amp; Meditation Rain on Downtown Apartment. White Noise to Relieve...,1,1,1640138637
1176,nottheonion,madeinbuffalo,nbcnewyork.com,"NYC Housing Specialists Asked Homeless Clients for Loans to Pay Rent, City Says",1,1,1640137698
1177,nottheonion,queen_nefertiti33,reuters.com,Exclusive: U.N. proposing paying nearly $6 million to Taliban for security,0,1,1640136121
1178,nottheonion,queen_nefertiti33,yahoo.com,"Exclusive-U.N. proposing paying nearly $6 million to Taliban for security -document, source",1,1,1640135923
1179,nottheonion,Hot-Inspector-3910,certifiedintel.com,"Idaho man James Russell believes eating his victim could 'cure his brain', cops say",0,1,1640135460
1180,nottheonion,readnews2021356,news.google.com,Fauci Builds New Animal Disease Center,1,1,1640135190
1181,nottheonion,readnews2021356,news.google.com,Fauci Builds New Animal Disease Research Center,1,1,1640135157
1182,nottheonion,yipchow,examiner.com.au,Fox host calls for 'kill shot' on Fauci,0,1,1640134569
1184,nottheonion,SeanLikeYouReadAbout,wsj.com,Think Santa Is Busy? Ham Sniffers Are Pushing Their Noses to the Limit,1,1,1640134546
1185,nottheonion,Hot-Condition88,healthing.ca,Mafia bosses worry for future as 'soft' millennial mobsters prefer texting to pistol-whipping,0,1,1640134451
1186,nottheonion,broughtonline,nzherald.co.nz,Six-year-old and her siblings buy house with pocket money,0,1,1640133942
1187,nottheonion,Alyssa3467,cnn.com,Ryan Reynolds repeatedly mistaken for Ben Affleck at New York pizza place,0,1,1640132806
1188,nottheonion,mac-mcgreor,fox2now.com,Actual headline: Previously-convicted arsonist named acting fire chief of Metro East volunteer fire department,0,1,1640132372
1189,nottheonion,m1n3c7afty,kotaku.com,"Ubisoft Director Says 'We Understand' Where NFT Hate Comes From, Does Not Understand Shit",1,1,1640132349
1190,nottheonion,Qlanger,businessinsider.com,The first American to die of the Omicron variant was an unvaccinated Texas man who had previously caught COVID-19,0,1,1640132279
1191,nottheonion,SelectiveSanity,cnn.com,America is running out of candy canes,0,1,1640132266
1192,nottheonion,Fit_Minimum8335,rawstory.com,Jim Bob Elliott is the latest Capitol attacker to be indicted for allegedly beating cops with a flag pole,1,1,1640131892
1193,nottheonion,Mamacrass,orlandoweekly.com,Florida man banned from airline for wearing thong as mask compares himself to Rosa Parks,1,1,1640131774
1194,nottheonion,justbethescandal,moneyinvestors.net,How Your Neighbor's Lottery Prize Can End Up Causing Your Own Ruin,0,1,1640130201
1195,nottheonion,dszp,cbsnews.com,A dinosaur embryo has been found inside a fossilized egg. Here's what that means.,0,1,1640129153
1197,nottheonion,Weaklurker,popsugar.co.uk,Kanye West Jumped Into Swan Lake in the Middle of His Free Concert,0,1,1640128778
1198,nottheonion,ridethepickle,nypost.com,Ex-Versace model credits youthful looks to drinking his own urine,1,1,1640128036
1199,nottheonion,No_Agenda29,yahoo.com,"What else is he supposed to do against all those vicious, bloodthirsty Ukrainians",1,1,1640128001
1200,nottheonion,CarletonPhD,cnbc.com,Superyacht building boom creates a supply crunch and crew shortage for ultrarich buyers,0,1,1640126776
1203,nottheonion,Sweep145,abc.net.au,Tasmanian mother offered zoo pass after disclosing daughter's allegation over sexual abuse to school,0,1,1640125427
1204,nottheonion,dwelleronthethreshld,irishtimes.com,Government struggling to retain ability to tell country what to do,0,1,1640125091
1205,nottheonion,atmoscience,abcnews.go.com,Haitian migrants sue Biden administration over treatment at southern border,0,1,1640124959
1206,nottheonion,Wants_to_Die12345,thethings.com,Adele’s ‘21’ Becomes First Female Record To Spend An Entire Decade On The Billboard 200,0,1,1640124552
1207,nottheonion,Dersou,youtube.com,Surprising facts on the breeding grounds of the Humpback whales.,1,1,1640123842
1208,nottheonion,jimi15,gamingbible.co.uk,Gamer Fatally Shot By Friend In Argument Over Diablo 2 Loot,0,1,1640123422
1209,nottheonion,Sea_Guarantee_1168,fumacrom.com,WHO SHOULD PARTICIPATE IN THE PROGRAM?,1,1,1640123323
1210,nottheonion,FUNKYDISCO,click2houston.com,KFC brings back fried chicken-scented firelog ahead of holidays,0,1,1640122818
1211,nottheonion,thomasp3864,bbc.co.uk,Spain police thwart raffle of Christmas hamper stuffed with drugs,0,1,1640121447
1212,nottheonion,kashyapaaa,www-newsweek-com.cdn.ampproject.org,"Group of monkeys kill over 250 dogs for ""revenge"" in Indian town",1,1,1640120377
1213,nottheonion,fkrditadms,9news.com,Prosecutor in I-70 truck crash case got 'trophy' for conviction,0,1,1640120012
1214,nottheonion,varunsundars,dailymotion.com,An extremely funny ride of a bully sugar glider!,1,1,1640119789
1215,nottheonion,TF_dia,google.com,Spanish drug raid thwarts raffle of Christmas ‘narco-basket’,1,1,1640119525
1216,nottheonion,s_in_progress,bangordailynews.com,“Let them all have it”. LePage says his pandemic plan as governor would be to let kids get coronavirus,0,1,1640118488
1217,nottheonion,xcd90,telegraph.co.uk,The metropolitan police refers itself to the police watchdog over handling of Downing Street party allegations,1,1,1640118052
1218,nottheonion,rjaiswal1,courthousenews.com,Coffee and airbags don’t mix.,0,1,1640117816
1219,nottheonion,rjaiswal1,autoblog.com,Coffee and airbags don’t mix,1,1,1640117676
1220,nottheonion,SelectiveSanity,cnn.com,81-year-old US Capitol rioter sentenced to three years of probation,0,1,1640117381
1221,nottheonion,Smartnership,cbs46.com,Emory University fraternity receives violation notice for Christmas wreath,0,1,1640117039
1222,nottheonion,Smartnership,msn.com,Fraternity at Emory University in trouble because of a Christmas wreath,1,1,1640116876
1223,nottheonion,lurker_bee,carscoops.com,People In California Are Leaving Their Trunks Open To Dissuade Thieves,1,1,1640115925
1224,nottheonion,MASKSWORKDAMMIT,nationalpost.com,Wow.,1,1,1640115750
1225,nottheonion,summerhair35,consequence.net,It oh,0,1,1640115610
1226,nottheonion,iamwhatswrongwithusa,thedailybeast.com,"Dallas QAnon ‘Cult’ Is Now Drinking Terrifying Chemical Cocktail, Family Says",1,1,1640114995
1227,nottheonion,atmoscience,abc3340.com,Satanic holiday display installed at Illinois Capitol,0,1,1640114894
1229,nottheonion,atmoscience,al.com,"Man stopped wife from driving drunk, charged when she died walking home",0,1,1640113164
1230,nottheonion,scmbag,californianewstimes.com,"Imaginary numbers could be needed to describe reality, new studies find - California News Times",0,1,1640112668
1231,nottheonion,SelectiveSanity,leoweekly.com,"""Die Hard"" Is A Christmas Movie, And Falls City Will Prove It To You At Their Thursday Theatre",0,1,1640112241
1232,nottheonion,makvalley,kitv.com,Wild boar attacks O’ahu surfer in waters off Kaena Point,0,1,1640112155
1233,nottheonion,SelectiveSanity,sacbee.com,‘Die Hard’ narrowly clinches win for favorite Christmas movie. What else are you watching?,1,1,1640112113
1234,nottheonion,scmbag,livescience.com,"Imaginary numbers could be needed to describe reality, new studies find",1,1,1640111813
1235,nottheonion,The-Karga,vebotto.com,Biden approved two huge solar farms,0,1,1640111222
1236,nottheonion,ShelteringInStPaul,thedailybeast.com,Convicted Arsonist Named Acting Chief of Illinois Fire Department,0,1,1640110774
1237,nottheonion,Safebox,deccanherald.com,Qatar seizes rainbow-coloured toys it deems 'un-Islamic',0,1,1640110753
1238,nottheonion,breadsticksnsauce,reuters.com,U.S. cities try new way to help the poor: give them money,0,1,1640110610
1239,nottheonion,chooseyrownindenture,nme.com,UK votes Rage's 'Killing In The Name Of' its favourite Christmas Number One,1,1,1640110349
1240,nottheonion,danger355,futurism.com,Woman Gives Birth in Tesla While It's Driving on Autopilot,0,1,1640110310
1241,nottheonion,SteO153,wantedinrome.com,Covid: Italy virologists sing 'Yes Vax' to tune of Jingle Bells,0,1,1640110288
1242,nottheonion,SilasX,digest.bps.org.uk,"Once A Meanie, Always A Meanie: Toddlers Are Harsh Judges Of Moral Character",0,1,1640109393
1244,nottheonion,bberkowitz,nbcnewyork.com,NYC City Employees Borrowed Money From Homeless Clients for Rent,0,1,1640107781
1245,nottheonion,thebelsnickle1991,bbc.com,"The princess, the sheikh and the £550m divorce settlement",0,1,1640107172
1246,nottheonion,meganatious,theguardian.com,Monkeys blamed for hundreds of puppy deaths captured in India,0,1,1640107039
1247,nottheonion,theangryfatguy,news.sky.com,Primary school teacher sacked over video of woman kicking and punching a horse | Also loses position with local pony club and is banned from trail hunting,0,1,1640106954
1248,nottheonion,meganatious,vice.com,Monkeys Go On a Killing Spree by Fatally Dropping 250 Puppies From Trees,1,1,1640106895
1249,nottheonion,SuccessfulJelly,npr.org,"Hospital offers parents $45,843-a-month installment plan for baby's NICU stay",0,1,1640106722
1250,nottheonion,Time_Ad_2258,verifiedtracking.com,here is the most precious of all find a way to lose weight quickly in 25 days discover how 🙏,0,1,1640106237
1251,nottheonion,Darth_Kahuna,kitv.com,Surf Boar'd: Wild boar attacks O’ahu surfer in waters off Kaena Point,0,1,1640106185
1252,nottheonion,Sanlear,apnews.com,Squirrels force St. Paul park to scale back holiday lights,0,1,1640105447
1253,nottheonion,khool1499,news5cleveland.com,"A Theft Too Far – Akron police recover stolen bridge, arrest 63-year-old Medina Co. man",0,1,1640104751
1254,nottheonion,thisismySFWprofile,thehill.com,Trump to hold news conference from Mar-a-Lago on Jan. 6,0,1,1640103466
1255,nottheonion,75dollars,thehill.com,"Fox dropping COVID-19 testing option, requiring vaccinations for workers in New York",0,1,1640103088
1256,nottheonion,Occultivated,livescience.com,"Imaginary numbers needed to describe reality, new studies find.",1,1,1640102741
1257,nottheonion,KGBStoleMyBike,rawstory.com,QAnon cultists are now drinking bleach compound from communal bowl: 'Immediately evokes images of Jonestown',1,1,1640102391
1258,nottheonion,raidonward,wafb.com,‘All I Want for Christmas Is A Roof’: St. Charles Parish school employees modify holiday song following Hurricane Ida,0,1,1640102166
1259,nottheonion,Amazing_Cow_3641,pilotonline.com,Doritos junkies hit jackpot as beached cargo container spills the goods,0,1,1640101673
1261,nottheonion,sidd1943,bbc.co.uk,Scottish Power debt team filmed raiding wrong home,0,1,1640101149
1263,nottheonion,RipePasta,msn.com,Marjorie Taylor Greene Refers to 'Yellow People' in Speech on GOP Diversity,1,1,1640099638
1265,nottheonion,itsachrysis,apple.news,Nailed it.,1,1,1640099408
1266,nottheonion,RipePasta,huffpost.com,Marjorie Taylor Greene Uses Racial Slur To Tout Diversity Of GOP,1,1,1640099302
1267,nottheonion,DiogenesK-9,thedailybeast.com,Bill O’Reilly: I Had to Console Trump After MAGA Fans Booed Him for Getting Vaccine Booster,0,1,1640099251
1268,nottheonion,xxxFuckEmAllxxx,bellinghamherald.com,Smuggler’s Inn owner convicted of smuggling people across the Canadian border,0,1,1640098402
1269,nottheonion,abortion__eater,wgntv.com,Rittenhouse Gets Standing Ovation at Conservative Conference,0,1,1640097535
1270,nottheonion,PersonalMost2,vice.com,Parrots Are Getting Drunk on Rotten Mangoes and Flying Under the Influence,1,1,1640096866
1272,nottheonion,chopinrocks,thepremierdaily.com,There's Actually A Whole Civilization Of 'Mole People',0,1,1640096653
1273,nottheonion,bolshoybooze,timesnownews.com,Infant dies after husband tries to do wife's delivery by referring to YouTube videos,1,1,1640096486
1274,nottheonion,titusyoungsenior,thetimes.co.uk,Amazon agreed to allow only five-star reviews for Xi’s book in China,1,1,1640096172
1275,nottheonion,Gravini,cbc.ca,Fisherman handed lifetime ban following midnight poaching of hundreds of crabs in Vancouver harbour,0,1,1640096137
1276,nottheonion,Ambitious_Bridge_491,windsorstar.com,Spelling error on Windsor billboard draws derision,1,1,1640095752
1277,nottheonion,Not_Fully_Awake,washingtonpost.com,D.C. third-graders were made to reenact episodes from the Holocaust,1,1,1640095693
1278,nottheonion,BilBorrax,outkick.com,When you have a strong union,0,1,1640095037
1279,nottheonion,2021-Man,bmj.com,UK drugs strategy: promised new approach is identical to previous strategies,0,1,1640094241
1281,nottheonion,Gdott,news18.com,"Demi Lovato Serenades ‘Ghost’ Who Faced Trauma from Sexism, Receives ‘Floating’ Ovation",1,1,1640092668
1282,nottheonion,sAindustrian,bbc.com,Kosovo agrees to rent prison cells to Denmark to ease overcrowding,0,1,1640091559
1283,nottheonion,38384,wionews.com,Taliban accidentally transfers money to Tajikistan-based opposition; embassy refuses to pay back,0,1,1640091018
1285,nottheonion,mrajoiner,thedailybeast.com,Fox News Anchor Experiences Real-Life Ron Burgundy Moment,1,1,1640090748
1286,nottheonion,JonathanPhillipFox,theguardian.com,Boy whose case inspired The Exorcist is named by US magazine | US news,0,1,1640090343
1287,nottheonion,[deleted],nypost.com,Amazon ordered to delete reviews of Chinese president's book: report,1,1,1640089789
1289,nottheonion,wcis4nubz,cnn.com,McDonald's teen employee hopped through drive-thru window to save customer choking on a chicken nugget,0,1,1640088721
1290,nottheonion,Oceans_sleep,foxnews.com,Sarah Palin: 'Over my dead body' will I get the COVID-19 vaccine,0,1,1640088708
1291,nottheonion,BannedThrice,yahoo.com,North Korea bans laughing,0,1,1640087788
1292,nottheonion,GenerallyIroh,metro.co.uk,Baked beans lover prepares for bean-covered Christmas dinner,1,1,1640087000
1293,nottheonion,Kinnell999,independent.co.uk,Quidditch to change name of sport to distance itself from JK Rowling,1,1,1640086389
1294,nottheonion,GenerallyIroh,futurism.com,"Scientist Who Trained Rats to Play ""Doom II"" Says He May Start Twitch Channel",1,1,1640086030
1295,nottheonion,Arteey,nypost.com,Woman claims she was virtually 'groped’ in Meta VR Metaverse,1,1,1640085487
1296,nottheonion,DiscombobulatedBox6,texastribune.org,Push to ban books in Texas schools spreads to public libraries,0,1,1640085332
1297,nottheonion,TheRedDevil21,m.timesofindia.com,"Merry Christmas: Vodafone auctioning world's first SMS, expected to fetch more than $200,000 - Times of India",1,1,1640085003
1298,nottheonion,Starlight-786,starlightinternational786.world,Content of Appropriate technology,1,1,1640082423
1299,nottheonion,Starlight-786,starlightinternational786.world,Content of Free Software,1,1,1640082412
1300,nottheonion,Starlight-786,starlightinternational786.world,Content of Childhood memory,1,1,1640082400
1301,nottheonion,virlan4trendnews,virlan.co,"watch : Did Tom Holland and Zendaya date? “Spider-Man: No Way Home” producer, Amy Pascal says she warned",0,1,1640082259
1302,nottheonion,Starlight-786,starlightinternational786.world,Content of Artificial intelligence,1,1,1640082113
1303,nottheonion,Starlight-786,starlightinternational786.world,Content of Online video platform,1,1,1640082097
1304,nottheonion,Starlight-786,starlightinternational786.world,Content of Entrepreneurship,1,1,1640082087
1305,nottheonion,Starlight-786,starlightinternational786.world,Content of Data Entry Clerk,1,1,1640082077
1306,nottheonion,Starlight-786,starlightinternational786.world,Content of Open-source programming,1,1,1640081999
1307,nottheonion,Starlight-786,starlightinternational786.world,Content of Business strategy,1,1,1640081988
1308,nottheonion,Starlight-786,starlightinternational786.world,Content of Philosophy of science,1,1,1640081777
1309,nottheonion,Starlight-786,starlightinternational786.world,Content of Natural disaster,1,1,1640081767
1310,nottheonion,Starlight-786,starlightinternational786.world,Content of Scientific method,1,1,1640081743
1311,nottheonion,Starlight-786,starlightinternational786.world,Content of Clinical psychology,1,1,1640081599
1312,nottheonion,Starlight-786,starlightinternational786.world,Content of Philosophy,1,1,1640081561
1313,nottheonion,danielce12,mynewscorp.com,SHOCK! On Delta Airlines Flight Woman Breastfeed Her Hairless CAT!,0,1,1640081539
1314,nottheonion,Starlight-786,starlightinternational786.world,Content Of Email marketing,1,1,1640081512
1315,nottheonion,TeqTronikz,bbc.com,A man who donated his mother's body to what he thought was Alzheimer's research learned later it was used to test explosives.,0,1,1640080917
1316,nottheonion,Movie_Advance_101,theguardian.com,North Korea bans laughing for 11 days during mourning for anniversary of Kim Jong-il's death,0,1,1640080683
1317,nottheonion,Starlight-786,starlightinternational786.world,Content of Music festival,1,1,1640080564
1318,nottheonion,Starlight-786,starlightinternational786.world,Content of Free software,1,1,1640080530
1319,nottheonion,jackythevillen,iol.co.za,Ouch! Bomb squad called to hospital after man gets munition 'stuck in his rectum',0,1,1640080368
1320,nottheonion,Starlight-786,starlightinternational786.world,Content Mobile technology,1,1,1640080329
1321,nottheonion,Starlight-786,starlightinternational786.world,Content of Cafe Racer,1,1,1640080316
1322,nottheonion,Starlight-786,starlightinternational786.world,Content of Software engineer,1,1,1640080179
1323,nottheonion,Starlight-786,starlightinternational786.world,Content of Computer programming,1,1,1640080114
1324,nottheonion,SpyderDM,thehill.com,Coal miners' union urges Manchin to reconsider opposition to Biden plan,0,1,1640079994
1325,nottheonion,totalwpierdol,cbsnews.com,Man suing body donation company after mother's corpse was used for bomb testing,0,1,1640079386
1326,nottheonion,pipopapupupewebghost,gamerant-com.cdn.ampproject.org,Sonic the Hedgehog Introduces Tails VTuber,1,1,1640079138
1327,nottheonion,Starlight-786,starlightinternational786.world,Content of Computer engineering,1,1,1640078048
1328,nottheonion,Starlight-786,starlightinternational786.world,Content of Software,1,1,1640077998
1329,nottheonion,Starlight-786,starlightinternational786.world,Content of Make in India,1,1,1640077972
1330,nottheonion,Starlight-786,starlightinternational786.world,Content of International Economics,1,1,1640077929
1331,nottheonion,Starlight-786,starlightinternational786.world,Content of Drink,1,1,1640077876
1332,nottheonion,Starlight-786,starlightinternational786.world,Content of Job analysis,1,1,1640077845
1333,nottheonion,Starlight-786,starlightinternational786.world,Content of Nature,1,1,1640077810
1334,nottheonion,totalwpierdol,newsweek.com,"Arizona man shocked to find out his mother's donated body was strapped to a chair and detonated in U.S. military ""blast testing""",1,1,1640077805
1335,nottheonion,Ok-Refrigerator3662,youtu.be,2021.12.21晚，小圓子，開播！,1,1,1640077789
1336,nottheonion,runhenry94,youtube.com,This Asian Man Ran the FASTEST 60m in Human History | Su Bingtian 2012-2021 Metamorphosis 9.83|6.29,0,1,1640077770
1337,nottheonion,Zeus2910,newindianexpress.com,Two monkeys involved in revenge killing of over 250 dogs captured in Maharashtra's Beed district (India),0,1,1640077318
1338,nottheonion,Change_petition,mydigitalstartup.net,"To curb student suicides, Indian Institute of Science, a premier university in India, begins removing ceiling fans",0,1,1640075416
1340,nottheonion,chakari10,euronews.com,Scottish parliament could soon grant pardons to witches,0,1,1640072750
1341,nottheonion,PepperoniGoblin,cbc.ca,No additional jail time for Smuggler's Inn owner guilty of helping people illegally enter Canada,0,1,1640072331
1342,nottheonion,AppropriateWeb9544,famousmoviejackets.com,Nicolas Cage Pink Jacket,0,1,1640071597
1343,nottheonion,gorays21,msn.com,"Two Teens Arrested, One Gator Killed In Florida Crash",1,1,1640070967
1344,nottheonion,Goatseegoatdo,en.newizv.ru,Russia drafts legal requirements for mass graves,0,1,1640070454
1345,nottheonion,summerhair35,thesun.co.uk,When is my baby arriving?,1,1,1640069656
1348,nottheonion,RealityCrave,mediatraffic.org,Joe Biden Chances Of Getting A Second Term Are Slim And Here’s Why,0,1,1640067042
1349,nottheonion,Hot-Inspector-3910,certifiedintel.com,"Speaking from prison: 'QAnon Shaman' Jacob Chansley compares himself to Gandhi, Martin Luther King Jr., and Jesus Christ",0,1,1640066918
1350,nottheonion,ucanews123,ucanews.com,"Pope tells kids: Jesus loves you, wants you to love others - UCA News",0,1,1640066530
1351,nottheonion,Establishedunfairly,bbc.co.uk,Young pupils allegedly forced to re-enact Holocaust in Washington school,0,1,1640066371
1352,nottheonion,Toybasher,newsmax.com,Laughter Banned for 11 Days in North Korea,1,1,1640065587
1353,nottheonion,Individual-Eagle2467,youtu.be,2021.12.21早，老白，開播！,1,1,1640063862
1354,nottheonion,wesleh778,msn.com,Monkeys captured after killing 250 dogs in “revenge” killings in Indian Town,1,1,1640063710
1355,nottheonion,Ferggzilla,mlive.com,"Michiganders in rural, deep red counties twice as likely to die of COVID, data shows",0,1,1640063632
1356,nottheonion,Humanzee2,twitter.com,Kids buy a house with their pocket money (and $665 000 from their property investor dad),1,1,1640063159
1357,nottheonion,Ironfox2151,foxlexington.com,58-foot bridge stolen in Ohio,0,1,1640061560
1358,nottheonion,Ironfox2151,independent.co.uk,Police baffled over theft of entire 58-ft high bridge in Ohio a month ago,1,1,1640061473
1359,nottheonion,Ironfox2151,nypost.com,Ohio police seeking thieves who stole 58-foot bridge,1,1,1640061406
1361,nottheonion,ucanews123,ucanews.com,Clerics get away with child abuse in the Philippines,0,1,1640060608
1362,nottheonion,Marvin-face,mobile.twitter.com,Indiana Governor celebrating end of construction of new stretch of interstate I-69.,1,1,1640060018
1363,nottheonion,iamtehfong,news.com.au,Spare a thought for the mistresses at Xmas,0,1,1640058248
1364,nottheonion,malloryduncan,beaconjournal.com,Who steals an entire bridge? Police say this Medina County man took one from Akron,0,1,1640058195
1365,nottheonion,SuperCub,cbc.ca,"Cobequid Pass holder receives $16 refund, then is charged $999,999",0,1,1640058140
1366,nottheonion,thetremulant,complex.com,North Korea Bans Laughing for 11 Days to Mark Anniversary of Former Leader Kim Jong Il’s Death,1,1,1640057597
