,subreddit,author,domain,title,num_comments,score,timestamp
0,TheOnion,mothershipq,theonion.com,Surgeon Kind Of Pissed Patient Seeing Her Deformed Face For First Time Just Smashed His Hand Mirror Like That,0,1,1640973300
1,TheOnion,-ImYourHuckleberry-,theartnewspaper.com,McDonald’s blocked from building drive-through at Rome's ancient Baths of Caracalla,1,1,1640971771
2,TheOnion,dwaxe,theonion.com,"Gwyneth Paltrow Touts New Diamond-Encrusted Trepanation Drill, Drainage Bucket On Website",0,1,1640955671
3,TheOnion,dwaxe,theonion.com,Artist Crafting Music Box Hopes It Delights At Least One Child In Post-Apocalypse,0,1,1640955669
4,TheOnion,dwaxe,theonion.com,Homeowner Trying To Smoke Out Snakes Accidentally Burns Down House,0,1,1640955668
5,TheOnion,dwaxe,theonion.com,Dictionary.Com Names ‘Allyship’ 2021 Word Of The Year,0,1,1640955667
6,TheOnion,dwaxe,theonion.com,Man Realizes ‘The Texas Chain Saw Massacre’ Actually Pretty Creepy After Rewatching It As Adult,0,1,1640955665
7,TheOnion,dwaxe,theonion.com,Idiotic New Year’s Resolutions You’ll Never Actually Keep,0,1,1640869619
8,TheOnion,dwaxe,theonion.com,New Initiative Decreases Stigma Against Homeless By Making Majority Of People Homeless,0,1,1640869618
9,TheOnion,dwaxe,theonion.com,Italian Dentist Presents Fake Arm For Vaccination To Get Pass,0,1,1640869617
10,TheOnion,dwaxe,theonion.com,Dollar General Opening New Store For Wealthier Shoppers,0,1,1640869615
11,TheOnion,dwaxe,theonion.com,Man Carefully Places Piece Of Paper In Back Pocket To Make Sure It Will Go Through Washing Machine,0,1,1640869614
12,TheOnion,dwaxe,theonion.com,"Woman Disgusted After Finding Out There Over 2,000 Calories In Recommended Daily Intake",0,1,1640869614
13,TheOnion,dwaxe,theonion.com,Signs You’ve Become A Total Wine Snob,0,1,1640783214
14,TheOnion,dwaxe,theonion.com,Disney’s Hall Of Presidents Opens Exhibit Of Historic Shadow Leaders Who Really Ran Country,0,1,1640783213
15,TheOnion,dwaxe,theonion.com,Poll: 43% Of Adults Say They Have Financially Cheated On Their Partner,0,1,1640783213
16,TheOnion,dwaxe,theonion.com,Woman Attempts To Hire Assassin From RentAHitman.com,0,1,1640783212
17,TheOnion,dwaxe,theonion.com,Report: Majority Of Americans Would Support A New War If There Were Elephants Involved,0,1,1640783212
18,TheOnion,dwaxe,theonion.com,Man With Deep Sadness Over Never Finding Someone Who Truly Knows Him Labeled ‘The Crazy Uncle’,0,1,1640783211
19,TheOnion,TheGuvnor247,theonion.com,Study: Climate Change Causing Albatross ‘Divorce’,0,1,1640781939
20,TheOnion,dwaxe,theonion.com,Experts Warn Nation’s Aging Sewer Infrastructure Could Be Just One Huge Turd Away From Collapse,0,1,1640696520
21,TheOnion,dwaxe,theonion.com,Biggest Mistakes All Gun Owners Make,0,1,1640696519
23,TheOnion,dwaxe,theonion.com,Walmart Using Driverless Trucks In Delivery Pilot Program,0,1,1640696517
24,TheOnion,dwaxe,theonion.com,Perverted Clown Mounts Funhouse Mirror On Ceiling Above Bed,0,1,1640696515
25,TheOnion,dwaxe,theonion.com,Homeowner’s Ring Security Alerts Now Just Texting News Stories About Black-On-Black Crime,0,1,1640696513
26,TheOnion,mothershipq,theonion.com,Woman’s Anecdote About Boyfriend Getting Annoyed Undercut By Widespread Knowledge Of His Anger Issues,0,1,1640636199
27,TheOnion,dwaxe,theonion.com,Man In Shower Sets Wet Band-Aid On Tub Edge To Throw Out In Few Months,0,1,1640610116
28,TheOnion,dwaxe,theonion.com,"Hey Gamers, We Know We Can Sometimes Be A Little One-Note About Gaming So If You Ever Want To Talk About Something Else, Like Baking Or Whatever, Just Know We’re Down",0,1,1640610115
29,TheOnion,dwaxe,theonion.com,Oakley Introduces Line Of Sunglasses For Front Of Head,0,1,1640610114
30,TheOnion,dwaxe,theonion.com,Signs You’ve Spent Too Much Time With Your Family Over The Holidays,0,1,1640610113
31,TheOnion,dwaxe,theonion.com,Scientists Create Ultra-Hot Superionic Black Ice,0,1,1640610112
32,TheOnion,dwaxe,theonion.com,Poll: More Americans Not Planning To Have Kids,0,1,1640610110
33,TheOnion,dwaxe,theonion.com,Man’s Natural Instinct To Fear The Unfamiliar Overcome By Promise Of ‘Great Barbecue Taste’,0,1,1640610109
34,TheOnion,Blujeanstraveler,gizmodo.com,"Finnish Man Passes on Paying $22,600 to Replace His Tesla's Battery, Blows Up Car Instead",1,1,1640534141
35,TheOnion,TheGuvnor247,theonion.com,Relatives Gather From Across The Country To Stare Into Screens Together,0,1,1640470965
36,TheOnion,TheGuvnor247,theonion.com,"Ho, Ho, Ho! I Saw You Masturbating!",0,1,1640470883
37,TheOnion,GaryGabagooler,youtube.com,Santa Exposed On Tinder,0,1,1640411077
38,TheOnion,dwaxe,theonion.com,Most Offensive Things You Can Say To Someone Who Doesn’t Celebrate Christmas,0,1,1640351217
39,TheOnion,dwaxe,theonion.com,Study: Grandmothers May Hold Deeper Bond With Grandchildren Than Own Children,0,1,1640351215
40,TheOnion,dwaxe,theonion.com,New Study Suggests Cats May Legitimately Be Psychopaths,0,1,1640351214
41,TheOnion,dwaxe,theonion.com,Parents Spent Too Much On Piano Lessons For Son Not To Play Dumb Little Song Every Time He Comes Home,0,1,1640351213
42,TheOnion,dwaxe,theonion.com,Netflix Exhausts Holiday Movie Lineup With ‘A Very Christmas Scimitar’,0,1,1640351212
43,TheOnion,kremor,theonion.com,Things To Never Say To Someone Who Is Alone For The Holidays,0,1,1640348691
44,TheOnion,dwaxe,theonion.com,"‘Can You Check The Back For 500 Million More Of These Covid Test Kits,’ Says Biden Picking Up Few Things From CVS",0,1,1640287295
45,TheOnion,dwaxe,theonion.com,Woman Annoyed At Mother’s Suggestion To Consider Freezing Her Leftovers,0,1,1640285489
46,TheOnion,dwaxe,theonion.com,What To Say If You’re Not Comfortable Traveling During Covid-19,0,1,1640275010
47,TheOnion,dwaxe,theonion.com,Jelly Belly Releases New Flavors Based On J.K. Rowling’s Other Works,0,1,1640264775
48,TheOnion,dwaxe,theonion.com,Babies Survive Tornado That Carried Them Away In Bathtub,0,1,1640264773
49,TheOnion,dwaxe,theonion.com,Restaurant Chalk Sign Insinuating There Something Naughty About Chili,0,1,1640264772
50,TheOnion,dwaxe,theonion.com,Biden Pledges 500 Million Free Virus Tests To Counter Omicron,0,1,1640210481
51,TheOnion,dwaxe,theonion.com,More Fridge Magnets Forced To Take On Extra Holiday Work Holding Up Christmas Cards,0,1,1640195789
52,TheOnion,TheGuvnor247,theonion.com,Nation’s Next Of Kin Exhausted From Constantly Identifying Bodies,0,1,1640191695
53,TheOnion,dwaxe,theonion.com,Nation Gathers Around Picky Eater To Make Him Try Things He Doesn’t Like,0,1,1640178120
54,TheOnion,dwaxe,theonion.com,Philadelphia Woman Gives Birth On Way To Hospital In Tesla On Autopilot,0,1,1640178109
55,TheOnion,dwaxe,theonion.com,Star High School Quarterback Blissfully Unaware He’ll Be Jets Starter 4 Years From Now,0,1,1640178108
56,TheOnion,dwaxe,theonion.com,Worst Mistakes You Can Make At A Company Holiday Party,0,1,1640178107
57,TheOnion,dwaxe,theonion.com,Manchin Says He Will Not Vote For Build Back Better Act,0,1,1640120829
58,TheOnion,dwaxe,theonion.com,Smattering Of Half-Remembered Facts From Ezra Klein’s Podcast Somehow Fail To Change Conservative Family Member’s Entire Worldview,0,1,1640118343
59,TheOnion,dwaxe,theonion.com,"‘Ooohhh, That Sounds Good!’ Says Woman Overhearing Pharmacy Order Of Person Before Her",0,1,1640116628
60,TheOnion,TrollHumper,theonion.com,Timeline Of Russia-Ukraine Conflict,0,1,1640107153
61,TheOnion,Sanlear,theonion.com,"Police Finally Throw Out Old, Embarrassing Evidence From ’80s",0,1,1640104307
62,TheOnion,aresef,theonion.com,Lawyer Explains That Just Because You Accidentally Kill Santa Doesn't Mean You’re Legally Obligated To Take His Place,0,1,1640102142
63,TheOnion,TheGuvnor247,theonion.com,Our Annual Year: Best Of February,0,1,1640086893
64,TheOnion,HannoPicardVI,theonion.com,Frequent porn searches by state,0,1,1640086137
65,TheOnion,El_Zarco,theonion.com,Report: No One Got Covid And It Was One Hell Of A Party You Missed,0,1,1640058802
66,TheOnion,TheGuvnor247,theonion.com,"‘Look, We’re Matching!’ Cry All 330 Million Americans, Pointing To Leopard Print Sweaters",0,1,1640027996
67,TheOnion,mothershipq,theonion.com,Landlord Informs Tenants He Increasing Endless Economic Anxiety By $100,0,1,1640023767
68,TheOnion,TheGuvnor247,theonion.com,Our Annual Year: Best Of January,0,1,1640000343
69,TheOnion,TheGuvnor247,theonion.com,Robotic Fish Frighten Aquatic Pests To Death,0,1,1640000321
70,TheOnion,mothershipq,theonion.com,Man Living In Most Affluent Country In World History Has Nerve To Complain About Being Homeless,0,1,1639857094
71,TheOnion,TheGuvnor247,theonion.com,"A Pest Control Company Bought A Half-Page Ad On Our Cover, And We’re In No Position To Turn It Down",0,1,1639833883
72,TheOnion,TheGuvnor247,theonion.com,"New Marvel Trailer Reveals That Spider-Man Up To His Wild, Web-Slinging Antics Yet Again",0,1,1639833713
73,TheOnion,Sanlear,theonion.com,"Games Bring People Together: We Don’t Have Any Specific Story Right Now That Proves This Point, But We Wanted To Express The General Sentiment",0,1,1639826019
74,TheOnion,stevo3001,theonion.com,Things No One Tells You Happen When You Fly First Class,0,1,1639770211
75,TheOnion,Sanlear,theonion.com,"‘We’re Still Gonna Go To Vegas, Buddy,’ Says U.S. Soldier Holding Dying Drone In His Arms",0,1,1639758246
76,TheOnion,TheGuvnor247,theonion.com,Critics Warn Biden’s Plan To Remove Lead Pipes Would Put Millions Of Potential Murder Weapons In Circulation,0,1,1639739935
77,TheOnion,TheGuvnor247,theonion.com,"AmazonSmile Donated More Than $40,000 To Anti-Vaccine Groups In 2020",0,1,1639739868
78,TheOnion,SportsDude012,theonion.com,Bruce Springsteen Relishes Finally Telling Off Foreman After Catalog Sells For $500 Million,0,1,1639702889
79,TheOnion,El_Zarco,theonion.com,TV Show Makes Up For Lack Of Diverse Characters With Guy Who Says ‘Abuelita’ A Lot,0,1,1639694247
80,TheOnion,aresef,theonion.com,Somewhat Athletic Couple Gives Birth To Potential Division III Lacrosse Player,0,1,1639683434
81,TheOnion,aresef,theonion.com,"Tim Duncan Claims He Has Helped Over 20,000 Women With Sensible Retirement Planning",0,1,1639671800
82,TheOnion,TheGuvnor247,theonion.com,U.S. Facing Santa Shortage,0,1,1639656738
83,TheOnion,TheGuvnor247,theonion.com,"Reddit, TikTok Users Spam Kellogg With Fake Applications To Help Striking Workers",0,1,1639656545
84,TheOnion,na5h,deccanherald.com,Students say Indian Institute of Science removing fans to prevent suicides,1,1,1639646544
85,TheOnion,Major-Eggplant-9045,i.redd.it,Look at The Onion,1,1,1639613288
86,TheOnion,bwint1,theonion.com,Pfizer Granted Emergency Use For Pill That Kills You Before Covid Can,0,1,1639604507
87,TheOnion,mothershipq,theonion.com,Chicken-Shit Asteroid Veers Away At Last Minute,0,1,1639542828
88,TheOnion,ThatsMyPhoenix,theonion.com,Amazon Fires Employees Who Didn’t Clock Out After Getting Buried In Rubble,0,1,1639515047
90,TheOnion,TheGuvnor247,theonion.com,Political Analysts Say GOP Could Take House If A Few Key Assassinations Break Their Way,0,1,1639487981
91,TheOnion,TheGuvnor247,theonion.com,Gynecologist Politely Tells Patient That She Forgot To Take Dildo Out,0,1,1639487916
92,TheOnion,mothershipq,theonion.com,Words Can’t Describe What Man With Limited Vocabulary Feeling Right Now,0,1,1639456038
93,TheOnion,mybustlinghedgerow,youtu.be,Anonymous Hero Donates Hospital 200 Human Kidneys,0,1,1639416091
94,TheOnion,TheGuvnor247,theonion.com,"TV Network Refuses To Air ‘Miracle On 34th Street’ For Outdated Depictions Of Hope, Joy",0,1,1639404268
95,TheOnion,ThatsMyPhoenix,theonion.com,Army Receives 15-Yard Penalty For Drone-Striking The Kicker,0,1,1639255284
96,TheOnion,Ogmills92,youtu.be,The Taliban are trying to Adapt to western ideals by appealing to feminism and trans rights,0,1,1639242218
97,TheOnion,TheGuvnor247,theonion.com,"‘And What Do You Want Me To Do, Brush Every Night?’ Snaps Jen Psaki At Dentist Suggesting She Could Improve Oral Hygiene",0,1,1639241099
98,TheOnion,TheGuvnor247,theonion.com,"Mrs. Fields CEO Under Fire For Laying Off 1,000 Employees Via Cookie Cake",0,1,1639241070
99,TheOnion,El_Zarco,theonion.com,End Of Man’s Usefulness To Society Celebrated With Sheet Cake,0,1,1639190215
100,TheOnion,mothershipq,theonion.com,No One At Laser Tag Prepared For How Hard Dad Was Going To Bring It,0,1,1639185563
101,TheOnion,TheGuvnor247,theonion.com,New Zillow Feature Lets Users Track Happy Lives Of People Who Outbid Them For Dream House,0,1,1639175281
102,TheOnion,ParticularScratch551,theonion.com,Serena Williams Stripped Of Titles After It Revealed She’s Been Playing With A Racket In Each Hand This Whole Time. A Twitter reply in first comment.,0,1,1639151636
104,TheOnion,El_Zarco,theonion.com,Bad News Gamers: It Appears Now Is Not The Time For Idle Merriment,0,1,1639126439
105,TheOnion,miguelopop,i.redd.it,I read this in silence,1,1,1639098824
106,TheOnion,aresef,theonion.com,‘Sesame Street’ Introduces First Enigmatic Muppet Who Has Yet To Reveal True Intentions,0,1,1639074754
107,TheOnion,mothershipq,theonion.com,Federal Witness Protection Program Criticized For Failing To Create Believable Female Identities,0,1,1639070270
108,TheOnion,TheGuvnor247,theonion.com,Kim Jong-Un Eagerly Waiting For Inner Circle To Get Big Enough So He Can Start Executing People Again,1,1,1639051279
109,TheOnion,TheGuvnor247,theonion.com,"Damian Lillard Gives Trailblazers List Of 12,482 Preferred Trade Destinations",0,1,1639051207
110,TheOnion,aresef,theonion.com,Rock &amp; Roll Hall Of Fame Displays 43 Bullets Ringo Starr Took For John Lennon Before Mark David Chapman Caught Him Off Guard,0,7,1638991326
111,TheOnion,TheGuvnor247,theonion.com,"‘You Know, If I Were You, I’d Go After Finland,’ Says Biden Trying To Dissuade Putin From Invading Ukraine",5,79,1638988534
112,TheOnion,mothershipq,theonion.com,Teary-Eyed Prince Andrew Reveals Ghislaine Maxwell Groomed Him To Have Sex With Dozens Of Teens,15,701,1638984775
113,TheOnion,TheGuvnor247,theonion.com,Nonprofit Cofounders Have Screaming Match Over Whether Mission To Ignite Change Or Spark Community Impact,2,222,1638964933
114,TheOnion,Tenma1,theonion.com,Signs The Spark Has Definitely Left Your Relationship,0,12,1638922330
115,TheOnion,mothershipq,theonion.com,"Study Finds 87% Of Home Invasions Foiled After Homeowner Nervously Mutters, ‘Who’s There?’",6,958,1638910656
116,TheOnion,Ogi-milo,youtu.be,God has fallen off the wagon,0,0,1638894517
117,TheOnion,TheGuvnor247,theonion.com,Verizon Customer Just Wants Acknowledgment He’s Been Treated Worse Than Any Other Person In Company’s History,0,74,1638889180
118,TheOnion,TheGuvnor247,theonion.com,Australia Drunkest Country In World,0,4,1638889046
119,TheOnion,manthatisnice,newsweek.com,"The Sydney Opera House in Australia has renewed a contract that will pay AU$376,380 ($265,515 USD) for a team of dogs over the next two years to chase seagulls away from the iconic landmark. The pooches are from a company called Mad Dogs and Englishmen.",2,1,1638887698
120,TheOnion,Sanlear,theonion.com,‘Information About Your Upcoming Flight’ Email Informs Passenger That Airplane Will Go In Sky,1,436,1638876435
121,TheOnion,TwilitSky,theonion.com,Office Workers Terrorized By Unhinged Ex-Employee Dropping In To Say Hi,1,1,1638848482
122,TheOnion,Ogmills92,youtube.com,Theologists find out God was actually an Asshole,3,1,1638844044
123,TheOnion,satr0145,theonion.com,Abortion Laws In Every State,1,1,1638831019
124,TheOnion,Ogmills92,youtube.com,if global warming is real... how did he get a snowball?,2,1,1638817043
125,TheOnion,TheGuvnor247,theonion.com,Aging Stalker Not Sure How Many Good Years Of Crouching In Bushes He Has Left,5,1,1638815965
126,TheOnion,Ogi-milo,youtu.be,New documentary shows that early humans had no survival skills and survived purely based on blind luck,3,1,1638805367
127,TheOnion,tousie,youtube.com,The Brutal Two-Year Reign Of Bahrain By Our Undercover EDGE Reporter (VICE Parody),0,1,1638773297
128,TheOnion,aresef,theonion.com,Seahawks Offensive Lineman Confused By Complicated Scheme Requiring Him To Make Block,0,1,1638745971
129,TheOnion,TheGuvnor247,theonion.com,Bounty Scientists Scream As Experimental Paper Towel Absorbs Entire Lab,13,1,1638731239
130,TheOnion,TheGuvnor247,theonion.com,Centrist NFL Fan Spends Sunday Rooting For Line Of Scrimmage,3,1,1638731213
131,TheOnion,ich_bin_groot_,youtu.be,The recent Michigan school shooting is really similar to this video.,2,1,1638565841
132,TheOnion,TheGuvnor247,theonion.com,"‘It Would Be So Easy,’ Think 79% Of People Holding Ladders For Loved Ones Putting Up Christmas Lights",0,1,1638539735
133,TheOnion,TheGuvnor247,theonion.com,Woman Brings Clothes To Dressing Room To See What They’ll Look Like Scattered Across Floor,1,1,1638539664
134,TheOnion,Ogmills92,youtube.com,The Taliban attempt to improve their public relations,5,1,1638539644
135,TheOnion,Sanlear,theonion.com,Prison Acknowledges Security Lapse That Led To Ghislaine Maxwell Spending Night In Noose Room,2,1,1638530665
136,TheOnion,ThatsMyPhoenix,theonion.com,Starbucks Dangles Tied-Up Union Organizers Over Vat Of Steamed Milk,0,1,1638481580
137,TheOnion,TheGuvnor247,theonion.com,Dr. Oz Endorses Benefits Of U.S. Senate Despite Proven Deadly Side Effects,4,1,1638471805
138,TheOnion,TheGuvnor247,theonion.com,"Hospital Adds $20,000 Scan That Informs Patient Whether They Have Feet",6,1,1638471716
139,TheOnion,aresef,theonion.com,Brian Kelly Admits He Never Actually Believed In God,0,1,1638387421
140,TheOnion,aresef,theonion.com,Hertz Hopeful New Football Player Spokesperson Doesn’t Murder Two People This Time Around,1,1,1638387408
141,TheOnion,aresef,theonion.com,CNN Announces Andrew Cuomo Will Take Over Brother’s Hosting Duties Until Replacement Found,1,1,1638387372
143,TheOnion,TheGuvnor247,theonion.com,Man Just 3 More Failed Goals Away From Becoming Crypto Guy,16,1,1638365603
144,TheOnion,Horror_East7215,youtube.com,The Taliban try to understand Trans &amp; Women rights,1,0,1638325452
145,TheOnion,duckdae,google.com,"‘No Way To Prevent This,’ Says Only Nation Where This Regularly Happens",2,1,1638304587
147,TheOnion,CarbonSteelSA,i.redd.it,Hmmmmm… I knew there was a reason for that name.,2,1,1638301331
148,TheOnion,aresef,theonion.com,New Beatles Doc Gives Man Greater Appreciation For How Long 8 Hours Feels,0,1,1638217536
149,TheOnion,aresef,theonion.com,Self-Important Asshole Making Big Show About Leaving Twitter,2,1,1638217493
150,TheOnion,mothershipq,theonion.com,Baker Mayfield Struggling To Tune Out Booing Progressive Fans On Commercial Set,0,1,1638209711
151,TheOnion,aresef,theonion.com,Lions Fan Praying Players Start Protesting Police Brutality Or Something So He Can Stop Watching,14,1,1638202325
152,TheOnion,Sanlear,theonion.com,Boris Johnson Unsure How U.K. One Country But Also Four,8,1,1638197858
153,TheOnion,TheGuvnor247,theonion.com,Man With No Friends Plans Makeshift Friendsgiving With Family Members Instead,2,1,1638139269
154,TheOnion,Ogmills92,youtu.be,McDonalds Mayhem: Fast food deaths on the rise (source:Japan),0,1,1638120974
155,TheOnion,Ogmills92,youtu.be,Taliban trying to improve their PR,2,1,1638119965
156,TheOnion,TheGuvnor247,theonion.com,"Serta Recalls 200,000 Mercy Killing Pillows",0,1,1638026373
157,TheOnion,Sanlear,theonion.com,Nation Nearly Strings Together 3 Good Days In Row,6,1,1638015207
158,TheOnion,theycallmeLLC,boston.com,"New Hampshire, Vermont asked to test deer for COVID-19",2,1,1638004628
159,TheOnion,theycallmeLLC,original.newsbreak.com,Albatross divorce rates going up due to climate change,2,1,1637999936
160,TheOnion,iCrackBaby,imgur.com,“Nottheonion” mods totally aren’t snowflake toddlers on a power trip.,2,1,1637936387
161,TheOnion,iCrackBaby,i.redd.it,“Nottheonion” mods are totally not pent up butt hurt little children who are on power trips 😂,2,1,1637936279
162,TheOnion,TheGuvnor247,theonion.com,Amazon To Let Warehouse Employees’ Families Work Thanksgiving Shifts Too,6,1,1637932801
163,TheOnion,TheGuvnor247,theonion.com,Friend Crashing In Guest Room Hopes He Can Return Favor When Host’s Marriage Implodes,5,1,1637932731
164,TheOnion,mothershipq,theonion.com,Overwhelmed Arizona Hospitals Turning Away Patients Who Need Cactus Spines Plucked From Bare Asses,3,1,1637777387
165,TheOnion,dwaxe,youtube.com,The Onion Reviews 'Licorice Pizza',0,1,1637772759
167,TheOnion,TheGuvnor247,theonion.com,World Chess Championship Forced To Use Salt Shaker After Losing Bishop,10,1,1637763622
168,TheOnion,TheGuvnor247,theonion.com,Family Saving Time This Thanksgiving By Making Oak Dining Table Day Before,2,1,1637763595
169,TheOnion,ESERWELSH,youtu.be,Uhhhhh... file corrupted? I dont remember it looking like that,0,1,1637734259
170,TheOnion,Ogmills92,youtu.be,Trans rights.. as understood by the Taliban 😂,2,1,1637717101
171,TheOnion,heavyLobster,theonion.com,Janet Yellen Announces Americans Can Use Promo Code ‘THANKS’ For 10% Off All U.S. Goods And Services,0,1,1637707159
172,TheOnion,NasoLittle,i.redd.it,Adele single handedly gets YouTube to remove the dislike button,2,1,1637702682
173,TheOnion,TheGuvnor247,theonion.com,Fish Way Too High On OxyContin Runoff To Give A Shit About Species’ Inevitable Extinction,2,1,1637686959
174,TheOnion,Sanlear,theonion.com,"Ultimate Betrayal: It Has Come To Our Attention That There Is A Non-Gamer Within The Ranks Of Our Readership, And We Will Find You",7,1,1637685525
175,TheOnion,aresef,theonion.com,NFL Study Finds Concussion Symptoms Completely Disappear If You’ve Had An Even Number Of Concussions,15,1,1637682500
176,TheOnion,Ogmills92,youtube.com,Extremists misunderstand feminism and trans rights,0,1,1637673039
177,TheOnion,TheGuvnor247,theonion.com,Tucker Carlson Late To Work After Being Murdered By Hordes Of Violent Minorities Again,3,1,1637614624
178,TheOnion,TheGuvnor247,theonion.com,Kyle Rittenhouse Acquitted Of All Charges In Kenosha Shootings,2,1,1637614601
179,TheOnion,aresef,theonion.com,Maryland Mayor Charged With 50 Counts Of Distributing Revenge Porn,3,1,1637602949
180,TheOnion,mothershipq,theonion.com,Walgreens Customer Really Pushing It With Amount Of Non-Medical Stuff She’s Bringing To Pharmacy Counter,14,1,1637598630
181,TheOnion,ThatsMyPhoenix,theonion.com,Kyle Rittenhouse Sentenced To 45 Years Of CPAC Appearances,328,1,1637346197
182,TheOnion,ThatsMyPhoenix,theonion.com,"‘Order, Order,’ Shouts Judge In Kyle Rittenhouse Case While Shooting AR-15 At Ceiling",0,1,1637346078
183,TheOnion,rcc12697,theonion.com,Scottie Pippen Boasts He Would’ve Given Much Better Performance Than Jordan In ‘Space Jam’,0,1,1637276306
184,TheOnion,aresef,theonion.com,House Removes Paul Gosar From Anime And Manga Committee,0,1,1637266599
185,TheOnion,mothershipq,theonion.com,Texas Bans Access To Tall Staircases In Case Women With Unwanted Pregnancies Get Any Ideas,21,1,1637263579
186,TheOnion,TheGuvnor247,theonion.com,"‘I Said Do It,’ Barks Cheesecake Factory CEO As Hesitant Chefs Hold Whole Fried Chicken Over Bowl Of Chocolate Pudding",0,1,1637260404
187,TheOnion,TheGuvnor247,theonion.com,Fannie Mae Issues Billions Of Mortgage-Backed NFTs,0,1,1637260363
188,TheOnion,ThatsMyPhoenix,theonion.com,Disney Acquires All Of America’s Children For $52 Billion,18,1,1637199374
189,TheOnion,mothershipq,theonion.com,TikTok Helps Kidnapper Find Teen,1,1,1637182030
190,TheOnion,ThatsMyPhoenix,theonion.com,Desperate Black Friday Customers Line Up Outside Cargo Ship Stalled In Pacific Ocean,0,1,1637179440
191,TheOnion,Sanlear,theonion.com,Americans Assure Pentagon They Don’t Care Enough To Make Covering Up Drone Strikes Worthwhile,0,1,1637179221
192,TheOnion,kremor,theonion.com,Higher Prices May Force Americans To Eat Reasonable Portions On Thanksgiving,10,1,1637160440
193,TheOnion,Imnotveryfunatpartys,theonion.com,Seal Lying in Sunbeam Could Be Depressed And You'd Never Know,0,1,1637108667
194,TheOnion,aresef,theonion.com,Cut It Out: You Can Criticize King K. Rool’s Actions Without Resorting To Insulting His Weight,1,1,1637099142
195,TheOnion,Late-Special,theonion.com,NFT Investor Reminds Skeptics Everything Else In World Stupid And Meaningless Too,8,1,1637086046
196,TheOnion,Th3dynospectrum,theonion.com,Comments That Can Actually Get You Fired From Work Immediately,0,1,1637063089
197,TheOnion,TheGuvnor247,theonion.com,Bounty CEO Rebrands Business As Metaverse Of Napkins,0,1,1637062344
198,TheOnion,TheGuvnor247,theonion.com,Zoo Assures Public Escaped Leopard Will Kill Them Quickly,0,1,1637062182
199,TheOnion,aresef,theonion.com,ESPN ManningCast Devolves Into Deeply Uncomfortable Argument About About Putting Father In Nursing Home,1,1,1637028589
200,TheOnion,Sanlear,theonion.com,White House Urges Kamala Harris To Sit At Computer All Day In Case Emails Come Through,1,1,1637026338
201,TheOnion,SchpartyOn,theonion.com,Patrick Leahy Announces He Won’t Seek Reelection To Make Room For Next Generation Of 70-Year-Olds,0,1,1637022760
202,TheOnion,SchpartyOn,theonion.com,Self-Conscious Referee Waits Until Other Official Puts Arms Up After Field Goal,0,1,1637022704
203,TheOnion,TheGuvnor247,theonion.com,Park Ranger Slips Fat Fish To Bear Before Gesturing Towards Littering Family He Wants Mauled,2,1,1637018018
204,TheOnion,heavyLobster,theonion.com,Aaron Rodgers Balloons To 450 Pounds After Single Inactive Week In Wisconsin,2,1,1636861719
205,TheOnion,TheGuvnor247,theonion.com,Kevin Durant Struggling To Shoot While Wearing 58 Different Jersey Variations,0,1,1636848880
206,TheOnion,Potential-Wave-6714,freestraighttalk.net,Free Straight Talk Reload Code,2,1,1636826021
209,TheOnion,BigDapRamirez,m.youtube.com,Prison economy spirals out of control,1,1,1636744881
210,TheOnion,Sanlear,theonion.com,Vatican Museum Displays Massive Skeletons Of Prehistoric Saints,1,1,1636734898
