,subreddit,author,domain,title,num_comments,score,timestamp
1064,TheOnion,Brosie-Odonnel,theonion.com,Irish-Americans Gear Up For 'The Reinforcin' O' The Stereotypes',0,1,1615996419
1065,TheOnion,dwaxe,ogn.theonion.com,Loving Support: This Man Brought His Xbox To The Delivery Room So His Wife Could Watch Him Play ‘Assassin’s Creed’ While In Labor,4,1,1615982708
1066,TheOnion,thebelsnickle1991,theonion.com,Saints Quarterback Drew Brees Retires After 20 Seasons,0,1,1615920778
1067,TheOnion,PoetryDefendant,theonion.com,"‘It’s Good To Practice Some Self Care,’ Says Man Kicking Back And Letting Last Chance At Happiness And Success Slip Away",1,1,1615919373
1068,TheOnion,PoetryDefendant,theonion.com,Zookeepers Confirm Pandas Not Mating Because They’re Scared Of Messing Up Friendship,0,1,1615919335
1069,TheOnion,aresef,theonion.com,Buckingham Palace Confirms Prince Phillip Released From Morgue In Good Health This Morning,2,1,1615915827
1070,TheOnion,aresef,theonion.com,Bible Scholars Say Early Mistranslation Distorted Story Of Jesus Crucifying The Romans,0,1,1615915807
1071,TheOnion,aresef,theonion.com,The 36 Members Of BTS,1,1,1615915782
1072,TheOnion,PoetryDefendant,theonion.com,Florida Attempts To Increase Vaccinations By Leaving Loose Syringes Around Beaches,26,1,1615903331
1073,TheOnion,Rhodesy97,youtu.be,(Parody) Ellen left STUNNED by Incredible Magic Trick,0,1,1615886868
1074,TheOnion,sanctaphrax,theonion.com,[2008] Recession-Plagued Nation Demands New Bubble To Invest In,6,1,1615864756
1075,TheOnion,dwaxe,entertainment.theonion.com,The 63rd Annual Grammy Awards: A Recap,0,1,1615812964
1076,TheOnion,mybustlinghedgerow,theonion.com,Biden Announces Americans Will Be Able To Do What They Did At Christmas By July 4,0,1,1615772761
1077,TheOnion,mybustlinghedgerow,local.theonion.com,Mom Moves In For Kill After Spotting Child’s Shirt Tag Sticking Out,0,1,1615772644
1078,TheOnion,dwaxe,entertainment.theonion.com,Sighing Janitor Once Again Called In To Mop Up Puddle Of Megan Thee Stallion Pussy Juice,10,1,1615766773
1079,TheOnion,dwaxe,entertainment.theonion.com,Taylor Swift Forced To Perform Songs In Public Domain At Grammys After Losing Rights To Albums Again,2,1,1615766772
1080,TheOnion,dwaxe,entertainment.theonion.com,BTS Thanks Horrifyingly Exploitative System That Got Them Where They Are Today,1,1,1615766771
1081,TheOnion,dwaxe,entertainment.theonion.com,Recording Academy Reminds Nominees You Can Crank Little Arm On Statue To Hear Supertramp’s ‘Breakfast In America’,0,1,1615766770
1082,TheOnion,zhepsh,youtu.be,Harry and Meghan fire their gardener,2,1,1615745219
1083,TheOnion,deathskull379,theonion.com,Experts Warn Uptick In Celebrity Boxing A Sign Nation Still Not Ready To Process Last Four Years,8,2,1615659883
1084,TheOnion,MotherHolle,youtube.com,Live From Congress - The Skull Fucking Bill Of 2007,0,2,1615659876
1085,TheOnion,Late-Special,theonion.com,Senator Can’t Believe It’s Already Been A Year Since He Boosted Stock Portfolio With Classified Coronavirus Information,5,2,1615595802
1086,TheOnion,dwaxe,ogn.theonion.com,"Hey Gamers, Our Source Inside Nintendo Disappeared And We Just Received His Gaming Hand In A Box So Don’t Expect Any News For A While",10,1,1615576025
1087,TheOnion,xfidp,standard.co.uk,Green Party peer calls for 6pm curfew for men as “discrimination of all kinds would be lessened”.,2,1,1615547951
1088,TheOnion,dwaxe,entertainment.theonion.com,The Onion’s 2021 Grammys Predictions,6,1,1615480901
1089,TheOnion,visuka2001,truthout.org,Pro-life-texas-lawmaker-introduces-bill-imposing-death-penalty-for-abortion,2,1,1615453096
1090,TheOnion,AttorneyAggravating7,i.redd.it,good thing the pet store has the same baggies for orca sales,2,1,1615420766
1091,TheOnion,Aisuyu24,theautomotiveroom.com,Nissan recalls 800 000 Sentras over brake lights - Car News. Car Reviews,2,1,1615407047
1092,TheOnion,Aisuyu24,theautomotiveroom.com,"Nissan recalls 800,000 Sentras over brake lights, as if things couldn't get any worse.",2,1,1615407012
1093,TheOnion,TitaniumDragon,local.theonion.com,‘Taco Bell For Life’ Winner Chooses To Receive Winnings As Single Lump Meal,20,1,1615393835
1094,TheOnion,dwaxe,ogn.theonion.com,"Scam Alert: This Guy Thought He Was Buying An Authentic PS5 On eBay, But Received Mark Rothko’s ‘1957 # 20’ Instead",0,1,1615392135
1095,TheOnion,dwaxe,politics.theonion.com,Key Takeaways From The Capitol Security Review,0,1,1615391676
1096,TheOnion,Late-Special,theonion.com,Fugitive Caught Coming Out Of Hiding To Buy ‘Call Of Duty’,5,1,1615385641
1098,TheOnion,bwint1,theonion.com,CDC Launches Ad Campaign Featuring Racist Mascot In Effort To Get More Conservatives Vaccinated,5,1,1615329466
1099,TheOnion,a-horse-has-no-name,theonion.com,Papa John’s Removes N-Word From Menus,29,1,1615309971
1100,TheOnion,Ellikichi,entertainment.theonion.com,Real-Life Pepe Le Pew Rapes Cat,1,1,1615306574
1101,TheOnion,Puff_Piece,rarible.com,You'll never solve the problem if you're afraid to use the real name,2,1,1615295750
1102,TheOnion,dwaxe,entertainment.theonion.com,Celebrities Discuss Their Most Difficult Acting Roles,1,1,1615294904
1103,TheOnion,GuyOnTheStreet,theonion.com,Naïve Detective Suspects Fair Play,0,1,1615266688
1104,TheOnion,ThatsMyPhoenix,theonion.com,"Meghan Markle Reveals Royals Worried Her Son Wouldn’t Have Family’s Sickly, Rancid Skin",19,1,1615241884
1105,TheOnion,dwaxe,politics.theonion.com,Ethics Report Shows Elaine Chao Ran Personal Errands With Transportation Department’s Private Zorb,2,1,1615219451
1106,TheOnion,dwaxe,entertainment.theonion.com,Kings Of Leon To Release New Album As NFT After Vinyl Physically Rejects Attempted Pressing,0,3,1614891097
1107,TheOnion,WorstMedivhKR,theonion.com,New Military Diversity Initiative Aims To Make Leadership Look More Like Countries They Invade,1,10,1614887130
1108,TheOnion,[deleted],twitter.com,Bugs Bunny Explains How LeBron Helped Him Get Sober For Role In ‘Space Jam’ Sequel,1,1,1614886384
1109,TheOnion,dwaxe,politics.theonion.com,Congress Cancels Thursday Session After Authorities Warn Of Looming Plot To Pass Stimulus Bill,0,24,1614880743
1110,TheOnion,ThatsMyPhoenix,theonion.com,Covid Announces Plan To Move Operations To Texas Full-Time To Escape Burdensome Regulations,18,1433,1614877490
1111,TheOnion,nsfw_celbs,freeskins.com,"Yo, get your free skin with code ""free100cc""",2,1,1614874119
1112,TheOnion,[deleted],reddit.com,Edmonton based Instagram account gets people to believe The Onion is a legit news source 🤦🏻‍♂️,2,1,1614814152
1113,TheOnion,ThatsMyPhoenix,theonion.com,New Texas Law Requires All Masks Have Word ‘Pussy’ Written Across Front,0,42,1614806332
1114,TheOnion,ThatsMyPhoenix,theonion.com,Texas Governor Announces State’s Morgues Now Allowed To Operate At 100% Capacity,26,1398,1614794792
1115,TheOnion,KoRayven,youtube.com,Obama Issues Presidential Pardon To Get Biden Out Of Jail For Third Time This Year,22,378,1614754740
1116,TheOnion,dwaxe,ogn.theonion.com,"Wow: You Can Actually Just Press ‘L3’ To Talk To The Enemies In ‘Demon’s Souls,’ And It Turns Out They’re Really Nice",2,1,1614702440
1117,TheOnion,dwaxe,politics.theonion.com,World Leaders Pledge To Cut Emissions By As Much As They Can Realistically Back Out Of,10,1,1614701978
1118,TheOnion,basementtribune,chng.it,Sign my petition to get The Onion to bring back their podcast The Topical!,1,1,1614478988
1119,TheOnion,kcgarbin,carelyst.com,"U.S. diplomats forced by China to undergo anal swab testing for Covid-19 after Biden raised ""fundamental concerns"" about Beijing's ""coercive and unfair economic practices and human rights abuses in Xinjiang."" : worldnews - Carelyst",1,1,1614429223
1120,TheOnion,strangehitman22,local.theonion.com,Democrat Reassures Friend This One Of The Good Syrian Airstrikes,12,106,1614397546
1121,TheOnion,dwaxe,politics.theonion.com,Parliamentarian Cuts Minimum Wage From Stimulus Due To Obscure Rule Requiring Poor Citizens To Needlessly Suffer,24,852,1614372250
1122,TheOnion,dwaxe,politics.theonion.com,Biden Comforts Families Of Syrian Airstrike Victims With Eloquent Speech On Living With Heartbreaking Loss,2,21,1614369861
1123,TheOnion,dwaxe,politics.theonion.com,Goals Of Biden Administration Reviewing U.S. Supply Chains,22,245,1614352483
1124,TheOnion,Gladamas,youtu.be,New Premium Uber Service Lets Users Commandeer Any Car,2,48,1614305589
1125,TheOnion,strangehitman22,theonion.com,Biden Unveils Cool Teen Migrant Detainment Center Where Youths Can Hang Out And Never Leave,0,30,1614291617
1126,TheOnion,dwaxe,politics.theonion.com,Florida GOP Introduces Ballotless Voting In Disenfranchised Communities,18,674,1614281051
1127,TheOnion,dwaxe,politics.theonion.com,"Joe Manchin Claims West Virginians Too Deficient In Character, Grit To Deserve $15 Minimum Wage",51,830,1614191077
1128,TheOnion,dwaxe,entertainment.theonion.com,Career Timeline Of Daft Punk,0,11,1614189699
1129,TheOnion,MarstheSchoolgirl,i.redd.it,"Thomas Bangalter of Daft Punk passed away peacefully at age 46. Coming two days after the duo officially split up, he fought a courageous battle proving that all forms of life can't last forever. ✨ 🖤",2,1,1614152073
1131,TheOnion,dwaxe,politics.theonion.com,Mitch McConnell Presses Merrick Garland About Legal Philosophy On Vengeance,2,52,1614111865
1132,TheOnion,dwaxe,ogn.theonion.com,Gaming Win: This Pro Gamer Did Something Terrible And Everyone Is Sweeping It Under The Rug Like He’s A Real Celebrity,18,944,1614111724
1133,TheOnion,El_Pinguino,politics.theonion.com,Millions Without Power Following Election [Classic],0,8,1614057136
1134,TheOnion,dwaxe,politics.theonion.com,"Trump Worried Biden Will Take Credit For 500,000 Covid Deaths He Made Possible",4,2,1614021258
1135,TheOnion,Beanz122,theonion.com,"Balloons, Confetti Fall Onto Grieving Family As Grandmother Becomes 500,000th Covid Death",17,1,1614008904
1136,TheOnion,Loisdenominator,montreal.ctvnews.ca,Quebec dairy board to examine why Canada's butter is suddenly mysteriously harder,2,1,1614000081
1137,TheOnion,TitaniumDragon,theonion.com,Myanmar Military Seizes Power In Coup,4,1,1613923071
1138,TheOnion,StretchProfessional1,theonion.com,What happened to the opinion section? The last one posted was over a month ago.,12,1,1613888069
1139,TheOnion,grggsmth,i.redd.it,An elderly gentleman proudly posing with one of his biggest onions.,2,1,1613764613
1140,TheOnion,dwaxe,politics.theonion.com,"‘Get Me On The First Flight Outta Here’ Says John Cornyn In Hoodie, Sunglasses Banging On Bahamas Airport Desk",0,1,1613761753
1141,TheOnion,aresef,sports.theonion.com,U.S. Broadcast Of Pivotal Chelsea-Manchester United Match To Stream Exclusively On Best Buy Display TVs,0,1,1613760859
1142,TheOnion,itstheyear3030,reddit.com,Top 3 .onion websites from the depths of the dark web,2,1,1613760505
1143,TheOnion,dwaxe,politics.theonion.com,Cuomo Tells Journalists There’s A Few More Deaths That Won’t Be Reported If They Keep Asking Questions,0,1,1613758780
1144,TheOnion,dwaxe,politics.theonion.com,Ted Cruz Celebrates Fulfilling Campaign Promise After Successfully Deporting 2 Hispanic Children,4,1,1613754863
1145,TheOnion,aresef,local.theonion.com,Bridesmaid Ruins Entire Universal Studios Toon Lagoon Bachelorette Party By Hooking Up With Dudley Do-Right,0,1,1613750748
1146,TheOnion,aresef,theonion.com,"‘The Penis Is The Male Reproductive Organ,’ Says Teacher To 5th-Grade Class That Has Already Watched Hundreds Of Hours Of Hardcore Pornography",41,1,1613750727
1147,TheOnion,ThatsMyPhoenix,theonion.com,Facebook Takes Down All Posts Spreading Misinformation About Fictional Nation Of ‘Australia’,18,1,1613702131
1148,TheOnion,G_Dawg630,i.redd.it,Man stabbed to death with a block of extra sharp cheddar cheese. “I didn’t know sharp cheddar was actually that sharp” one witness stated.,2,1,1613701264
1149,TheOnion,latina109,http,I am mistress Latina I am looking for a obidient and trustworthy sissy slut 24/7 in the bdsm lifestyle interested massage me on:kik: veria2,2,1,1613697992
1151,TheOnion,aresef,local.theonion.com,Maine Residents Placed Under Boil Lobster Advisory,0,1,1613685219
1152,TheOnion,aresef,theonion.com,Studio Ghibli Theme Park Opening Delayed After Construction Site Overrun With Curious Forest Sprites,2,1,1613685165
1153,TheOnion,dwaxe,ogn.theonion.com,We’ve Seen Enough: OGN Is Officially Calling The State Of New Hampshire For Gamers,6,1,1613657225
1154,TheOnion,Yayabynx,eyeofzatara.com,Sony Announces PS5 Scalper's Edition: Sold Out in 5 Minutes,2,1,1613616222
1155,TheOnion,JuDGe3690,theonion.com,Doctor Assures Limbaugh Family It Normal For Body To Continue Ranting About Welfare Queens Hours After Death,17,1,1613603598
1156,TheOnion,aresef,theonion.com,"Newsmax Host Falsely Claims 1 Person Died, 20 People Born At Capitol Riots",0,1,1613590656
1157,TheOnion,dwaxe,politics.theonion.com,"‘Truly An Honor To Receive This Gift From The Black Community,’ Says Trump Graciously Accepting NAACP Lawsuit",2,1,1613510679
1158,TheOnion,BestRexxarNA,local.theonion.com,Something About The Way Society Was Exposed As Complete Illusion Over Past Year Really Getting Man Down Today,2,1,1613458335
1159,TheOnion,CeramicLicker,theonion.com,U.S. Mint Introduces New Seven-Cent Coin To Bolster Citizens’ Math Skills,0,1,1613430320
1161,TheOnion,trinkibenda,youtube.com,leaked footage of trump and melania,0,1,1613420402
1162,TheOnion,bwint1,theonion.com,Police Union Honors Law Enforcement Officers Injured Carrying Out Capitol Attack,18,1,1613410379
1163,TheOnion,kooljool,bin.disroot.org,add ur DW links in here,2,1,1613279011
1164,TheOnion,fangstarfang,theonion.com,OSHA Announces Revamped Forklift Certification Will Feature Halfpipe Portion,0,1,1613271605
1165,TheOnion,fangstarfang,theonion.com,"‘We Must Act Now To Save Our Civilization,’ Says Melting King Of Glacieria During U.N. Address",7,1,1613262106
1166,TheOnion,Tom_Hanks_Bot,i.redd.it,Trump and friends celebrate acquittal,2,1,1613253901
1167,TheOnion,iMor3no,sports.theonion.com,Shaq Assures NBA Players His Baseless Cheap Shots Come From A Good Place,0,1,1613226350
1168,TheOnion,Real_Sosobad,local.theonion.com,Free Condom Harsh Reminder Of Sexless Existence,6,1,1613207232
1169,TheOnion,Faze_Mabin,i.redd.it,Racism just keeps getting better,2,1,1613164828
1170,TheOnion,Faze_Mabin,957bigfm.iheart.com,Tom Brady called 'Racist' for winning Super Bowl during Black History Month | 95.7 BIG FM,3,1,1613164725
1171,TheOnion,dwaxe,entertainment.theonion.com,Timeline Of Britney Spears’ Career,0,1,1613158575
1172,TheOnion,dwaxe,politics.theonion.com,Lindsey Graham Hisses Directions At Attorneys Messing Up Speech They Spent Hours Rehearsing,0,1,1613158456
1173,TheOnion,dwaxe,ogn.theonion.com,"Jesus Christ: Mario And Yoshi Used A Warp Block At The Same Time And Emerged Onto The Mario Party Board As A Horrifying, Fused Monstrosity",11,1,1613135260
1174,TheOnion,GuyOnTheStreet,theonion.com,Woman Quick To Clarify That Child In Dating Profile Picture Not Alive Anymore,7,1,1613099961
1175,TheOnion,GuyOnTheStreet,theonion.com,Seems sensible,0,1,1613099866
1176,TheOnion,dwaxe,politics.theonion.com,Ted Cruz Deeply Disturbed By Part Of Capitol Riot Video Where Chuck Schumer Not Beaten To Death,0,1,1613068178
1177,TheOnion,dwaxe,ogn.theonion.com,End Of An Era: Sony Just Announced They’re Stopping Production Of The PS5,22,1,1613060254
1178,TheOnion,dwaxe,politics.theonion.com,Senators Overjoyed By Chihuahua Jumping Through Hoops During Impeachment Intermission,0,1,1613060066
1179,TheOnion,ThatMakesMeM0ist,theonion.com,Andrew Yang Leading NYC Mayoral Race After Flipping Off Residents And Telling Them To Suck His Dick,1,4,1613007538
1181,TheOnion,aresef,sports.theonion.com,Study: 95% Of ESPN.com Visits Habitual,0,8,1612984193
1182,TheOnion,aresef,theonion.com,"Trump Attorneys Argue He Spoke Metaphorically Of Ripping Chamber Doors Off Hinges, Crushing Pelosi’s Skull",31,302,1612984162
1183,TheOnion,aresef,local.theonion.com,Boyfriend Upset About Something American Government Did In 1970s,10,12,1612984148
1184,TheOnion,aresef,theonion.com,Flustered Donald Trump Confesses He Only Murdered Mistress Because He Loved Her,3,3,1612984010
1185,TheOnion,dwaxe,entertainment.theonion.com,Christopher Nolan Still No Closer To Understanding End Of ‘Tenet’ After Watching Dozens Of YouTube Explainer Video,18,1,1612885590
1186,TheOnion,Superb-Palpitation44,sports.theonion.com,Streaking Vince Lombardi Hologram Eludes Stadium Security,1,1,1612882588
1187,TheOnion,09ferretboy,i.redd.it,Guy turns into ostrich after horrific car accident!,2,1,1612846292
1188,TheOnion,dwaxe,entertainment.theonion.com,Media Claims Britney Spears Well Enough To Be Released Back Into Their Sole Custody,0,1,1612819282
1189,TheOnion,FutureOmelet,sports.theonion.com,NFL Bankrupted After Receiving $6.3 Trillion Bill From Hospitals For Healthcare Workers Appearance,12,1,1612798670
1190,TheOnion,p4ul1023,sports.theonion.com,Excited Tampa Bay Residents Wish They Had An Actual City To Tear Apart,6,1,1612754610
1191,TheOnion,ThatsMyPhoenix,theonion.com,Republicans Accuse Ocasio-Cortez Of Not Being Anywhere Near Place They Told Capitol Mob She Would Be,2,222,1612473129
1192,TheOnion,aresef,theonion.com,Pundits Warn Removing Marjorie Taylor Greene From Committee Assignments Could Leave Her With Free Time,1,11,1612471105
1193,TheOnion,dwaxe,politics.theonion.com,"‘I Want To Go See Those Mountains Where It Looks Like Avatar,’ Says Biden In Speech Outlining Foreign Policy Agenda",21,1140,1612463052
1194,TheOnion,coolwali,local.theonion.com,Local Man Ruins Date By Just Being Himself,6,785,1612398247
1195,TheOnion,dwaxe,politics.theonion.com,Deranged Conspiracy Theorist Convinced Large Cabal Of Americans Want Her To Disappear,2,49,1612376945
1196,TheOnion,RyukoThizz426,i.redd.it,America needs this shirt,2,1,1612362668
1197,TheOnion,aresef,theonion.com,Nation’s Arborists Once Again Urge Congress To Lower The Age Of Consent For Trees,4,351,1612362059
1198,TheOnion,Ron-Swanson,theonion.com,Insurrectionist Truther Doesn’t Believe He Was At Capitol,15,879,1612333363
1199,TheOnion,dwaxe,politics.theonion.com,Health Insurance Lobbyist Tears Up After Realizing Dianne Feinstein No Longer Recognizes His Face,1,20,1612287272
1200,TheOnion,Niq6,theonion.com,Coworker With Two Computer Screens Not Fucking Around,0,23,1612284105
1201,TheOnion,dwaxe,entertainment.theonion.com,Shy Brothers In Affluent Suburb Already Feeling Pressure To Become Auteur Filmmakers,23,854,1612280173
1202,TheOnion,byronbertram1234,youtube.com,All Fear News,2,2,1612247281
1203,TheOnion,dwaxe,entertainment.theonion.com,BET Executives Panicking After Realizing They Have Nothing Lined Up For Black History Month,0,10,1612207591
1204,TheOnion,dwaxe,ogn.theonion.com,Confused About The GameStop Stock Situation? Here’s An Explainer We Plagiarized Wholesale From Polygon Because We Don’t Get It Either,6,575,1612207342
1205,TheOnion,[deleted],youtube.com,Trigger warning - fyc,0,0,1612201140
1206,TheOnion,bowlerboy2,politics.theonion.com,Pete Buttigieg Learning About Problems Facing Rail Infrastructure By Spending Week Living As Train,0,14,1612197781
1207,TheOnion,dwaxe,politics.theonion.com,Paranoid Janet Yellen Hides Entire U.S. Money Supply In Treasury Department Drop Ceiling,12,733,1612188244
1209,TheOnion,Culver222,i.redd.it,Not The Onion,2,1,1612056329
1210,TheOnion,Ajreil,theonion.com,Home Depot Releases New Bluetooth Cordless Hose,2,1,1612053488
1211,TheOnion,Alex09464367,theonion.com,YouTube Removes Thousands Of Underperforming Covid Misinformation Videos,15,1,1612040646
1212,TheOnion,redditmandez,youtu.be,dark market down,1,1,1612033202
1213,TheOnion,butmuhfreedoms,local.theonion.com,Doctor Wondering Why There ‘Reverse’ Switch On Ventilator,0,1,1612027986
1214,TheOnion,Acrobatic_Channel955,indiatoday.in,"Drunk Kolkata man tries to bomb son, dies in explosion himself",2,1,1611993934
1215,TheOnion,aresef,theonion.com,How Redditors Drove A GameStop Stock Surge,2,1,1611986900
1216,TheOnion,aresef,theonion.com,‘This’ Comment Dozens Of Twitter Users On Thread Incorrectly Explaining News Story,1,1,1611986878
1217,TheOnion,Rafaeliki,theonion.com,Redditors’ Class-Action Lawsuit Alleges Robinhood On Some Bitch Shit,32,1,1611957682
1218,TheOnion,dwaxe,youtube.com,"New Erectile Dysfunction Startup Sends Ripped, Virile Man Directly To Your Door To Bang Your Spouse",1,1,1611947308
1220,TheOnion,dwaxe,ogn.theonion.com,Bad News For Gamers: OGN Has Learned Ocarinas Are Real And They Goddamn Suck,19,1,1611925656
1221,TheOnion,Apes_B_APIN2275,/r/TheOnion/comments/l7mnxr/classic_mets_baseball/,Classic Mets Baseball,1,1,1611905986
1222,TheOnion,aresef,theonion.com,Biden Continues Reading ‘The Pet Goat’ To Schoolchildren After Being Informed Of GameStop Situation,1,1,1611872519
1224,TheOnion,ThatsMyPhoenix,theonion.com,"‘Buy! No, Sell! No, Buy!’ Scream Dueling Front And Back Faces Of Jim Cramer Trying To Drown Each Other Out",18,2,1611864566
1225,TheOnion,Rafaeliki,theonion.com,Congress Investigating Why Capitol Dome’s Atomic Vaporizing Ray Wasn’t Deployed To Eviscerate Rioters,5,3,1611800825
1226,TheOnion,schueaj,theonion.com,Increasingly Bold Israel Begins Building Settlements In Downtown Albuquerque,15,10,1611772526
1227,TheOnion,dwaxe,ogn.theonion.com,Rest Easy: Bethesda Announces That Shia LaBeouf Will Appear In ‘Indiana Jones’ Game But His Character Dies Almost Immediately,1,1,1611766947
1228,TheOnion,dwaxe,politics.theonion.com,Report: Lincoln Memorial Most Powerful Testament To Nation’s Passion For Sitting Down,0,1,1611598476
1229,TheOnion,ThatsMyPhoenix,theonion.com,Tearful Justin Trudeau Chains Self To Keystone Pipeline To Stop Biden Administration From Destroying Oil Industry Heritage Site,0,1,1611594696
1230,TheOnion,Cr3X1eUZ,clickhole.com,"Heartwarming: When This Subway Employee Had To Walk 20 Miles To Work Because He Couldn’t Afford A Car, The CEO Of Subway Drove Alongside Him To Cheer Him On",1,1,1611516706
1231,TheOnion,[deleted],sciencemint.com,Scientists Make First 'Invisible Solar Panels' You Can Integrate Into Smartphones,2,1,1611487434
1233,TheOnion,redditmandez,youtube.com,ACCESS BIG BLUE MARKET. NEW DARKNET MARKET,2,1,1611450319
1234,TheOnion,Jareddenney,youtu.be,NASA Simulator Preps Astronauts For Larry King Interview,8,1,1611410687
1235,TheOnion,GuyOnTheStreet,local.theonion.com,Existentialist Firefighter Delays 3 Deaths,6,1,1611379586
1236,TheOnion,hussainather,livescience.com,"1st preserved dinosaur butthole is 'perfect' and 'unique,' paleontologist says",2,1,1611357122
1237,TheOnion,dwaxe,youtube.com,Most Children Go Missing The Moment Parent Turns Attention Toward Themself For One Goddamn Second,0,1,1611349384
1238,TheOnion,dwaxe,entertainment.theonion.com,Jerry Seinfeld Destitute After Purchasing $950 Million Car,0,1,1611338485
1239,TheOnion,dwaxe,ogn.theonion.com,Rumors Confirmed: IO Interactive Confirms Agent 47’s Barcode Brings Up Del Monte Whole Green Beans When Scanned,15,1,1611324455
1240,TheOnion,connorgrs,i.redd.it,Recently found a sketch comedy tape made by The Onion in 1996 at an antique store!,2,1,1611275705
1241,TheOnion,aresef,theonion.com,Pete Buttigieg Vows To Bring Together Small-Town And Big-City Streets Into One Beautiful American Intersection,0,1,1611256064
1242,TheOnion,dwaxe,politics.theonion.com,Inaugural Address Spills Over Into Second Day As Biden Continues To List Greatest Issues Facing Nation,4,1,1611254667
1243,TheOnion,dwaxe,ogn.theonion.com,"Know Your Rights: If A Cop Asks You To Stop Gaming, You Don’t Have To",3,1,1611246430
1244,TheOnion,alamozony,theonion.com,"[From 2013] When You're Feeling Low, Just Remember I'll Be Dead In About 15 Or 20 Years",11,1,1611208595
1245,TheOnion,dwaxe,politics.theonion.com,"Horrified Biden Family Discovers Rotting, Months-Old Corpse Of Jeff Sessions In White House Executive Residence",4,2,1611177872
1246,TheOnion,dwaxe,politics.theonion.com,Secret Service Agent Heroically Dives In Front Of Strong Breeze That Could Have Killed Biden,28,1,1611164664
1247,TheOnion,dwaxe,politics.theonion.com,Panicked National Guard Troops Shoot Down Military Flyover,0,1,1611164663
1248,TheOnion,aresef,politics.theonion.com,Crowd Politely Cheers Along As Pat Toomey’s Senate Jazz Combo Plays Opening Set At Inauguration,0,1,1611163543
1249,TheOnion,aresef,theonion.com,Bored Flags Already Filtering Out Of Inauguration Halfway Through Biden Speech,0,1,1611163517
1250,TheOnion,BestRexxarNA,theonion.com,"‘Look, He Came After All!’ Says Inauguration Guest Spotting Trump Crouching With Rifle On Nearby Roof",0,2,1611163483
1251,TheOnion,aresef,politics.theonion.com,Stray Doberman Accidentally Sworn In As President After Putting Paw On Inaugural Bible,11,1,1611161460
1252,TheOnion,dwaxe,politics.theonion.com,Vilsack Stuns At Inauguration In 6-Foot-Tall Husk Of Corn,0,1,1611159850
1253,TheOnion,dwaxe,politics.theonion.com,Trump Directs Movers Loading Bubble-Wrapped Melania Into Storage Pod,2,1,1611155353
1254,TheOnion,ThatsMyPhoenix,theonion.com,"Today’s Historic Front Page: Nov. 7, 2020",0,1,1611151663
1255,TheOnion,dwaxe,politics.theonion.com,U.S. Enters Constitutional Crisis After Forgetting Whether Transfer Of Presidential Power Happens At 12 A.M. Or 12 P.M.,15,1,1611151477
1256,TheOnion,Meluchluch,i.redd.it,How many people can get angry from one post?,2,1,1611146197
1257,TheOnion,timelighter,theonion.com,"Admit It: You People Want To See How Far This Goes, Don’t You? [from 2015]",4,1,1611123888
1258,TheOnion,timelighter,theonion.com,Jean Teasdale is back!,4,1,1611123162
1259,TheOnion,dwaxe,politics.theonion.com,Trump Panicking After Realizing Fingerprints All Over White House,17,16,1611083673
1260,TheOnion,ehlee1178,i.redd.it,From Our Dumb Century,2,1,1610992527
