,subreddit,author,domain,title,num_comments,score,timestamp
764,nottheonion,rjaiswal1,businessinsider.com,A Bloomberg TV Host Gifted Bitcoin On Air And It Immediately Got Stolen,1,1,1640423190
765,nottheonion,rjaiswal1,theverge.com,News anchor receives Bitcoin on TV only to have it promptly stolen,1,1,1640423048
766,nottheonion,HarryBotter1138,mlive.com,"Residents urge Ann Arbor, MI officials to decriminalize glue sniffing",0,1,1640422416
767,nottheonion,Finlay_Lee,thethaiger.com,"With tourism suffering, sea turtles are thriving in peace in Phuket",0,1,1640419867
768,nottheonion,TomThanosBrady,insider.com,Japanese Professor Creates Lickable TV Screen during the Covid Pandemic...,0,1,1640417509
769,nottheonion,23World,ladbible.com,Murder-For-Hire Suspect Arrested After Leaving Positive Review For Alleged Hitman Online,1,1,1640415694
770,nottheonion,-Omegamart-,apnews.com,Backfiring car causes active shooter scare at movie theater,0,1,1640410974
771,nottheonion,Justjay0420,dailystar.co.uk,NASA enlists priest to prepare humans for an alien discovery,0,1,1640410932
772,nottheonion,-Omegamart-,protocol.com,Amazon Yankee Candle reviews are mirroring the COVID-19 surge — again,0,2,1640409656
773,nottheonion,-Omegamart-,eminetra.co.uk,A chubby 2-year-old chain smoker who puffed 40 times a day looks unrecognizable in 7 years,0,1,1640408349
774,nottheonion,ScatteredSignal,kiro7.com,"Tennessee man strangles, kills neighbor’s pet kangaroo, alleging it attacked his wife.",0,1,1640408120
775,nottheonion,-Omegamart-,insider.com,A man who says he found a frog in a box of lettuce has named the amphibian Tony and is currently keeping it as a pet,0,1,1640408107
776,nottheonion,Mission_Durian888,theguardian.com,"Getting Covid booster follows ‘teaching of Jesus Christ’, says Boris Johnson | Boris Johnson",0,1,1640407485
777,nottheonion,Clear_Can_9836,youtu.be,2021.12.25早，老白，開播！,1,1,1640407212
778,nottheonion,positive_X,thedailybeast.com,Roger Stone Is Desperate for Cash and Still Selling Autographed Rocks,1,1,1640406721
779,nottheonion,nineby5,youtube.com,Biden agrees with slogan 'Let's go Brandon',1,1,1640405251
780,nottheonion,C3POdreamer,nypost.com,Bidens blasted over singing nurses' WH performance as COVID-19 cases rise,0,1,1640404629
781,nottheonion,NickCTA,dailystar.co.uk,"Pedro Filho, killed his dad, ate his heart. Killed 100+ people and is free!! Welcome to brazil!",1,1,1640403667
782,nottheonion,problem_solver1,deccanherald.com,"Wife treats me like a slave, almost smothered me, alleges Bengaluru man",0,1,1640403256
783,nottheonion,-Omegamart-,foxnews.com,New Jersey hijacker who used backhoe to flip police car shot and killed: 'Out of a movie',0,1,1640402981
784,nottheonion,NickCTA,en.m.wikipedia.org,"Meet Pedro Filho, murdered 100+ people and not in jail!",1,1,1640402766
785,nottheonion,-Omegamart-,foxnews.com,New Jersey hijacker who used backhoe to flip police car shot and killed: 'Out of a movie',0,1,1640402728
786,nottheonion,-Omegamart-,foxnews.com,"Oklahoma boy’s arm ripped off by pit bull after trying to pet puppies, police say",0,1,1640401435
787,nottheonion,-Omegamart-,foxnews.com,"Illinois homeless man crushed to death inside garbage truck, some blame cold weather",0,1,1640399926
788,nottheonion,-Omegamart-,apnews.com,"Holiday gifts taken from luggage, replaced with dog food",0,1,1640399055
789,nottheonion,RkOShea,dailymail.co.uk,Owner blows up his Tesla and incinerates an effigy of Elon Musk,1,1,1640397609
790,nottheonion,Haisiel,flickertailtimes.com,Dickinson Highschool Midget Mascot Replaced With Leprechaun,0,1,1640396422
791,nottheonion,Che0063,self.nottheonion,Best of r/NotTheOnion 2021: Nominations now open!,0,1,1640395803
792,nottheonion,SD_throwaway222,nypost.com,Man blows up Tesla after mechanics charge $23K for new battery,1,1,1640385463
793,nottheonion,SD_throwaway222,gizmodo.com,Finnish Man Blows Up Tesla Car Instead of Replacing Battery,1,1,1640385375
794,nottheonion,_sabbracadabra,theguardian.com,Nirvana seek to dismiss sexual abuse lawsuit concerning Nevermind cover,0,1,1640385254
795,nottheonion,RapidFX_,gifs.tribe.so,Nevada Man Claimed to Have Proof of Illegal Voting Takes Guilt Plea to Voting Twice,0,1,1640385209
796,nottheonion,DizzyTemperature3013,foxnews.com,"Dad tells Biden, 'Let's go Brandon' during Christmas Eve call — and Biden agrees",0,1,1640384336
797,nottheonion,pau-ki,nypost.com,Sexy model uninvited from wedding over racy bridesmaid dress,1,1,1640383202
798,nottheonion,Plane-Foundation9016,youtube.com,Se ele Ficou Rico eu Também Posso ficar rico - Kayky Janiszewski - Marke...,1,1,1640381976
799,nottheonion,yuchennasa,scmp.com,US applies for officials to attend Winter Games amid diplomatic boycott,1,1,1640381454
800,nottheonion,masiakasaurus,bbc.com,Russian priest who adopted 70 children jailed for abuse,0,1,1640380870
801,nottheonion,musicfromadventures,mlive.com,"Ann Arbor,MI to decriminalize glue sniffing",0,1,1640380432
802,nottheonion,musicfromadventures,mlive.com,What are they going to decriminalize next?,0,1,1640380320
803,nottheonion,obviousthrowawaynamr,ggwash.org,Residents of a rich Montgomery County neighborhood provide a helpful list of places where cheaper homes can go,1,1,1640380022
804,nottheonion,de_jezzai,read.cash,Federal Government Threatens Crossover Service,0,1,1640379360
805,nottheonion,SillyWalrus19,dw.com,Poland accuses Germany of trying to form 'Fourth Reich',0,1,1640376956
806,nottheonion,Garden_Variety_Medic,counton2.com,Berkeley County deputies arrest man who fled traffic stop with baby alligator in car,0,1,1640376517
807,nottheonion,bshensky,mlive.com,Residents urge Ann Arbor officials to decriminalize glue sniffing,0,1,1640375429
808,nottheonion,holybolt9,nytimes.com,"Beware the Elf on a Shelf, Privacy Watchdogs Warn",1,1,1640375342
809,nottheonion,Sweep145,givemesport.com,Logan Paul claims people think Jake Paul is this generation's Mike Tyson &amp; Muhammad Ali,0,1,1640373611
810,nottheonion,Chef_Andre,foxnews.com,Brandon where are you?,0,1,1640373049
811,nottheonion,KimCureAll,theguardian.com,French zoo closes after pack of nine wolves escapes | France,0,1,1640372722
812,nottheonion,KimCureAll,straitstimes.com,French zoo shut after pack of wolves escapes,1,1,1640372634
813,nottheonion,RapidFX_,gifs.tribe.so,Canada Taps Into Strategic Reserves To Deal With Massive Shortage Of Maple Syrup,0,1,1640370442
814,nottheonion,oliver_17,mirror.co.uk,Christmas shopping sparks 'trolley rage' as Brits 'fight over Brussels sprouts',1,1,1640370167
815,nottheonion,Darth_Kahuna,apnews.com,NOT REAL NEWS: A look at what didn't happen this week,0,1,1640369733
816,nottheonion,Azurebluenomad,cnn.com,'Don't Weigh Me' cards aim to reduce stress at the doctor's office,0,1,1640369433
817,nottheonion,jackythevillen,news24.com,Cops arrest Range Rover driver who steered vehicle from roof of car,0,1,1640369318
818,nottheonion,RealityCrave,mediatraffic.org,NCIS LA Actor Arrested On Set For The Murder Of 2 Young Women,0,1,1640369103
819,nottheonion,Azurebluenomad,dailymail.co.uk,'Don't weigh me' cards available in US doctors surgeries,1,1,1640368978
820,nottheonion,Sorce1557,mlive.com,Residents urge Ann Arbor officials to decriminalize glue sniffing,0,1,1640368738
821,nottheonion,enchanted_kitten,pinknews.co.uk,This woman unwittingly asked a gay guy out on a date. He set her up with his straight identical twin brother instead,1,1,1640368210
822,nottheonion,RapidFX_,gifs.tribe.so,You Could Face A $5000 Fine For Playing Christmas Music In Your Car,0,1,1640367593
823,nottheonion,Zhukov-74,businessinsider.com,Former US Ambassador to Russia Says Putin's 'Acting Crazy' Over Ukraine,1,1,1640367203
824,nottheonion,oranjemania,technotrenz.com,NASA has hired a priest to help humans prepare for alien encounters,0,1,1640366688
825,nottheonion,Puzzleheaded-Rise314,onlinecheckwriter.com,Check Routing Number,0,1,1640366462
826,nottheonion,Next-Weakness5904,foxnews.com,It just doesn’t feel like Christmas with Rush gone this year.,0,1,1640365950
827,nottheonion,peacetomotherearth,electrek.co,"Tesla owner blows up his Model S with dynamite over $22,000 battery replacement",1,1,1640365742
828,nottheonion,MaamaG,maamag.com,Cookies &amp; Cream She’s Eating Herself Out,0,1,1640365535
829,nottheonion,StormCTRH,wbrz.com,Metairie man caught deceiving babysitters into changing his diapers arrested for second time,0,1,1640365407
830,nottheonion,SillyWalrus19,timesofindia.indiatimes.com,Govt doesn't agree with India's rank in World Press Freedom Index: I&amp;B minister,1,1,1640364212
831,nottheonion,Darth_Kahuna,wsbtv.com,Idaho sheriff charged after pulling gun on church youth group,0,1,1640363182
832,nottheonion,Stress--Reliever,youtube.com,Gentle Night Rain in a Forest Cave House - Sleep Instantly for 8HRS &amp; B...,1,1,1640362820
833,nottheonion,SillyWalrus19,trtworld.com,Putin: Insulting Prophet Muhammad is not freedom of expression,0,1,1640362788
834,nottheonion,freehugsfromsatan,cnbc.com,President Trump urges Americans to wear masks to contain the coronavirus outbreak,0,1,1640362784
835,nottheonion,BassAntelope,theguardian.com,Taste the TV: Japan invents lickable screen to imitate food flavours,0,1,1640362670
836,nottheonion,spooky-pancake,dailymail.co.uk,Transgender dad who gave birth revealed nurses call him a 'mom',1,1,1640361300
837,nottheonion,Zhukov-74,toysmatrix.com,UK looking at reinstating Winston Churchill favourite EU stopped,0,1,1640360053
838,nottheonion,panaxxxx,electrek.co,"Tesla owner blows up his Model S with dynamite over $22,000 battery replacement",1,1,1640359700
839,nottheonion,panaxxxx,engadget.com,Amazon warned workers that its busy season could make them feel suicidal,1,1,1640359191
840,nottheonion,usatopseo1234,usatopseo.com,"Buy verified facebook business manager. 100% best verified usa, uk facebook business manager account.",0,1,1640358934
841,nottheonion,SomeDudeinCO3,the-sun.com,China fires up 'artificial sun' 7 times warmer to make unlimited energy,1,1,1640358798
842,nottheonion,panaxxxx,finance.yahoo.com,Amazon warned workers that its busy season could make them feel suicidal,1,1,1640358501
843,nottheonion,virlan4trendnews,virlan.co,What is the BTS light stick called? Why are KPOP Lightsticks so expensive?,0,1,1640358457
844,nottheonion,spooky-pancake,nypost.com,Transgender man who gave birth slams nurses who called him ‘Mom’,1,1,1640358245
845,nottheonion,ajhw13,republicworld.com,"Pig painter Pigcasso’s artwork ‘Wild and Free’ sold for record-breaking £20,000: Report",0,1,1640357380
846,nottheonion,ajhw13,dailymail.co.uk,"Pigcasso the piggy painter sells its latest artwork for £20,000",1,1,1640357325
847,nottheonion,ajhw13,thesun.co.uk,"Painting pig brings home the bacon as latest piece of art sells for £20,000",1,1,1640357220
848,nottheonion,ajhw13,wionews.com,"Pig painter Pigcasso’s artwork sells for whopping £20,000, creates history",1,1,1640357122
849,nottheonion,ajhw13,republicworld.com,"Pig painter Pigcasso’s artwork ‘Wild and Free’ sold for record-breaking £20,000: Report",1,1,1640357043
850,nottheonion,virlan4trendnews,virlan.co,Laura Barton is Agent 19 Mockingbird CONFIRMED . Hawkeye Episode 6 Finale. Barbara Morse,0,1,1640355147
851,nottheonion,Anaeli_David,read.cash,Federal Government Threatens Crossover Service,0,1,1640355007
852,nottheonion,Dickie-McGeezax,theguardian.com,"Cat burglar: New Zealand pet steals bong, bag of white powder and lacy underwear",0,1,1640353947
853,nottheonion,PersonalMost2,nst.com.my,Senior citizen jailed six years for having sex with goat,0,1,1640351553
854,nottheonion,Nashocheese,trtworld.com,Putin Educating The World On Freedom Of Expression.,0,1,1640349990
855,nottheonion,God-first-1974,youtu.be,👉What christmas 🎄 means to me,2,1,1640349707
856,nottheonion,BMF-MOPS,vice.com,People Got Sick at a Conspiracy Conference. They’re Sure It’s Anthrax.,1,1,1640347987
857,nottheonion,LynxTuna,news.sky.com,Lickable TV prototype in development that could bring food flavours into your front room,0,1,1640346335
858,nottheonion,Finlay_Lee,english.kyodonews.net,Japanese university finds drug effective in treating ALS,0,1,1640344890
859,nottheonion,virlan4trendnews,virlan.co,Who is Positive in BTS? K-pop star Suga tests positive for Covid after BTS return from US,0,1,1640344791
860,nottheonion,blargle125,apnews.com,Taiwan's Foxconn qualifies for Wisconsin tax breaks for first time,0,1,1640343744
861,nottheonion,AppropriateWeb9544,famousmoviejackets.com,Nicolas Cage 57 Fur Black Coat,0,1,1640343234
862,nottheonion,housemuncher,smh.com.au,"Beware the Elf on the Shelf, privacy watchdogs warn",0,1,1640342914
863,nottheonion,SavingsBad0,mothership.sg,Japanese professor creates lickable TV screen that produces food flavours,1,1,1640340838
864,nottheonion,fionnbou,theguardian.com,"Getting Covid booster follows ‘teaching of Jesus Christ’, says Boris Johnson",0,1,1640335570
865,nottheonion,Oowixo,popsci.com,Google Earth caught a $2 billion stealth bomber on candid camera,0,1,1640334767
866,nottheonion,real_T_Cruz,theguardian.com,"Tesla, bowing to pressure, stops allowing drivers to play video games while driving",0,1,1640334126
867,nottheonion,Material-Committee40,google.com,finnish santa - Google Search,1,1,1640332059
868,nottheonion,WildFurball2118,freemalaysiatoday.com,Senior citizen jailed 6 years for having sex with a female goat.,0,1,1640331956
869,nottheonion,simplelifestyle,tucson.com,Tucson officer who killed a man in a wheelchair says he will likely appeal if fired,0,1,1640329004
870,nottheonion,simplelifestyle,kiro7.com,Suspected shoplifter using a wheelchair shot 9 times by Arizona police officer,0,1,1640328560
871,nottheonion,mng8ng,businessinsider.com,"Marjorie Taylor Greene, who has boasted about being unvaccinated, owns stock in 3 major vaccine makers",0,1,1640326377
872,nottheonion,dbclass,msn.com,Kamala turns to Hillary to help reverse her drop in approval ratings,1,1,1640326324
873,nottheonion,Reach-for-the-sky_15,theguardian.com,Taste the TV: Japan invents lickable screen to imitate food flavours,0,1,1640325360
874,nottheonion,yipchow,apnews.com,Texas board withdraws pardon recommendation for George Floyd,0,1,1640325001
875,nottheonion,ProfVerstrooid,news24.com,Bulelani Qolani yet to see justice for naked tackle during shack demolition,0,1,1640324797
876,nottheonion,larsandthemoon,theguardian.com,I mean rly,0,1,1640324604
877,nottheonion,[deleted],amp.sacbee.com,"California man robs bank of cash and deposits money at ATM outside, Delaware cops say",1,1,1640324461
878,nottheonion,PedalGull013,theguardian.com,"Tesla, bowing to pressure, stops allowing drivers to play video games while driving",0,1,1640323554
879,nottheonion,Nazzyboyyy,theguardian.com,"Tesla, bowing to pressure, stops allowing drivers to play video games while driving",0,1,1640323170
880,nottheonion,Reach-for-the-sky_15,lawandcrime.com,Former Wisconsin Children's Court Judge Sentenced to Federal Prison for Distributing Child P*rn from County Courthouse,1,1,1640322675
881,nottheonion,DoremusJessup,apnews.com,Florida man with drugs around penis denies they were his,1,1,1640322604
882,nottheonion,_boxy_brown_,orlandoweekly.com,"Florida man claims bags of cocaine, meth found wrapped around penis aren't his",1,1,1640320317
883,nottheonion,captainbbeard,blogto.com,Impaired Ontario driver hands police a Tim Hortons gift card instead of his license,1,1,1640320196
884,nottheonion,Reach-for-the-sky_15,theguardian.com,"Tesla, bowing to pressure, stops allowing drivers to play video games while driving",0,1,1640319474
885,nottheonion,Carnalvore86,wfla.com,Clearwater man with drugs around groin area denies they were his | WFLA,0,1,1640318179
886,nottheonion,[deleted],fox13news.com,Florida man busted with drugs 'wrapped around his penis' tells deputies it's not his: report,1,1,1640317620
887,nottheonion,babbchuck,newsweek.com,Vaccine mandate protesters turned away from Trump Tower restaurant requiring COVID shots,0,1,1640317511
888,nottheonion,fatla00,npr.org,"Amazon settles with NLRB; pledges to ""not threaten workers with discipline or call the police when they are engaging in union activity in exterior non-work areas during non-work time.""",0,1,1640317465
889,nottheonion,Carnalvore86,orlandoweekly.com,"Florida man claims bags of cocaine, meth found wrapped around penis aren't his",1,1,1640317370
890,nottheonion,bigboij,kdvr.com,Man strangles kangaroo to death,0,1,1640317278
891,nottheonion,poclee,northwichguardian.co.uk,Northwich woman jailed for cocaine-fuelled sex with a dog,0,2,1640317219
892,nottheonion,Puzzleheaded-Rise314,onlinecheckwriter.com,Accounts Receivable,0,1,1640316763
893,nottheonion,eat_more_ovaltine,hawaiiathletics.com,Hawai‘i Will Not Participate In EasyPost Hawai‘i Bowl - University of Hawai'i at Manoa Athletics,0,1,1640316668
894,nottheonion,TatonkaJack,fraghero.com,Amazon Bans Itself On Twitch After Broadcasting NSFW Content,0,1,1640313606
895,nottheonion,TatonkaJack,fraghero.com,Amazon Bans Itself On Twitch After Broadcasting NSFW Content,1,1,1640313530
896,nottheonion,Jont_K,theguardian.com,China bans pro-democracy candidates in Macau elections,0,1,1640313175
897,nottheonion,ebradio,consequence.net,Synth repairman accidentally gets high after touching old LSD on a vintage ’60s synthesizer,0,1,1640312994
898,nottheonion,jarrydlm86,cnbc.com,Dorsey blocked from Twitter,0,1,1640312797
899,nottheonion,jlozada24,theguardian.com,"Tesla, bowing to pressure, stops allowing drivers to play video games while driving",0,1,1640311717
900,nottheonion,green-glass,thewhig.com,Portland firehall destroyed in blaze,0,1,1640311589
901,nottheonion,mrajoiner,ctpost.com,"Warrant: Westport day care worker called babies ‘chunky monkey,’ kicked balls at them",0,1,1640311551
902,nottheonion,XYchromosomedominent,fox17online.com,Community Members work to Save the Knight Before Christmas,0,1,1640310912
903,nottheonion,UAJZ,wbrz.com,Metairie man caught deceiving babysitters into changing his diapers arrested for second time,0,1,1640308985
904,nottheonion,cryptictesticles,apnews.com,LA police kill teen girl while firing shots at male suspect,0,2,1640308898
905,nottheonion,gitchesauce,mlive.com,Residents urge Ann Arbor officials to decriminalize glue sniffing,0,1,1640308233
906,nottheonion,69_mgusta,dailykos.com,"Dozens at QAnon conference fall ill, swear it was an anthrax attack—not COVID-19",0,1,1640306694
907,nottheonion,northjersey78,theguardian.com,"Tesla, bowing to pressure, stops allowing drivers to play video games while driving | Tesla | The Guardian",0,1,1640305427
908,nottheonion,Meatballthesub88,cnbc.com,"TIL that in 2009 when giving a TED talk on malaria, Bill Gates released a jar full of mosquitoes on the crowd because ""there's no reason only poor people should have the experience"".",1,1,1640304237
909,nottheonion,SmartGryphax,news.yahoo.com,"Putin Loses His Cool When Confronted Over Ukraine, Claims It Belongs To Lenin Anyway",1,1,1640303322
910,nottheonion,HothHanSolo,theguardian.com,"Tesla, bowing to pressure, stops allowing drivers to play video games while driving",0,1,1640302083
911,nottheonion,allaroucncbjfnfjc,xvideos.com,This isn't the onion,0,1,1640301695
912,nottheonion,eappendix,lawandcrime.com,Former Wisconsin Children’s Court Judge Sentenced to Federal Prison for Distributing Child Pornography from County Courthouse,1,1,1640299754
913,nottheonion,No-Lifeguard-8173,cnn.com,'Don't Weigh Me' cards aim to reduce stress at the doctor's office,0,1,1640299725
914,nottheonion,sourbeer51,mlive.com,Residents urge Ann Arbor officials to decriminalize glue sniffing,0,1,1640298663
915,nottheonion,[deleted],engadget.com,Amazon warned workers that its busy season could make them feel suicidal,1,1,1640297294
916,nottheonion,Wooden-Berry6421,servianasdfas.blogspot.com,"God entered into my body, as a ghostly body, and begins ripping my face, shoots gum disease in mouth",1,1,1640297132
917,nottheonion,WalkLikeAnEgyptian69,wsvn.com,"Foreperson: 3 jurors unwilling to convict Resiles based on race, leading to mistrial",0,1,1640296896
918,nottheonion,virlan4trendnews,virlan.co,Doctor Strange 2 Cast,0,1,1640295545
919,nottheonion,nimobo,mirror.co.uk,"Dad puts up £3,000 for a hypnotist to cure son of supporting Tottenham Hotspur",1,1,1640295332
920,nottheonion,Manjojango2001,vice.com,People Got Sick at a Conspiracy Conference. They’re Sure It’s Anthrax.,1,1,1640295295
921,nottheonion,NineteenEighty9,reuters.com,Tasty TV: Japanese professor creates flavourful screen,0,1,1640295163
922,nottheonion,69_mgusta,youtube.com,Cop Pulls Over School Bus For Wearing Masks,1,1,1640294565
923,nottheonion,virlan4trendnews,virlan.co,Is Doctor Fate stronger than Doctor Strange?,0,1,1640294489
924,nottheonion,Jzerox8K,thecounter.org,"Professional Ham Sniffers In Spain Are Strained ""To The Limit Of Human Possibility"", Have To Sniff 800 Hams Per Day This Christmas Season",0,1,1640292642
925,nottheonion,Weniger_aber_besser,nbclosangeles.com,Florida Man With Drugs Around Penis Denies They Were His,1,1,1640292602
926,nottheonion,virlan4trendnews,virlan.co,What is the story of Doctor Strange in the multiverse of madness?,0,1,1640291056
927,nottheonion,ExactlySorta,theguardian.com,US conservative parents push for book bans – and unintentionally make reading cool again,0,1,1640290649
928,nottheonion,PhilDesenex,newsweek.com,Convicted arsonist named chief of fire department sparks resignations,1,1,1640290229
929,nottheonion,Sweep145,insider.com,Nonwhite Americans are being misidentified as white on their death certificates,0,1,1640289711
930,nottheonion,LoiteringInNJ,orlandoweekly.com,"Florida man claims bags of cocaine, meth found wrapped around penis aren't his",1,1,1640289413
931,nottheonion,brandondtodd,xxlmag.com,Future Orders Kentucky Fried Chicken to Louis Vuitton Dinner Because He Doesn’t Like Sushi,1,1,1640287497
932,nottheonion,Shoban_Gunzeye,newsweek.com,Woman arriving at brother's for Christmas to find she's cooking sparks fury,1,1,1640286467
933,nottheonion,SWIMMlNG,cnn.com,Tesla is under federal investigation for letting drivers play video games,0,1,1640286462
934,nottheonion,gabrielxz,huffpost.com,Pope Francis Demands Humility In New Zinger-Filled Christmas Speech,1,1,1640286204
935,nottheonion,69_mgusta,publicfigure.com,Missouri Cop Pulls Over School Bus Driver For Wearing A Mask.,0,1,1640285928
936,nottheonion,ThrowawayAIIDay,m.orlandoweekly.com,"Florida man claims bags of cocaine, meth found wrapped around penis aren't his",1,1,1640283483
937,nottheonion,198Throwawayy,news.yahoo.com,"Putin Loses His Cool When Confronted Over Ukraine, Claims It Belongs To Lenin Anyway",1,1,1640283477
938,nottheonion,LongshanksAragon,thecrimemag.com,This Man Escaped the Death Row... And Died,0,1,1640283475
939,nottheonion,Darth_Kahuna,apnews.com,AP Exclusive: Polish opposition senator hacked with spyware,0,1,1640283475
940,nottheonion,providencepro,theguardian.com,Taste the TV: Japan invents lickable screen to imitate food flavours,0,1,1640283406
941,nottheonion,vantionsio,theguardian.com,Barrister who sued after colleague asked him to stop farting loses case,0,1,1640283019
942,nottheonion,SillyWalrus19,news.sky.com,Man kicked off flight for wearing women's underwear as face mask,0,1,1640282201
943,nottheonion,SillyWalrus19,bbc.com,Brigitte Macron to sue over false claims she was born male,0,1,1640281268
944,nottheonion,rainbowarriorhere,dawn.com,Smoking dead scorpions is KP's latest dangerous addiction,0,1,1640280729
945,nottheonion,cryptictesticles,clickorlando.com,"Florida man claims bags of cocaine, meth found wrapped around penis aren't his",1,1,1640280717
946,nottheonion,rainbowarriorhere,northwichguardian.co.uk,Anti-vaccine protesters try to serve papers on Alan Shearer but get wrong house,0,1,1640280641
947,nottheonion,FireMEGAcrush,fair.org,'A For-Profit Company Is Trying to Privatize as Many Public Libraries as They Can',0,1,1640280601
948,nottheonion,cryptictesticles,nypost.com,"Florida man claims bags of cocaine, meth found wrapped around penis aren't his",1,1,1640280450
949,nottheonion,cryptictesticles,m.orlandoweekly.com,"Florida man claims bags of cocaine, meth found wrapped around penis aren't his",1,1,1640279919
950,nottheonion,Jon_Boopin,newscientist.com,Dogs notice when computer animations violate Newton’s laws of physics,1,1,1640279835
951,nottheonion,rainbowarriorhere,theguardian.com,"Cat burglar: New Zealand pet steals bong, bag of white powder and lacy underwear",0,1,1640279741
952,nottheonion,Reach-for-the-sky_15,vice.com,People Got Sick at a Conspiracy Conference. They’re Sure It’s Anthrax.,1,1,1640279490
953,nottheonion,SillyWalrus19,thedailybeast.com,"Putin Loses His Cool When Confronted Over Ukraine, Claims It Belongs to Lenin Anyway",1,1,1640279381
954,nottheonion,Timely_Nature1478,10bmnews.com,Army charity gift hampers bring joy to veterans and their families,0,1,1640279281
955,nottheonion,awskeetskeetmuhfugga,cnn.com,North Carolina police chief placed on unpaid leave for telling officers about 'clinic' to obtain Covid-19 vaccination cards without getting the shots,0,1,1640279054
956,nottheonion,littlepiggy,france24.com,"Covid-19: In Sweden, a vaccine passport on a microchip implant",0,1,1640279025
957,nottheonion,that_guy_next_to_you,montreal.ctvnews.ca,Humans will one day have sex in space: Montreal researcher,0,1,1640278828
958,nottheonion,-Omegamart-,odt.co.nz,Firearms found after near-naked chase,0,1,1640278577
959,nottheonion,[deleted],carscoops.com,"Russia's Kamaz Is Facing A Worker Shortage, So They're Considering Having Prisoners Build Vehicles",1,1,1640278433
960,nottheonion,r4816,independent.co.uk,Madison Cawthorn under fire for calling on fellow conservatives to drop out of college like him,1,1,1640278184
961,nottheonion,-Omegamart-,kentonline.co.uk,Woman charged with urinating in police vehicle,0,1,1640278046
