,subreddit,author,domain,title,num_comments,score,timestamp
0,nottheonion,Taco_duck68,wral.com,"Man attempts to pay for car with rap, steals potato chip truck",0,1,1640995192
1,nottheonion,BlackNingaa,bloodyelbow.com,Former UFC fighter reveals past as sex worker to fund mma career,1,1,1640994707
2,nottheonion,Lopsided_File_1642,facebook.com,Log into Facebook,1,1,1640991506
3,nottheonion,SkinnyWhiteGirl19,theartnewspaper.com,McDonald’s blocked from building drive-through at Rome's ancient Baths of Caracalla,0,1,1640990429
4,nottheonion,kids-cake-and-crazy,kjrh.com,Legendary actress Betty White dies at 99 on New Year's Eve. Screw you 2021!,0,1,1640989181
5,nottheonion,carolinaindian02,thedrive.com,"Toyota Corolla Hits 50 Million Sold, Gets Its Own Manga",0,1,1640986038
6,nottheonion,TheBravan,theconservativetreehouse.com,Illinois Holocaust Museum Begins Requiring Visitors to Show Approved Travel and Vaccination Papers,1,1,1640984973
7,nottheonion,millitzer,boingboing.net,"Reporter likely to be charged for using ""view source"" feature on web browser",1,1,1640984798
8,nottheonion,AcetylCoA1856,huffpost.com,"Woman Tests Positive For COVID, Quarantines In Airplane Bathroom For 5 Hours",0,1,1640984135
9,nottheonion,aspiringoxfordcomma,theartnewspaper.com,McDonald’s blocked from building drive-through at Rome's ancient Baths of Caracalla,0,1,1640983576
10,nottheonion,Jaerisonflosrhe,cnn.com,Amazon's Alexa tells 10-year-old child to touch penny to exposed plug socket,0,1,1640982689
11,nottheonion,Haunted_Syrup,theartnewspaper.com,McDonald’s blocked from building drive-through at Rome's ancient Baths of Caracalla,0,1,1640982685
12,nottheonion,eatyourveggies11,theartnewspaper.com,McDonald’s blocked from building drive-through at Rome's ancient Baths of Caracalla,0,1,1640982146
13,nottheonion,KaleidoscopeWarCrime,theartnewspaper.com,McDonald’s blocked from building drive-through at Rome's ancient Baths of Caracalla,0,1,1640981867
14,nottheonion,DoubleBeef1,youtu.be,California school boards to ban 'D' and 'F' grades,1,1,1640981678
15,nottheonion,urbanskyline09,france24.com,France offers intensive care nurses €100 monthly bonus amid Covid-19 exhaustion,0,1,1640981435
16,nottheonion,The_Mordecai,stltoday.com,Parson says he believes prosecutor will bring charges in Post-Dispatch case,1,1,1640981344
17,nottheonion,The_Mordecai,boingboing.net,"Reporter likely to be charged for using ""view source"" feature on web browser",1,1,1640980977
18,nottheonion,YoMomsHubby,insiderpaper.com,Growing a beard is not mandatory: Taliban,0,1,1640980902
19,nottheonion,LavaringX,theartnewspaper.com,McDonald’s blocked from building drive-through at Rome's ancient Baths of Caracalla,0,1,1640980411
20,nottheonion,Astraeus323,foxnews.com,"Betty White's secret to a long, happy, healthy life (Hint: it came from her mom)",0,1,1640980191
21,nottheonion,Expwar,yahoo.com,"Betty White, The Golden Girls and Hot in Cleveland Star, Dead at 99",1,1,1640979959
22,nottheonion,ohdearitsrichardiii,theguardian.com,"Call me a thespian not an actor, says Nicolas Cage",0,1,1640979683
23,nottheonion,rainbowarriorhere,theguardian.com,Giuffre lawyers seek details on Prince Andrew’s claimed inability to sweat,0,1,1640979344
24,nottheonion,l3lacklabel,amp.tmz.com,Betty White Dead at 99,1,1,1640978894
25,nottheonion,Drusgar,kxan.com,Central Texas Red Cross sending at least one volunteer to Colorado after devastating fires,0,1,1640978802
26,nottheonion,uup17,cnn.com,Virginia Giuffre's lawyers demand proof that Prince Andrew can't sweat,0,1,1640978349
27,nottheonion,Glittering-Stop-9981,servianasdfas.blogspot.com,"God entered into my body, as a ghostly body, and begins ripping my face, shoots gum disease in mouth",1,1,1640978290
28,nottheonion,Randclad,cnbc.com,Bank accidentally deposits $176 million into people's accounts on Christmas Day,0,1,1640978058
29,nottheonion,Battle_Librarian,usatoday.com,'2021 is pulling out all the tricks': Fish rain from the sky in rare phenomenon in Texas,0,1,1640977836
30,nottheonion,Chef_Andre,foxnews.com,New York says it will prioritize non-White people in distributing low supply of COVID-19 treatments,0,1,1640977319
31,nottheonion,Either-Solution-8618,cnn.com,Nicolas Cage doesn't want to be called an 'actor',0,1,1640977193
32,nottheonion,albaalba,theguardian.com,Americans seeking to renounce their citizenship are stuck with it for now,0,1,1640976971
33,nottheonion,r00t1,theartnewspaper.com,McDonald’s blocked from building drive-through at Rome's ancient Baths of Caracalla,0,1,1640976286
34,nottheonion,efranklin13,charlotteobserver.com,Dad buying his kids chocolate milk from 7-Eleven hits the jackpot in Virginia lottery,0,1,1640973993
35,nottheonion,any-mystic,boingboing.net,"Reporter likely to be charged for using ""view source"" feature on web browser",1,1,1640973806
36,nottheonion,Y___S-Reddit,theguardian.com,Israel blames map error for UN deaths in bombing | Israel,0,1,1640973190
37,nottheonion,NeverEndingDClock,hongkongfp.com,Stand News raid: Hong Kong justice chief says foreign critics of journalist arrests are in violation of int'l law - Hong Kong Free Press HKFP,0,1,1640972446
38,nottheonion,nightowlk17,whio.com,Drone carrying marijuana crashes into Ohio house,0,1,1640972103
39,nottheonion,nightowlk17,whio.com,Drone carrying marijuana crashes into Ohio house,1,1,1640971893
40,nottheonion,Msajidhussain517,jobsalrats.website,BOK Jobs 2022 – Latest Jobs 2022,1,1,1640971674
41,nottheonion,Stereomceez2212,npr.org,Retired general warns the U.S. military could lead a coup after the 2024 election,0,1,1640971082
42,nottheonion,seosmmworld,seosmmworld.com,Buy Facebook Ads Accounts - 100% Active &amp; Verified Business Manager,0,1,1640969678
43,nottheonion,onandonandonandoff,bbc.com,Prince Andrew accuser seeks evidence he could not sweat,0,1,1640968457
44,nottheonion,mannyosu,nypost.com,"IRS wants thieves, drug dealers to report their income",1,1,1640968352
45,nottheonion,Sofa__King__Cool,pennlive.com,"IRS reminds taxpayers that they have to report any income from crime, such as dealing drugs",0,1,1640968170
46,nottheonion,iamharryvirus,youtu.be,A Brazilian priest strapped himself to 1000 balloons to raise money for a roadside chapel,1,1,1640968166
47,nottheonion,DrMechanic08,commondreams.org,Humanity's Final Arms Race: UN Fails to Agree on 'Killer Robot' Ban,1,1,1640967911
48,nottheonion,Azurebluenomad,yahoo.com,"Father allegedly drove 14-year-old son to store to commit murder, police say",1,1,1640967812
49,nottheonion,SelectiveSanity,cnn.com,Nicolas Cage doesn't want to be called an 'actor',0,1,1640967739
50,nottheonion,suchdogewow5,theguardian.com,Woman self-isolates in plane toilet for five hours after Covid-positive test mid-flight | Coronavirus,0,1,1640966006
51,nottheonion,merepsull,commondreams.org,Humanity's Final Arms Race: UN Fails to Agree on 'Killer Robot' Ban,1,1,1640965471
52,nottheonion,DaveInLondon89,bbc.co.uk,Prince Andrew accuser seeks evidence he could not sweat,0,1,1640963938
53,nottheonion,av1987,twitter.com,"Upset over their grievances not being addressed, members of a parents association in Ludhiana (India) garlanded the district education officer with a shoe. The officer was happily getting clicked till he realised it !!!!",1,1,1640963308
54,nottheonion,Acrzyguy,sciencefocus.com,"Thousands of coma patients may be conscious but we’re ignoring them, says pioneering neuroscientist",0,1,1640963023
55,nottheonion,INDAV,scotsman.com,Prince Andrew asked to prove inability to sweat in civil case,0,1,1640961888
56,nottheonion,hybridtheorist,mirror.co.uk,Prince Andrew's rape accuser demands the Duke proves his claim he cannot sweat,1,1,1640961599
57,nottheonion,cashapp354,sites.google.com,Win 1500000$ cashapp Balance.,1,1,1640959983
58,nottheonion,Zhukov-74,theartnewspaper.com,McDonald’s blocked from building drive-through at Rome's ancient Baths of Caracalla,0,1,1640958928
59,nottheonion,Live_Writing83,irishtimes.com,Private schools say exclusion from State grants is ‘discriminatory’,0,1,1640958376
60,nottheonion,Phamson456,phamson.com.vn,22 Mộ đá đôi đẹp bán tại Yên Bái - Đá Mỹ Nghệ Phạm Sơn,0,1,1640954846
61,nottheonion,geekman20,cathelete.com,"Brandon Brown to drive 'Let's go, Brandon'-themed car - Washington Times - Cathelete",0,1,1640954183
62,nottheonion,geekman20,washingtontimes.com,"NASCAR’s Brandon Brown to drive ‘Let’s go, Brandon’-themed car",1,1,1640954107
63,nottheonion,[deleted],ndtv.com,Jail For Drug Dealer Who Decorated Christmas Tree With Cash And Cocaine,1,1,1640953954
64,nottheonion,JamalBruh,cnbc.com,Pro-Trump lawyer says his plantations were go-to spots for those aiming to overturn the 2020 election,0,1,1640953516
65,nottheonion,thebelsnickle1991,bbc.com,Bangladesh: Women-only beach scrapped after social media outcry,0,1,1640948808
66,nottheonion,halfxvxfull,independent.co.uk,Prince Andrew accuser asks him to provide medical evidence to show he can’t sweat,1,1,1640948523
67,nottheonion,Adept_Ad_3403,youtu.be,"Tesla Recalls Over 475,000 Cars Over Safety Issues Increasing Crash Risk",1,1,1640948209
68,nottheonion,ssrees,bbc.com,Covid: Woman isolates in toilet for five hours after testing positive mid-flight test,0,1,1640947366
69,nottheonion,tallmantim,boingboing.net,Sweet Jeebus,1,1,1640947246
70,nottheonion,LoganthePaladin,gizmodo.com,Let's Go Brandon Cryptocurrency Sponsors NASCAR's Brandon Brown,0,1,1640946764
71,nottheonion,calbert1735,cnn.com,Cats blamed for more than 100 house fires in South Korea,0,1,1640946293
72,nottheonion,LoganthePaladin,rollingstone.com,'Let's Go Brandon' Crypto Coin to Sponsor 'Let's Go Brandon' Racecar Driver,1,1,1640946200
73,nottheonion,meme_stealing_bandit,bbc.com,Covid: Woman isolates in toilet for five hours after positive mid-flight test,0,1,1640945966
74,nottheonion,halfxvxfull,thetimes.co.uk,Prince Andrew asked to prove his inability to sweat by Virginia Giuffre’s lawyers,1,1,1640945712
75,nottheonion,Thesaddestdumpling,nbcnews.com,"Don't forget to declare income from stolen goods and illegal activities, IRS says",0,1,1640944036
76,nottheonion,Thesaddestdumpling,nbcnews.com,"Don't forget to declare income from stolen goods and illegal activities, IRS says",1,1,1640943931
77,nottheonion,NaturalPheno,kas4.com,Boulder County fires: All the aftermath of the Marshall fire affecting Colorado | wildfires 2021,0,1,1640943872
78,nottheonion,fieldybbz,theguardian.com,Woman self-isolates in plane toilet for five hours after Covid-positive test mid-flight,0,1,1640941280
79,nottheonion,sexyhusband714,trendswide.com,Jamal Khashoggi’s Saudi hit squad killers ‘are living in seven-star villas in Riyadh’,0,1,1640940540
80,nottheonion,virlan4trendnews,virlan.co,What is X Factor’s Ray Quinn doing now? Is Still Married?,0,1,1640940498
81,nottheonion,PeriFyseos,youtu.be,Herons and Cormorant,1,1,1640933956
82,nottheonion,TheDifficultQuest,theweek.co.uk,Doctor says we should not sleep naked because of flatulent spraying,1,1,1640932894
83,nottheonion,asdfasdf666_,boingboing.net,"Reporter likely to be charged for using ""view source"" feature on web browser",1,1,1640930246
84,nottheonion,praxiq,mainichi.jp,Tokyo police lose 2 floppy disks containing personal info on 38 public housing applicants,0,1,1640927915
85,nottheonion,Many_Scratch2269,geopolicies.com,"Marjorie Taylor Greene Says She Wants To Take Away The Voting Rights of Californian and New York Transplants Who Vote Blue. Says They Are Moving Out of “shitholes” and Moving Into “GREAT red states,” Then Goes On To Tweet First Amendment.",0,1,1640927328
86,nottheonion,-Omegamart-,bleepingcomputer.com,University loses 77TB of research data due to backup error,0,1,1640926904
87,nottheonion,tayhc511,liverpoolecho.co.uk,'Covid deniers' storm hospital and accuse nurses of 'kidnap',0,1,1640926774
88,nottheonion,soparklion,nfl.com,NFL teams to observe moment of silence for John Madden in Week 17,0,1,1640926452
89,nottheonion,benjamindbrooks,fox4news.com,IRS requires reporting of illegally obtained property on tax reports,0,1,1640924314
90,nottheonion,Pretty_Flamingo_4455,reddit.com,Racially Discriminated,0,1,1640924020
91,nottheonion,brianswichkow,abc13.com,RadioShack reboots as cryptocurrency company,0,1,1640923089
92,nottheonion,VonDrakken,avclub.com,"Nicolas Cage prefers “thespian” to “actor,” thank you very much",0,1,1640921353
93,nottheonion,Frank8821NV,southfloridagaynews.com,Founder of 'Ex-gay' Group Confesses to Having Multiple Hookups with Men,0,1,1640920897
94,nottheonion,twdvermont,cnn.com,Chicago woman quarantined in airplane bathroom for 3 hours after testing positive for Covid-19 mid-flight,0,1,1640919844
95,nottheonion,SFCWeirdo,brokeassstuart.com,DEA Releases Emoji Drug Decoder,0,1,1640919490
96,nottheonion,ChiWod10,huffpost.com,Stay safe and remain ugly,1,1,1640918203
97,nottheonion,League_Pristine,opindia.com,"Man who has been dropping used condoms in temple donation boxes arrested, says he was doing it to spread the message of Jesus",0,1,1640917746
98,nottheonion,GetOutOfTheWhey,nydailynews.com,"Georgia man squirts fart spray called Liquid ASS on woman in bar, sparking mass exodus at Athens establishment",1,1,1640917366
99,nottheonion,atmoscience,miamiherald.com,"Man faked a COVID positive test to avoid court hearing in Connecticut, officials say",0,1,1640917033
100,nottheonion,Mighty_L_LORT,cnn.com,Chicago woman quarantined in airplane bathroom for 3 hours after testing positive for Covid-19 mid-flight,0,1,1640916993
101,nottheonion,anglomike,ottawa.ctvnews.ca,"Police look for leads in Christmas butter heist in Trenton, Ont.",0,1,1640913408
102,nottheonion,GremlinBandit,cnn.com,Amazon's Alexa tells 10-year-old child to touch penny to exposed plug socket,0,1,1640912324
103,nottheonion,PresidentSpanky,bbc.com,China bans its national football players from getting tattoos,0,1,1640912281
104,nottheonion,yipchow,wusa9.com,New Yorker blames food pyramid in Capitol riot case,0,1,1640911046
105,nottheonion,Knight_Alfa,people.com,"Tesla Owner Decides to Blow Up His Car with Dynamite When Faced with $22,000 Repair Bill",1,1,1640910552
106,nottheonion,Knight_Alfa,stuff.co.nz,"Tesla owner straps car with dynamite and blow it up rather than pay $22,000 in repairs",1,1,1640910402
107,nottheonion,Knight_Alfa,electrek.co,"Tesla owner blows up his Model S with dynamite over $22,000 battery replacement",1,1,1640910269
108,nottheonion,kekcopter,bnd.com,Firefighters quit after convicted arsonist is appointed chief of St. Clair County district,0,1,1640909929
109,nottheonion,QuicklyThisWay,england.nhs.uk,NHS urges hundreds of thousands to have a ‘jabby New Year’,0,1,1640909882
110,nottheonion,Chroncom,chron.com,It was raining fish (hallelujah) in this eastern Texas city on Wednesday,0,1,1640908901
111,nottheonion,klayface94,calgaryherald.com,Prince Andrew makes 'unprecedented' request for all witness testimony in sex abuse case to be kept secret,1,1,1640908569
112,nottheonion,Anaeli_David,read.cash,Federal Government Of Nigeria Plans To Borrow More Money,0,1,1640908201
113,nottheonion,nathew42,mlive.com,Mayonnaise bath awaits winning coach of Duke’s Mayo Bowl,0,1,1640907423
114,nottheonion,Gh0stp3pp3r,washingtontimes.com,Aaron Rodgers: Science that 'can't be questioned' is 'propaganda',1,1,1640905731
115,nottheonion,SelectiveSanity,comicsands.com,Don Jr. Implores Young Supporters To Ditch Peaceful Bible Rule Since It's 'Gotten Us Nothing',0,1,1640905451
116,nottheonion,WhosWilson,bbc.com,Covid: Woman isolates in toilet for five hours after positive mid-flight test,0,1,1640904277
117,nottheonion,WalkLikeAnEgyptian69,nbcnews.com,Man sentenced for fatally shooting woman during argument over the 2016 election,0,1,1640904219
118,nottheonion,Vera_Telco,abcnews.go.com,Denver shootings suspect wrote books previewing attacks,0,1,1640904160
119,nottheonion,AngryMobOfVaginas,freep.com,Michigan says it won't follow CDC's relaxed covid 19 recommendations.,0,1,1640903367
120,nottheonion,Challenger4664A,nbcnews.com,Should Pluto be a planet again? The debate rages on,0,1,1640902786
121,nottheonion,sewn_of_a_gun,bbc.co.uk,Covid: Woman isolates in toilet for five hours after positive mid-flight test,0,1,1640902300
122,nottheonion,sewn_of_a_gun,bbc.co.uk,Woman isolates in toilet for five hours after positive mid-flight Covid test,0,1,1640902202
123,nottheonion,IntelligentMachine20,fiverr.com,SPOTIFY MUSIC PROMOTION,1,1,1640902195
124,nottheonion,DasCapitolin,nytimes.com,"After 4 Killings, ‘Officer of the Year’ Is Still on the Job",1,1,1640900700
125,nottheonion,Archane-Arcmage,mystateline.com,Bomb squad called to hospital after man gets WWII mortar stuck in his rectum,0,1,1640900145
126,nottheonion,centralintelligency,businessinsider.com,Tom Brady says he'll get fined by the NFL if he throws another Microsoft Surface tablet,1,1,1640900024
127,nottheonion,morenewsat11,clickondetroit.com,Michigan Gov. Whitmer signs bill so non-teaching staff can work as subs,1,1,1640900007
128,nottheonion,virlan4trendnews,virlan.co,Why does the Rock hate Vin Diesel? What Happened with Dwayne Johnson and Vin Diesel?,0,1,1640899792
129,nottheonion,SelectiveSanity,npr.org,This 6th-grader gave a classmate the Heimlich and saved a woman from a fire in one day : NPR,0,1,1640898475
130,nottheonion,whyaretherenouser,bc.ctvnews.ca,I can see no possible issues with this,0,1,1640897775
131,nottheonion,billover1134,youtu.be,"Roger S. Adams ""ACE"" Memorial service. Roger was a man that never met a stranger!",1,1,1640896101
132,nottheonion,TransFattyAcid,rollingstone.com,'Let's Go Brandon' Crypto Coin to Sponsor 'Let's Go Brandon' Racecar Driver,0,1,1640894575
133,nottheonion,BlazedLarry,metro.co.uk,'Rogue' squirrel terrorises town by attacking people as they put their bins out,1,1,1640894490
134,nottheonion,domo415,wgntv.com,DEA releases emoji drug decoder,0,1,1640891983
135,nottheonion,SelectiveSanity,fox13news.com,McDonald’s rolls out exercise bikes for dine-in customers in China,0,1,1640891663
136,nottheonion,SelectiveSanity,upi.com,British family earns Guinness World Record for most albino siblings,1,1,1640891565
137,nottheonion,Zombillions,reut.rs,U.S. reality TV star Paris Hilton launches meta-verse business on Roblox,1,1,1640890857
138,nottheonion,zampe,newsweek.com,Amazon driver allegedly fired for dunking on basketball hoop says he would do it again,1,1,1640890412
139,nottheonion,huhIguess,thehill.com,'Psycho' squirrel terrorizes small town over Christmas,0,1,1640889129
140,nottheonion,coheed85,bbc.co.uk,China bans its national football players from getting tattoos,0,1,1640888827
141,nottheonion,confibulator,nbcbayarea.com,"Don’t Forget to Declare Income From Stolen Goods and Illegal Activities, IRS Says",0,1,1640887841
142,nottheonion,Msajidhussain517,jobsalrats.website,"Capital Hospital Islamabad Jobs 2022 for Medical Officers, Nurses, Specialist Doctors, Office Attendants, Ward Boys / Aya, Sanitary Workers, Security Guards &amp; Others Latest",1,1,1640887476
143,nottheonion,benislover343,tomshardware.com,'World's Fastest PC' Hits 100 KPH Packing Core i9-12900K and RX 6900 XT,0,1,1640887078
144,nottheonion,BlankVerse,truthout.org,"Rand Paul Says Legal Campaign Methods Are How Dems ""Steal"" Elections",0,1,1640886911
145,nottheonion,PhilDesenex,kxan.com,Fish rain from the sky in east Texas town as storms moved through,0,1,1640886469
146,nottheonion,meatybone,cbssports.com,Mack Brown and Shane Beamer agree to mayonnaise bath for winner of Duke's Mayo Bowl,0,1,1640885615
147,nottheonion,Defiant_Race_7544,people.com,"Tesla Owner Decides to Blow Up His Car with Dynamite When Faced with $22,000 Repair Bill",1,1,1640885500
148,nottheonion,chalillianaire,newsbreak.com,Squirrel injures 18 people in two days of attacks in Buckley,1,1,1640884811
149,nottheonion,mihi33,bluehost.com,Best Web Hosting 2021 - Domains - WordPress - Bluehost,1,1,1640884218
150,nottheonion,mart1373,mlive.com,"Father allegedly fires gun after son says, ‘Why don’t you just shoot me?’",0,1,1640884029
151,nottheonion,vaish7848,cnn.com,China bans footballers from getting tattoos,0,1,1640883800
152,nottheonion,Timely_Nature1478,10bmnews.com,Those who do not wear masks will be fined one thousand riyals the Saudi Interior Ministry said,0,1,1640883685
153,nottheonion,holtpj,foxnews.com,Five anti-vax protesters arrested after storming a Burger King,0,1,1640882719
154,nottheonion,IlyaasTheReporter,businessinsider.co.za,A US employee who makes R6.4 million a year is angry he has to make one delivery every month,1,1,1640882678
155,nottheonion,holtpj,thedailybeast.com,Five anti-vax protesters arrested after storming a Burger King,1,1,1640882584
156,nottheonion,holtpj,newsweek.com,Five anti-vax protesters arrested after storming a Burger King,1,1,1640882419
157,nottheonion,holtpj,nypost.com,5 anti-vax protesters arrested after storming a Burger King,1,1,1640882328
158,nottheonion,Randclad,timesnownews.com,Google Maps tells man to 'drive into a tree' when lost in the wilderness,1,1,1640882269
159,nottheonion,Rise7979,dailymail.co.uk,Home | Daily Mail Online,0,1,1640881891
160,nottheonion,therealdjred,wbir.com,'The Human Remains Locator' | Forensic investigators develop tools they say can find bodies,0,1,1640881544
161,nottheonion,virlan4trendnews,virlan.co,Who wrote Taylor Swift Shake It Off? What is Copyright Lawsuit?,0,1,1640881456
162,nottheonion,justtinygoatthings,freep.com,Fieger: I deserve to know about headless bird detail in Oxford school shooting case,0,1,1640880760
163,nottheonion,jamin_g,insider.com,"A squirrel went on a vicious Christmas rampage in a Welsh town, attacking 18 residents and animals",0,1,1640880698
164,nottheonion,SelectiveSanity,cnn.com,Alleged Chinese smugglers publicly shamed for breaching Covid rules,0,1,1640880473
165,nottheonion,rainbowarriorhere,bbc.co.uk,Santander: Bank hands out £130m in Christmas blunder,0,1,1640879171
166,nottheonion,OfNothingorTempest,google.com,Alexa Tells Child to Stick Penny on Exposed Socket,0,1,1640878351
167,nottheonion,brochacho83,foxnews.com,"Florida man busted with meth and coke wrapped around his penis, tells cops it's not his",0,1,1640878305
168,nottheonion,elrichthain,cnn.com,Amazon's Alexa tells 10-year-old child to touch penny to exposed plug socket,0,1,1640878219
169,nottheonion,[deleted],yahoo.com,"Unvaccinated Joe Rogan Cancels 4/20 Show in Canada, Can’t Even “Get into the Country”",0,1,1640877917
170,nottheonion,Donsyxx,toronto.citynews.ca,"Ontario police investigating alleged theft of $200,000 worth of butter",0,1,1640877745
171,nottheonion,brochacho83,foxnews.com,"Florida man busted with meth and coke wrapped around his penis, tells cops it's not his",1,1,1640876593
172,nottheonion,Nikoklis,businessinsider.com,Ozzy Osbourne will launch an NFT collection called 'CryptoBatz',1,1,1640875809
173,nottheonion,Nikoklis,news.bitcoin.com,Ozzy Osbourne Reveals Cryptobatz NFT Project Paying Tribute to His Iconic Bat Bite – Blockchain Bitcoin News,1,1,1640875481
174,nottheonion,ekonomihukuknot,ahvalnews.com,Turkey’s Treasury and Finance Minister Nureddin Nebati: ‘US Federal Reserve does not belong to the American public but rather is in the hands of 5 families’,0,1,1640875198
175,nottheonion,civicode,gov.uk,Strong steroid found in ‘natural’ skin cream,0,1,1640875169
176,nottheonion,Defiant_Race_7544,independent.co.uk,"Grey squirrel terrorises north Wales community, attacking and injuring 18 people",1,1,1640874002
177,nottheonion,channelchek,channelchek.com,Reddit Posts Been Paving the Way for State Marijuana Reform,0,1,1640873826
178,nottheonion,Defiant_Race_7544,ndtv.com,"""Vicious"" Squirrel Attacks 18 People In Two-Day Christmas Rampage",1,1,1640873673
179,nottheonion,BickKattowski,firstpost.com,"‘Psycho’ squirrel goes on 48-hour Christmas rampage in UK town, injures 18 people",0,1,1640873442
180,nottheonion,Ok-e-commerce,sites.google.com,GLOBAL BUYING AND SELLING,1,1,1640873101
181,nottheonion,dabdon1,pearldentlab.net,Ghislaine Maxwell’s new prison ‘will be Disneyland’ after New York cell,0,1,1640872367
182,nottheonion,Drumlin,amp.cnn.com,Amazon's Alexa tells 10-year-old child to touch penny to exposed plug socket,1,1,1640872059
183,nottheonion,maximum-sarcasm,axios.com,"Trump accuses Jan. 6 panel of ""seeking evidence of criminal activity""",0,1,1640872047
184,nottheonion,Dirtychorizo,cwbchicago.com,See a robbery happening? This alderman wants you to run toward the offenders while blowing a whistle. - CWB Chicago,0,1,1640871506
185,nottheonion,Dirtychorizo,cwbchicago.com,The ol Come back and kick me whistle,0,1,1640871377
186,nottheonion,Msajidhussain517,jobsalrats.website,How To Pass Driving Test In Pakistan In Two Minutes? E-Sign Driving Test,1,1,1640871060
187,nottheonion,Ok-e-commerce,sites.google.com,gift of life,0,1,1640870841
188,nottheonion,TheThrillist,dailymail.co.uk,Easily influenced lions,1,1,1640869890
189,nottheonion,Whosyourdad2,syracuse.com,"Upstate NY CEO resigns after accusations of forcing employees to visit strip clubs, prostitutes",0,1,1640869557
190,nottheonion,cheesuscharlie,en.wikinews.org,"TIL: In 2006, a woman farted on a plane and tried to cover up the smell by lighting matches, causing an emergency landing when passengers told cabin crew that they could smell burning matches.",0,1,1640868616
191,nottheonion,ppizzzaaa,theguardian.com,Citroën pulls Egypt ad accused of promoting harassment of women,0,1,1640868606
192,nottheonion,virlan4trendnews,virlan.co,Are the Animatronics from FNAF security breach possessed?,0,1,1640867811
193,nottheonion,sAindustrian,bbc.com,China bans its national football players from getting tattoos,0,1,1640867265
194,nottheonion,HumanNo109850364048,reuters.com,"Chinese bishops, priests brief Hong Kong clerics on Xi's view of religion",0,1,1640866973
195,nottheonion,Lumpy_Sir9208,reddit.com,hi,0,1,1640865384
