,subreddit,author,domain,title,num_comments,score,timestamp
1560,nottheonion,cheesyfluff,businessinsider.com,"Billionaire who blasted into space defended spending tens of millions of dollars on the trip, saying his critics 'perhaps have never been to space'",1,1,1640006482
1561,nottheonion,gangbangkang,huffpost.com,A School Librarian Instructs Third-Graders to Re-enact Scenes From Holocaust,1,1,1640006392
1562,nottheonion,virlan4trendnews,virlan.co,"Watch : Tasted MrBeast Burger Restaurant. How good is MrBeast Burger food, really?",0,1,1640005461
1563,nottheonion,Mexicanuck,abcnews.go.com,Muslim org fires leader for working with anti-Muslim group,0,1,1640005380
1564,nottheonion,Appropriate_Ebb7890,theguardian.com,Jewish woman accused of antisemitism by Labour threatens to sue,1,1,1640004652
1565,nottheonion,joeydebreuk,abcnews.go.com,Dozens of camels barred from Saudi beauty contest over Botox,0,1,1640004234
1566,nottheonion,AkaGurGor,theguardian.com,Chatting over cheese and wine: anatomy of Downing Street lockdown gathering | Boris Johnson,0,1,1640001122
1567,nottheonion,NeverEndingDClock,hongkongfp.com,"Hong Kong offers free transport on 'patriots' election day, but citizens seize chance to travel around city",0,1,1640000698
1568,nottheonion,Ill-Chef4943,saharareporters.com,Lagos Party Attendants Kill Guest For Collecting Food Several Times!,0,1,1640000697
1569,nottheonion,thebigjohnnyd,7news.com.au,Melbourne six-year-old and her siblings pool pocket money to buy their first home,0,1,1640000643
1570,nottheonion,FuckLogic420,ndtv.com,2 Monkeys Caught In Maharashtra In 'Revenge Killing' Of 250 Dogs: Report,1,1,1640000189
1571,nottheonion,DiePhilosoraptorDie,nypost.com,Joe Manchin’s Christmas gift to America: Killing the Build Back Better horror,1,1,1639999870
1572,nottheonion,TacoBoiler2,republicworld.com,Maharashtra: Fuming monkeys kill 250 dogs in revenge massacre after death of baby monkey,0,1,1639999857
1573,nottheonion,TacoBoiler2,thelogicalindian.com,Rampaging monkeys kill 250 dogs in India in revenge massacre,1,1,1639999746
1574,nottheonion,TacoBoiler2,nypost.com,Rampaging monkeys kill 250 dogs in India in revenge massacre,1,1,1639999558
1575,nottheonion,TacoBoiler2,timesnownews.com,Enraged monkeys kill 250 dogs to take 'revenge' after puppy kills baby monkey,1,1,1639999260
1576,nottheonion,JediFreak,wtop.com,Stafford Co. police searching for $100 ‘Hamburglar’,0,1,1639998852
1577,nottheonion,breanneorama,ctvnews.ca,Florida man kicked off flight after trying to wear women's underwear as a face mask,1,1,1639998725
1578,nottheonion,[deleted],mynewscorp.com,Government report admits there are 23.5 Million people in England who have NOT had a single dose of a Covid-19 Vaccine,0,1,1639998047
1579,nottheonion,meowroarhiss,msn.com,2 Monkeys Captured After Killing 250 Dogs in 'Revenge' Killing of Baby Monkey Murdered by Dogs,1,1,1639997930
1580,nottheonion,breanneorama,ctvnews.ca,Florida man kicked off flight after trying to wear women's underwear as a face mask,1,1,1639997667
1581,nottheonion,PullMull,telegraph.co.uk,Taliban facing grumbles over pay from rank-and-file troops as fighting for God is no longer enough,1,1,1639997574
1582,nottheonion,virlan4trendnews,virlan.co,Five Nights at Freddy’s: Security Breach. Wach Part 2. Who is Vanessa? Who is Vanny?,0,1,1639995245
1583,nottheonion,ucanews123,ucanews.com,Vatican appoints new bishop to Vietnam diocese - UCA News,0,1,1639994220
1584,nottheonion,MichaelAvenaughty,theguardian.com,Women executed 300 years ago as witches in Scotland set to receive pardons,0,1,1639993623
1585,nottheonion,Betweentheminds,indy100.com,Drink-driver downs hand sanitiser to ‘trick’ breathalyser – forgetting it’s alcoholic,1,1,1639993205
1586,nottheonion,BingBlessAmerica,nytimes.com,"Third-Graders Instructed to Re-enact Scenes From Holocaust, Principal Says",1,1,1639993095
1587,nottheonion,MajedMZCR,theguardian.com,North Korea bans laughing for 11 days during mourning for anniversary of Kim Jong-il's death,0,1,1639992718
1588,nottheonion,MajedMZCR,barstoolsports.com,"North Korea Has Banned Laughing, Drinking, Celebrating BIrthdays, And Buying Food For 11 Days To Honor The 10 Years Of Kim Jung-Un's Rule",1,1,1639992658
1589,nottheonion,Amakall,hindustantimes.com,2 monkeys arrested for killing 250+ dogs in a revenge massacre,0,1,1639990023
1590,nottheonion,Standard-Tangerine-5,aw-journal.com,Trump demands China pay $60T in 'reparations' for pandemic - Around World journal,0,1,1639989982
1591,nottheonion,Standard-Tangerine-5,washingtontimes.com,Reoperations?,1,1,1639989829
1592,nottheonion,Standard-Tangerine-5,washingtontimes.com,Trump Demands China Pay 60 TRILLION in Reparations Pandemic,1,1,1639989751
1593,nottheonion,virlan4trendnews,virlan.co,is Tom Holland still going to be Spider Man? After ‘No Way Home’,0,1,1639988091
1594,nottheonion,sllithery-sneek,truth11.com,These are your leaders and celebrities! This has to be exposed! Save the kids who are being trafficked by these disgusting individuals! How long have they actually been getting away with this!!! Our world is not suppose to be like this. The world is ran by mentally ill people!,0,1,1639984760
1595,nottheonion,Moonraker985,telegraph.co.uk,Taliban complain about working conditions,1,1,1639984463
1596,nottheonion,RealityCrave,mediatraffic.org,NCIS LA may get canceled because actor of who Murdered two women,0,1,1639983099
1597,nottheonion,adser5000,hindustantimes.com,2 monkeys captured in Maharashtra's Beed. They were involved in killing of over 250 dogs,0,1,1639982487
1598,nottheonion,takenusernameisadnow,tampabay.com,Florida schools warn students against latest TikTok challenge,1,1,1639981848
1599,nottheonion,Cosmosive_1,news.rthk.hk,High election turnout not always good says Carrie Lam,0,1,1639981176
1600,nottheonion,Knight_Alfa,telegraph.co.uk,World’s first 'Tesla baby' born as child arrives while car was being driven in autopilot,1,1,1639980656
1601,nottheonion,Bokbreath,rawstory.com,Third graders forced to dig pretend mass graves in Holocaust reenactment — then told 'Jews ruined Christmas',1,1,1639980614
1602,nottheonion,virlan4trendnews,virlan.co,"Watch : Tom Holland aka Spiderman talks about his struggles with dyslexia, his accent, &amp; success as an actor ...",0,1,1639980449
1603,nottheonion,wtcode,foxnews.com,Law prof suggests rewrites of First and Second Amendments that do not mention free press or bearing arms,0,1,1639979389
1604,nottheonion,Kattarsecular,indiatimes.com,Rise Of the Apes! Monkeys Reportedly Kill 250 Dogs To Take Revenge After Pooches Killed A Baby Monkey,1,1,1639977969
1605,nottheonion,Gai_InKognito,bbc.com,Anti-5G necklaces found to be radioactive,0,1,1639977552
1606,nottheonion,chandu6234,ndtv.com,2 Monkeys Caught In Maharashtra In 'Revenge Killing' Of 250 Dogs,0,1,1639976930
1607,nottheonion,NotRogersAndClarke,abc.net.au,Multi-Millionaire Sues Widow over $15 CD of Music (some of which the Multi Millionaire stole in the first place),0,1,1639975813
1608,nottheonion,Gravitybongos,consequence.net,Journey cassette mistaken for a bomb causes building evacuation,0,1,1639975785
1609,nottheonion,rookie_broker,theprint.in,After 4 suicides in a year — 3 by hanging — IISc begins removing ceiling fans in hostel room,1,1,1639973105
1610,nottheonion,photoalbumguy2,fox5dc.com,DCPS investigates after elementary students say they were forced to reenact Holocaust,0,1,1639971643
1611,nottheonion,photoalbumguy2,timesofisrael.com,"DC 3rd graders made to reenact Holocaust, told it's 'because Jews ruined Christmas'",1,1,1639971573
1612,nottheonion,Hajime-87,screenrant.com,Dungeons &amp; Dragons: Wizards of the Coast Removes Problematic Lore,0,1,1639969186
1613,nottheonion,steikul,nypost.com,Rampaging monkeys kill 250 dogs in India in revenge massacre,1,1,1639967278
1614,nottheonion,alexdionisos,dailymail.co.uk,Scout leaders apologise to woman who was hounded after calling a bearded man 'he' on social media,1,1,1639964158
1615,nottheonion,roxyamused,seattletimes.com,"In Leavenworth, Christmas skirmish breaks out over rebranding and Krampus Drink Crawl",1,1,1639964063
1616,nottheonion,batture,thenationalnews.com,Emergency announced in Suez Canal as 'Ever Given' container ship returns,0,1,1639959992
1617,nottheonion,throwaway_06-20,boston.com,Real-life quidditch leagues to change Harry Potter sport's name after author's 'anti-trans' remarks,0,1,1639959793
1618,nottheonion,KachaPapeeta,samaa.tv,Candidate killed by celebratory gunfire shortly after winning election.,0,1,1639958599
1619,nottheonion,commitgalaxynote7,foxbusiness.com,Portland commissioner set to vote for budget defends herself after second creditor sues her over personal debt,0,1,1639956804
1620,nottheonion,commitgalaxynote7,foxbusiness.com,Portland commissioner set to vote for budget defends herself after second creditor sues her over personal debt,1,1,1639956685
1621,nottheonion,Darth_Kahuna,france24.com,Record low turnout for Hong Kong’s first poll under new ‘patriots only’ rules,0,1,1639956474
1622,nottheonion,barathesh,france24.com,Turnout appears low for Hong Kong election held under new 'patriots only' rules,0,1,1639956195
1623,nottheonion,SketchedEyesWatchinU,google.com,Man kicked off flight for wearing women's underwear as face mask,1,1,1639955660
1624,nottheonion,SketchedEyesWatchinU,beta.ctvnews.ca,Florida man kicked off flight after trying to wear women's underwear as a face mask,1,1,1639955439
1625,nottheonion,Darth_Kahuna,abcnews.go.com,Potter's ex-chief: 'I saw no violation' of policy by officer,0,1,1639954528
1626,nottheonion,PoppyHatesTea,theguardian.com,Women executed 300 years ago as witches in Scotland set to receive pardons,0,1,1639953605
1627,nottheonion,BlackPhantom29,newscientist.com,Robotic fish scares invasive species so badly that it cannot breed,1,1,1639953415
1628,nottheonion,Darth_Kahuna,technologyreview.com,The metaverse has a groping problem already,0,1,1639953347
1629,nottheonion,ErisMorns_Third_Eye,nypost.com,Ohio police seeking thieves who stole 58-foot bridge,1,1,1639951773
1630,nottheonion,d1pl0mat_,insider.com,Accessories Said to 'Protect Against 5G' Found to Be Radioactive,0,1,1639950595
1631,nottheonion,LeFailure,eurogamer.net,Microsoft can't get hold of retail Xbox Series X consoles for this weekend's Halo tournament,1,1,1639950292
1632,nottheonion,pyriel2012,austonia.com,Murder-for-hire suspect caught after he wrote a positive internet review for one of the alleged hitmen,0,1,1639950290
1633,nottheonion,NteveSash,finance.yahoo.com,Sarah Palin says ‘over my dead body’ will she have vaccine after contracting Covid,0,1,1639949623
1634,nottheonion,NteveSash,independent.co.uk,Sarah Palin says ‘over my dead body’ will authorities make her have a covid vaccine shot,0,1,1639949571
1635,nottheonion,oliva-ova,hotstatelive.blogspot.com,"Just open an account and verify, then have unlimited phone sex. more",1,1,1639949481
1636,nottheonion,drakens6,news.mit.edu,"""DRACO"" Nanobot uses MRNA ""tags"" to identify cells for destruction",0,1,1639949211
1637,nottheonion,Bigb5wm,theatlantic.com,The Vaccine Scientist Spreading Vaccine Misinformation,0,1,1639949050
1638,nottheonion,satan69_420,theguardian.com,"‘Anti-5G’ necklaces are radioactive and dangerous, Dutch nuclear experts say",0,1,1639946694
1639,nottheonion,boricimo,theverge.com,Horseshoe crabs are in danger because everyone wants their blood.,1,1,1639946196
1640,nottheonion,quirkycurlygirly,local12.com,Report: Monkeys in India going on deadly rampage against dogs after baby monkey killed,0,1,1639944579
1641,nottheonion,anyonmoussource,abcnews.go.com,Shooting spike cancels Mississippi town's Christmas parade,0,1,1639943782
1642,nottheonion,who_ate_the_bat,independent.co.uk,Unisex changing rooms put women at danger of sexual assault,1,1,1639943738
1643,nottheonion,SuccessfulJelly,cbssports.com,Mack Brown and Shane Beamer agree to mayonnaise bath for winner of Duke's Mayo Bowl,0,1,1639943357
1644,nottheonion,Existing_Cow_3907,dailymail.co.uk,"Innocent black man, 61, who was jailed for raping author Alice Sebold after she wrongly identified him had NO idea she made millions off the story while he lived in windowless squalor after finishing 16-year jail sentence",1,1,1639943193
1645,nottheonion,XXmynameisNeganXX,rollingstone.com,Widow ordered to pay thousands for attempting to sell husband's Eric Clapton bootleg,1,1,1639942470
1646,nottheonion,XXmynameisNeganXX,washingtonpost.com,Eric Clapton sued a woman who listed a bootleg CD on eBay for $11. She now owes thousands.,1,1,1639942242
1647,nottheonion,XXmynameisNeganXX,seattletimes.com,Eric Clapton sued a woman who listed a bootleg CD on eBay for $11. She now owes thousands,1,1,1639942005
1648,nottheonion,Qlanger,newsweek.com,"Washington Senator Doug Ericksen, Who Fought Vaccine Mandate, Dies After COVID Battle",0,1,1639941438
1649,nottheonion,pacificcoasthighway,theguardian.com,Philadelphia woman gives birth in front seat of Tesla on autopilot,0,1,1639941116
1650,nottheonion,[deleted],mynewscorp.com,"Since the Roll-Out of Covid Injections There’s Been Funeral, After Funeral, After Funeral – “It’s Tragic” Says Vicar’s Wife",0,1,1639941082
1651,nottheonion,pacificcoasthighway,theguardian.com,Philadelphia woman gives birth in front seat of Tesla on autopilot,1,1,1639941076
1652,nottheonion,NamedMichael,insider.com,An elite runner pooped down her leg 7 miles into a marathon but kept going until the end — maintaining a personal-record pace almost the whole way,0,1,1639940514
1653,nottheonion,kanjibytes,rte.ie,Camels disqualified from beauty pageant over cosmetic enhancements,0,1,1639939594
1654,nottheonion,SkyTheGuy8,dailyatomic.com,"North Korean Founder Kim Il Sung Did Not Have the Ability to Teleport, State Media Admits - DailyAtomic",0,1,1639938662
1655,nottheonion,LivelyJellyfish,pilotonline.com,Norfolk police tackled a bicyclist for riding without a headlight. Bodycam footage in a lawsuit shows it all.,0,1,1639937927
1656,nottheonion,XLg7bhS3wbs47yt,euronews.com,Avatar ‘groped’ in first sexual assault incident in Meta’s metaverse,0,1,1639937651
1657,nottheonion,whiskey06,theguardian.com,How a grounded hulk is floating everyone’s boat in Vancouver. The stranded boat that broke free of its tethers has become a local celebrity – with tribute T-shirts and its own Twitter account,0,1,1639937292
1658,nottheonion,EitherThanks,theprint.in,After 4 suicides in a year — 3 by hanging — IISc begins removing ceiling fans in hostel rooms. Thoughts?,0,1,1639934954
1659,nottheonion,thornierstraw8,thejournal.ie,TIL That during WW2 Heinz invented a self heating soup can that would frequently explode.,1,1,1639932794
1660,nottheonion,GhostYogurt,bbc.com,Anti-5G necklaces found to be radioactive,0,1,1639931847
1661,nottheonion,Naar-kanger,indianexpress.com,Two monkeys captured for killing puppies in retaliation in India's Maharashtra,0,1,1639930155
1662,nottheonion,______---------,theguardian.com,Guests urged to be vaccinated at anti-vaxxer Robert F Kennedy Jr’s party,0,1,1639930144
1663,nottheonion,NewsAssociates,gifs.tribe.so,"6 years after it was shut down, PlayStation Home has been resurrected by fans",1,1,1639929821
1664,nottheonion,steikul,9news.com.au,"Necklaces conspiracy theorists wear to 'protect' themselves from 5G are actually radioactive, nuclear experts warn",0,1,1639928775
1665,nottheonion,Change_petition,nypost.com,Woman claims she was virtually ‘groped’ in Meta’s VR metaverse,1,1,1639926761
1666,nottheonion,PositiveBubbles,news.com.au,Newcastle Church of Ubuntu sacked woman for getting Covid-19 vaccine,0,1,1639926189
1667,nottheonion,virlan4trendnews,virlan.co,WATCH : Tom Holland and Zendaya Kissing in his Car,0,1,1639925510
1668,nottheonion,harmonicoasis,www-bbc-com.cdn.ampproject.org,Anti-5G necklaces found to be radioactive - BBC News,0,1,1639925088
1669,nottheonion,virlan4trendnews,virlan.co,Watch : Why Zendaya Jokingly Called Tom Holland ‘An Idiot’. His Latest Post Sparks Dating Rumors,0,1,1639924515
1670,nottheonion,sjwbollocks,insider.com,"India: Monkeys Throw Dogs Off Buildings in 'Revenge' Attacks, Report Says",0,1,1639924275
1671,nottheonion,beautifulntrealistic,bbc.com,Anti-5G necklaces found to be radioactive,0,1,1639924131
1672,nottheonion,oldguydrinkingbeer,pcmag.com,"Anti-5G Pendant Actually Causes Harmful Radiation, Dutch Authorities Warn",0,1,1639923697
1673,nottheonion,admirbudva,ladbible.com,Demi Lovato Sings To Ghosts To Help Them Overcome Trauma Caused By Sexism,1,1,1639923342
1674,nottheonion,virlan4trendnews,virlan.co,Did Tom Holland and Zendaya ever date?,0,1,1639923175
1675,nottheonion,Bonnie817,melaniatrump.com,Neiman Marcus is selling Non Fungible Tokens of Melania Trump’s cobalt blue eyes,0,1,1639922949
1676,nottheonion,lovehugebutt,google.com,It's monke vs doge in India.,1,1,1639922878
1677,nottheonion,lovehugebutt,google.com,It's monke vs doge in India.,1,1,1639922713
1678,nottheonion,virlan4trendnews,virlan.co,"Tom Holland Age, Height, Wiki, Bio, News, FAQ",0,1,1639922063
1679,nottheonion,goast_cat,bbc.com,Monkey offered cocaine and flushed down loo recovering,0,1,1639920266
1680,nottheonion,languidcorpse,theguardian.com,Baby driver: Philadelphia woman gives birth in front seat of Tesla on autopilot | Tesla,0,1,1639920212
1681,nottheonion,Naar-kanger,timesofindia.indiatimes.com,India: 2 monkeys caught for killing puppies,1,1,1639919141
1682,nottheonion,Gold-Egg7376,mestreculinaria.com,Bolo recheado com mousse de limão e leite condensado caseiro,0,1,1639918559
1683,nottheonion,life_is_a_pain,ndtv.com,2 Monkeys Caught In Maharashtra In 'Revenge Killing' Of 250 Dogs: Report,0,1,1639916935
1684,nottheonion,redditforgets,india.com,Monkeys in an Indian village have k*lled 250 dogs by dragging them to the top of buildings.,0,1,1639916127
1685,nottheonion,Godlymod,gifs.tribe.so,Pope Francis says extramarital sex sins aren't that 'serious',0,1,1639915976
1686,nottheonion,redditforgets,google.com,Monkeys Kill 80 Puppies in Gang War With Dogs.,1,1,1639915496
1687,nottheonion,MagicLobsterAttorney,bbc.com,Anti-5G necklaces found to be radioactive,0,1,1639914956
1688,nottheonion,Godlymod,gifs.tribe.so,Strange 'droning noise that makes locals' bodies vibrate' spreads to village nearby,0,1,1639914900
1689,nottheonion,Godlymod,gifs.tribe.so,Strange 'droning noise that makes locals' bodies vibrate' spreads to village nearby,0,1,1639914896
1690,nottheonion,Godlymod,gifs.tribe.so,Nevada Man Claimed to Have Proof of Illegal Voting Takes Guilt Plea to Voting Twice,0,1,1639914693
1691,nottheonion,Hot-Inspector-3910,certifiedintel.com,Beta tester claims she was virtually 'groped' in Meta's virtual reality metaverse,0,1,1639914432
1692,nottheonion,Knight_Alfa,foxnews.com,CNN guest advises people to wear masks at Christmas whether 'vaccinated or not',0,1,1639914333
1693,nottheonion,hrsmn,bbc.com,Anti-5G necklaces found to be radioactive,0,1,1639913813
1694,nottheonion,Fancy_Combination452,youtu.be,2021.12.19晚，小圓子，開播！,1,1,1639913342
1695,nottheonion,hyperqbit,oregonlive.com,"Fox News forgets Washington State Senator Dough Ericksen died…Ooh, free puppies and kittens for everyone!",0,1,1639910776
1696,nottheonion,Godlymod,gifs.tribe.so,Nevada Man Claimed to Have Proof of Illegal Voting Takes Guilt Plea to Voting Twice,0,1,1639910138
1697,nottheonion,hyperqbit,donaldjtrump.com,"Fox News forgets Washington State Senator Doug Ericksen died. Instead, we are redirecting you to spoke person for Fox News website",1,1,1639909507
1698,nottheonion,danielce12,mynewscorp.com,A comprehensive guide - How Americans can resist coronavirus shot mandates!,0,1,1639909003
1699,nottheonion,Godlymod,gifs.tribe.so,Strange 'droning noise that makes locals' bodies vibrate' spreads to village nearby,0,1,1639908991
1700,nottheonion,dmnksaman,complex.com,Man Arrested After Robbing Bank and Then Depositing Money Into ATM Outside,1,1,1639905902
1701,nottheonion,richh00,bbc.co.uk,Anti-5G necklaces found to be radioactive,0,1,1639905441
1702,nottheonion,shashroy,opindia.com,"‘Women who go out after 9 pm are prostitutes, they deserve to be raped’: Kerala’s Islamic cleric Swalih Bathery",0,1,1639903804
1703,nottheonion,Godlymod,gifs.tribe.so,"Facebook exposes mercenary spy firms that targeted 50,000 people",0,1,1639903101
1704,nottheonion,ashpd17,theprint.in,After 4 suicides in a year — 3 by hanging — IISc begins removing ceiling fans in hostel rooms,0,1,1639903060
1705,nottheonion,SodaPuffin,kwtx.com,Local school districts relieved as a Tik Tok threat of 'national shoot up your school day' ends with no shootings,0,1,1639902647
1706,nottheonion,Godlymod,gifs.tribe.so,"Facebook exposes mercenary spy firms that targeted 50,000 people",0,1,1639902352
1707,nottheonion,Godlymod,gifs.tribe.so,Nevada Man Claimed to Have Proof of Illegal Voting Takes Guilt Plea to Voting Twice,0,1,1639902315
1708,nottheonion,Godlymod,gifs.tribe.so,Strange 'droning noise that makes locals' bodies vibrate' spreads to village nearby,0,1,1639902298
1709,nottheonion,calbert1735,heartlandsignal.com,GOP gubernatorial candidate’s campaign video celebrates Minnesota with stock images from Eastern Europe,0,1,1639901959
1710,nottheonion,Maxwelpet,bbc.com,At least they wont get that 5G flu.,0,1,1639901934
1711,nottheonion,legendariusss,samoaglobalnews.com,"Intoxicated Driver Escapes Injury from Accident, but gets Knocked Out by his Brother",0,1,1639901710
1712,nottheonion,KrabbMannder957,amp.cnn.com,Kamala Harris lets Charlamagne tha God know who the real President is aka CNN trying to spin some bs lol,1,1,1639900929
1713,nottheonion,KrabbMannder957,amp.cnn.com,Kamala Harris lets Charlamagne tha God know who the real President is aka CNN is trying to spin some bs lolololol,1,1,1639900611
1714,nottheonion,PanJaszczurka,theguardian.com,Alabama man accused of feeding caged 'attack squirrel' meth | Alabama,0,1,1639900160
1715,nottheonion,EMPulseKC,thehill.com,Biden administration reverses Trump rule allowing more powerful shower heads,0,1,1639899114
1716,nottheonion,zzzz401,theguardian.com,People are paying for KFC to be smuggled through tunnels into Gaza,0,1,1639898477
1717,nottheonion,Sarahclaire54,newsbreak.com,Police on the lookout for thieves who stole entire 58-foot bridge,1,1,1639897587
1718,nottheonion,zzzz401,nytimes.com,KFC 12 piece buckets have been smuggled through tunnels into Gaza,1,1,1639897569
1719,nottheonion,GreenTeaOnMyDesk,insider.com,Florida man who was kicked off a United Airlines flight over wearing a red thong on his face instead of a face mask compared himself to civil-rights pioneer Rosa Parks,1,1,1639897374
1720,nottheonion,leyla00,bbc.com,"Necklaces and accessories claiming to ""protect"" people from 5G mobile networks have been found to be radioactive",0,1,1639894767
1721,nottheonion,Pensyfan19,people.com,Billie Eilish Says the Met Gala Made Her Realize 'Famous People Are Just Literally Nobodies',1,1,1639894686
1722,nottheonion,RealityCrave,mediatraffic.org,NCIS LA &amp; Amazing Race Actor Arrested On Set For Murder Of 2 Women,0,1,1639894658
1723,nottheonion,baylonedward,gamespot.com,Xbox Shortages: Microsoft's Own Pro Halo Infinite Tournament Is Using Development Kits For Some Players,1,1,1639894085
1724,nottheonion,canadaoilguy,businessinsider.com,"'QAnon Shaman' Jacob Chansley compared himself to Gandhi, Martin Luther King Jr., and Jesus Christ in interview from prison",1,1,1639893169
1725,nottheonion,ze_kat,newsweek.com,Group of Monkeys Kill Over 250 Dogs for 'Revenge' in Indian Town,1,1,1639893121
1726,nottheonion,BeepBoopBeep3000,austonia.com,Murder-for-hire suspect caught after he wrote a positive internet review for one of the alleged hitmen,0,1,1639891564
1727,nottheonion,Fancy_Combination452,youtu.be,2021.12.19早，老白，開播！,1,1,1639891337
1728,nottheonion,Godlymod,mirror.co.uk,Strange 'droning' noise bothering locals for year spreads to village nearby,1,1,1639890464
1729,nottheonion,Godlymod,gifs.tribe.so,Strange 'droning noise that makes locals' bodies vibrate' spreads to village nearby,0,1,1639889311
1730,nottheonion,Godlymod,gifs.tribe.so,Nevada Man Claimed to Have Proof of Illegal Voting Takes Guilt Plea to Voting Twice,0,1,1639888881
1731,nottheonion,AspectImpossible3271,www-bbc-co-uk.cdn.ampproject.org,Anti-5G necklaces found to be radioactive - BBC News,0,1,1639888831
1732,nottheonion,Financial_Lime_252,newsnationnow.com,Mississippi man facing 5 years in prison for shining lasers at planes,0,1,1639887730
1733,nottheonion,[deleted],mirror.co.uk,Cleaner walks out of office after 'mortifying' Elf on the Shelf prank by workers,1,1,1639887196
1734,nottheonion,popsicler1,newsbreakapp.com,Police on the lookout for thieves who stole entire 58-foot bridge,0,1,1639886976
1735,nottheonion,popsicler1,newsbreakapp.com,Police on the lookout for thieves who stole entire 58-foot bridge - NewsBreak,0,1,1639886893
1736,nottheonion,idiotsavant419,thehill.com,Biden administration reverses Trump rule allowing more powerful shower heads,0,1,1639885975
1737,nottheonion,Frequent_Flyer_2025,dailysnark.com,Washington Football Team Planning To Start Plus-Size Male Model Vs. Eagles Due To COVID-19 Outbreak With Team,0,1,1639885747
1738,nottheonion,Oolican,ctvnews.ca,"'Anti-5G' jewelry and accessories are radioactive, Dutch authorities warn",0,1,1639882595
1739,nottheonion,seattle11,bbc.com,"Necklaces and accessories claiming to ""protect"" people from 5G mobile networks have been found to be radioactive",0,1,1639882402
1740,nottheonion,giraffe-legs-11,plantbasednews.org,Company Launches Haunting Factory Farm Playset For Christmas,0,1,1639881097
1741,nottheonion,RIP_RBG,usatoday.com,Browns' Odell Beckham Jr. on COVID-19: 'I don't think it's going to enter this body...it's a mutual respect',0,1,1639880439
1742,nottheonion,justbethescandal,moneyinvestors.net,Is Dogecoin the future? How far could this crypto go?,0,1,1639880064
