body_alltext,Sentiment_Type,huggingface_sentiment,t5_emot
“ Sucks donkey balls ” I love how graphic that is . Tomorrow I shall work that into a conversation . Thank you sir !,NEUTRAL,Positive,joy
if you could be anyone who would you be ?,NEUTRAL,Positive,anger
"I feel for you . I have some friends but they are too busy with their own lives to care about mine . Which is okay because I don ’ t want to ever force anyone to deal with me if they don ’ t want to . I currently don ’ t have money for weed but when I did , it was my crutch to get me through the day . Without weed I feel life is dull and lackluster . I do smoke CBD but that only helps so much . When I smoke , it makes me feel more capable of handling things that I normally wouldn ’ t . The way I see it , it ’ s either weed or something worse so I smoke weed lol . I completely agree with you being sober sucks donkey balls . That ’ s something people will never understand until they ’ ve experienced it chronically , is the constant psychological pain . To them you ’ re fine on the outside but are dying on the inside , trying to find a way out . I ’ ve only just recently discovered why I have the issues I do so I ’ ve always been depressed and anxious just never realized it , definitely made everything worse by pretending I was fine . I ’ m sorry about your diagnosis , can ’ t imagine what it ’ s like to lose your hair on top of all the stress you go through . I hope everything works out . I also hope that this makes you feel a lil better : you ’ re the one that inspired me to write this . I ’ ve never written this much to someone online in what feels like forever !",NEUTRAL,Neutral,sadness
( ღ ˘ ⌣ ˘ ) :heart_suit: 𝓼𝓮𝓷𝓲𝓷𝓰 𝓶𝓾𝓬𝓱 ℒ ♡ ⓥℯ 𝕥𝕠𝕠 ㄚ ♡ ⓤ,NEUTRAL,Negative,love
"Life is shit a lot of the time . Feel free to message me if you want friend sometimes you just need people to talk to . It's hard making friends cause like how the fuck do you actually do that . But ye , I'm open for random messages",NEUTRAL,Positive,joy
Thanks everyone for commenting it ’ s a some scary times out there I ’ m trying to make it through I ’ ve been getting more anxiety and panic attacks as of lately and the vistaril dosent help should I say something to my psychiatrist,NEUTRAL,Negative,fear
Passion flower is really great for anxiety . It can be found sometimes in tea form . I get in bulk . Powder & either drink w honey n hot water . or put in capsules,POSITIVE,Positive,joy
"Thank you for believing me and not calling me crazy , even when I feel crazy . I'm looking for a therapist . I haven't told past therapists about the stalker .",NEGATIVE,Positive,fear
"This . Also , stay away from drugs and alcohol because they alleviate in short term , but aggrevate times ten long term . Have hobbies , positive experiences , good relationships . Get good sleep and exercise . Depression sucks , especially when you ’ re young , but you ’ re going to find your way",NEUTRAL,Positive,joy
That was a heavy read . Life is just harsh sometimes . I hope it gets better for you and everybody else,NEUTRAL,Positive,sadness
I wish i can tell you its gonna be okay but unfortunately we are in the same hell hole . :person_facepalming: :light_skin_tone: ‍ :female_sign: ,NEUTRAL,Negative,joy
Advertisement for what ?,NEUTRAL,Positive,fear
remove the link in order for us to approve the post,NEUTRAL,Positive,anger
Rewrite this so it doesn't sound like an advertisement . It's why it's been removed from several subreddits you posted on .,NEUTRAL,Positive,anger
Remove your # 3 if you want me to approve this comment . This is all your own personal ideology .,POSITIVE,Positive,anger
"I really don't know . Posts like this are one of the biggest reasons for why I feel that depression really is , or at least can be , a chemical balance in the brain . At least from the surface , you have all you want , or at least the girl of your dreams , and yet you are still depressed . I would suggest a few things that could help , though . 2 ) Gratitude and keeping a gratitude journal - this is a highly advisable activity that I hope you engage in and that you take this advice to heart . It has been scientifically documented that keeping a gratitude journal over the course of several weeks to months , writing in it periodically ( maybe 1 - 3 times per week , at least 5 things each time ) and - and this is key - feeling the gratitude and appreciation for the things you write and list down in it in your heart , well this has been scientifically proven through documented research that it can and does improve and increase a persons baseline level of happiness ( the average level of happiness from which a person feels on any given occasion , which is basically how happy or sad a person feels when nothing significant as happened to lessen or improve their happiness or their life , the average mood and emotional frequency in which a person inhabits . ) - well , it has been proven that keeping a gratitude journal over a period described above can and is able to raise a persons baseline level of happiness by up to 25 % ( or even higher , probably , too . ) . So , therefore , by acting grateful through writing out 5 good things you have in your life on paper or that you have going for you in a journal for gratitude , you can , over time , raise and improve your mood and quality of life possibly to a significant degree and level ! 2 ) Exercise - weight lifting , but and especially , walking and / or running outdoors - exercise has been a time tested and verified mood improver and cognitive enhancer . Often times , when we exercise , we are able to tap into our God given neural pharmacy of sorts , so to speak - our brains release endorphins which raise and lift our moods and our spirits , usually ( depending on the workout or exercise ) for several hours afterwards . If depression is a chemical imbalance , AND IF your anti-depressants have not worked as desired - - YET - - then , maybe you could make yourself happier , chemically speaking , via a daily workout and exercise regime . ALSO , walking and / or exercising in some form outdoors , especially and specifically during the daylight , is another proven way to affect your mood in a positive way as exposure of oneself to daylight is crucial to a persons mental wellbeing and sense of happiness and contentment in life as well . 3 ) Spirituality - whatever God you may or may not believe in ( personally I'm a Christian ) could be a very positive addition to your life if you choose to cultivate a deeper understanding of who God may be as well as what He encompasses , meaning , what that truth of His existence would mean for you and the way you have been designed and are meant to live life according to Him . What I can start you off with is that God is love and through love you can find a sense of connectedness and in doing loving acts and cherishing what you have as well as cultivating more love within you , your heart and soul , you can thus become more spiritual with or without any God involved ( though I'd certainly advise you to begin to research the various spiritual paths up until you find a pathway that seems the most logical to be a reflection of the nature of God ( I guarantee you that there is more to God than any 1 religion or religious text can even begin to describe or allow you to know , however , so much of what you or me or anybody knows about God who is a true beliver often comes down to what we are given as a portion from Him for our faith , meaning , what we can learn about God through our various life experiences and lessons which He uses for good in our lives to teach us and so we grow and mature as spiritual beings ) . 4 ) Meditation - As with an approach and effort towards spirituality , meditation and mindfulness is another crucial component and key step towards a mentally happier and healthier wellbeing and life . You could look it up and you will find countless articles and studies which show the positive impact and benefits / effects of a DAILY ( It MUST be DAILY for the benefits to be of any lasting or significant value , though initially you may likely still feel the relaxation of course because of its nature of peacefulness and calmness ) - of a DAILY meditation regime ( a 20 minute session each day is all you need by the way ) including ( but not limited to ) an increase in grey matter in the brain and a growth within a meditator's amygdala ( the portion of the brain which regulates hormones and counteracts anxiety and stress from what I can recall ) so there are real , physical changes which come about with meditation upon which you can be changed mentally and emotionally for the better , as well as other happiness inducing benefits which naturally arise and come from a meditative and mindfulness based way of life - look it up , there are many significant positive effects of this daily activity and habit you could and should take up . 5 ) Begin to read self-help books and watch self-improvement based videos on YouTube - - meaning , take up self-development - this could change your life in so many ways it's ridiculous ( providing you begin applying the material you are reading and / or watching ) trust me on this , I would explain ( and could if you ask me to ) but I am getting tired of writing atm ahaha . 6 ) Go to talk therapy / Begin to see a counselor or a therapist in person preferably , although if that is too expensive go to better help I think it's called or find another good therapy sight which you could afford ( or try out 7 - cups - - [ https://www.7cups.com/ ] ( https://www.7cups.com/ ) ) as it is basically a website of FREE THERAPY - My best former friend who died by a suicide 2 years ago first told me about this and I'm amazed at how cool and good o fa site it is and I actually just remembered it a bit ago while writing this and am looking forward to using it again soon today lol ) . 7 ) Maintain and / or keep a close relationship / cultivate a closer relationship with your family and / or loved ones . This is again a very good idea for greater mental and emotional wellbeing and happiness as this is one area of life that truly matters and actually , in my opinion , counts the most at creating the greatest meaning in and to a life which a person is alive to have and to actually live , too .",NEUTRAL,Negative,joy
Being content and being able to be myself .,POSITIVE,Positive,joy
"You are stronger than you know . Take it hour by hour , then it will be day by day , and week by week . The pain may never go away , but your strength will grow , and it will be manageable . Ask for help when you need it .",NEUTRAL,Positive,joy
"You don't sound crazy . I think you are understanding what I am saying but your mind is not fully accepting it . I might be wrong here but I am just saying what makes sense to me . Its hard to explain these situations . What your ex did was wrong too . He didnt wanna understand anything and chose the lame way out . You shouldn't try to pretend it didn't happen cuz its not possible and you are just neglecting something you need help for and its gonna start affecting you more unconsciously . Your ex sounds so immature , ignorant and selfish . I am glad hes an ex . This is trauma . Theres nothing wrong with you . Theres just this part of your brain that needs to heal and you gotta allow it to heal instead of burying it deeper cuz ignoring doesnt work . You said you couldn't explain why you didn't hurt the stalker ? There could be two possibilities . Either you were too scared and confused everytime you saw him or there was this guilt deep down in your heart that its all your fault which is absolutely not true as I said earlier . Maybe what happened made you lose confidence and your brain wanted to punish itself by allowing it to happen . Could be anything . You should really seek professional help cuz it might not seem like a big deal but it is . You didnt deserve all of this .",NEUTRAL,Negative,sadness
"I am so sorry lifes been so harsh . What you went through sounds horrible and you are truly a brave soul for making it this far . You should seek professional help . It gets better . It takes time to find the right therapist and right medication , the one that suits you , but its all worth it in the end . Even if it doesnt completely help , it will help you heal a bit .",NEUTRAL,Negative,sadness
"It will get better friend . Trust me , been there . It sucks so much . You need some time maybe to figure things out or maybe a little break from everything to just relax . Just dont get stuck at one point . You gotta keep moving and fighting . Hope time eases everything for you .",NEUTRAL,Positive,sadness
You are not a black sheep . I am sorry you feel this way . Hope things change and you feel better . Sending love . Stay strong and get help . Theres so much in this world thats waiting for you . Good things take time but they happen .,POSITIVE,Negative,joy
"I guess that ’ s why then , it ’ s hard to meet people if your at home . I ’ m sure if you were around people you wouldn ’ t have any trouble making friends . Just your circumstances I guess .",NEUTRAL,Positive,joy
"You don ’ t need your dreams to come true to be happy , just enjoy the small things in your day . Little things , interactions with the people around you , the sun the wind the moon the stars , the rain . It ’ s a beautiful world , just try to appreciate it now rather than some point in the future . I do hope all your dreams come true though , it sounds like a great life .",POSITIVE,Positive,joy
"Unfortunately when it comes to mental health issues a pill usually isn ’ t a fix all because of emotions . I ’ d try some holistic healing practices as well . Yoga , meditation , journaling and therapy ( if ur parents can afford ) Also some thing else that helps is rage journaling or sad journaling where you give yourself 5-10 to write whatever you want during a hard emotion or panic attack . Just let it all out say insane things lol just release basically . Then you don ’ t read it again just leave it on the page . I know it sounds silly but it helps clear the mind since usually you ’ d keep these things inside I hope you feel better soon ! I started dealing with depression at 12 and I ’ m 30 now so i can say objectively it gets better but it does take a lot of work . Good luck !",NEUTRAL,Positive,joy
"To be loved back by the person I love . To feel wanted , desired , needed , special . To know I have my person , my team to rely on . To make it worth living because they are at home for me to come back to .",POSITIVE,Positive,love
I'm so sorry to hear that . Just focus on your health and hope you get better soon .,NEUTRAL,Negative,sadness
Thank you I go to therapy once a week I ’ ve been going for upwards of 2 years,NEUTRAL,Positive,joy
That ’ s sounds terrible . Maybe try going to get a councilor she could help you figure things out that you never thought about before . I will pray for you . I hope you get better,NEUTRAL,Negative,sadness
"Its hard man , its hard to find love and hold it . To be desired is another thing , thats more lust or greed then what ypu really want , which is compassion",NEUTRAL,Positive,love
"It aint selfish bro , and I know wha",NEGATIVE,Positive,anger
I want to be loved and desired . To not be so alone . It's exhausting .,NEUTRAL,Negative,love
"If you see this , I'm interested in hearing an update on your status regarding these posts . I'm your same age .",NEUTRAL,Positive,joy
"I see what you mean , im glad you have a hopeful fantasy of your future . I think everyone does , but yours seems nice - - and like actual happiness . Happiness isn't a constant state of being though - - it comes and goes like all emotions . Imagine instead of happiness we strived for anger ; Its hard to be angry \ * all \ * the time . ( shitty analogy but you get the point . ) I think , what we really want , is to be content . to have goals , to be constantly full of desire but grateful for where we are . I want to be content where I am , to have things and people I love , to be able to make a difference . Not necessarily constant happiness . I think all we can really do with depression , is find the few things that make it worth living . the only thing thats been making me happy recently , is romance manga and video games . Its shallow and looked down upon . But , right now , those are my things worth living for . It might be selfish but its my reason and Im going to hold onto it until it doesnt make me happy anymore . I think the point is to find the people or things that make life worth living . Things that make you still want to exist . Its not about some huge purpose or continuous happiness , its just , finding things that matter to you . With depression , you mostly lose sight of all of that . the only thing we can do is keep trying to find things that matter to us , to make us want to at least read one more chapter or visit that person at least a few more times .",NEUTRAL,Positive,joy
Painfully aware,POSITIVE,Negative,joy
"I've actually had to read this a few times . I feel like I'm understanding what you say , but not feeling it . I probably sound crazy . My ex-boyfriend knew about the stalker and always asked why I didn't hurt him . I could never explain my reaction . My ex only knew about one time the stalker assaulted me . I'd told my ex hoping he'd protect me . Instead he left me . I feel like his reaction matches how I feel about it myself . I've been trying to just forget and pretend it didn't happen , but everything reminds me of it . My ex got mad I didn't want sex anymore . I just kept seeing the stalker in my mind instead of my ex , and my ex was offended , said I wanted it , I was cheating on him . I kept thinking what is wrong with me ?",NEUTRAL,Negative,love
"I pray I'll forget , but I doubt I will . I've never thought of suicide as the coward's way out , but maybe it was for him ? Maybe he felt guilty and didn't know how else to stop himself ?",NEGATIVE,Negative,sadness
Thank you,NEUTRAL,Positive,joy
"Sending love your way bro :red_heart:  I ’ m sorry life doesn ’ t seem to he going your way at the moment , maybe try tackle one thing at a time , be it your job , relationship , or training / understanding your dogs behaviour . You ’ re only human , like the rest of us no need to put so much pressure on yourself to change everything at once .",NEUTRAL,Negative,sadness
You sound exactly like me . I wonder how you are right now ? Did you manage to beat the brain fog and get your studies done ?,POSITIVE,Positive,joy
Just want to say thank you . It ’ s always better to know you ’ re not alone and to hear words like this,POSITIVE,Positive,sadness
Been there . Still there .,NEUTRAL,Negative,sadness
"Thank you for commenting Thank you for your kind words and optimism . I'm not sure , to be honest I may have given up already , I just can't see how things could get better , they always get worse it seems , it's been that way for years . Would be nice if there was something that would work but doesn't seem likely Annoyed Thank you , wish the best for you too , hope you're ok",POSITIVE,Negative,joy
"It's like slow suicide isn't it . 2020 I had two very deliberate attempts , I saw what they did to my family , hoe much distress it caused . Last year I just ate and drank silly amounts of stuff , like I'd sit and eat a full pack of parmesan cheese or huge bars of chocolate - knowing it wasn't good for me , knowing that at my age it could easily put me into heart attack zone ... it would look like a heart attack when in fact I'd sabotaged my health so badly it was a slow suicide . I also danced way to close to fatal doses of codeine etc but it would have appeared as an accidental overdose ... I'm all aches and pains and discomfort because of that now , because of the amount of codeine I've taken , because of all the shit I've put in my body . I've a wife and kids , the three eldest are adult enough to know I've struggled and thar it's not them , it's me , but I can't put that on my 6 year old ... I can not have her have such a horrible thing happen and then qs she gets older realise what I've done . I'm left so damaged by the fact that my blood family , my parents and sister just treat me as something to toy with , tried to manipulate my emotions etc , took chances on my mental health and security and exploited my vulnerabilities . I'm not sure why my parents , moreso my mother , would do that ? Whats important for me is that the kids know that it's not them causing the issues , it's my childhood and emotional abuse from people I'm supposed to have trusted , causing me the issues . I've been left to deal with the fallout from my mothers mental health issues , that she refuses to recognise , but I've recognised mine and I'm determined to not have the next generation to handle mine . My 6 year old especially doesn't deserve to have her life ripped apart like that , so I'm working hard to undo all the damage I've done to myself and change the environment around me to make it easier to have headspace I live in such a cluttered , overcrowded house that my mind will never be tidy until the house is , so that's one of the big things this year . I've identified all my triggers now I think , whereas I wasn't able to through the fog of medication etc , so now I'm free of all thar it's time to work on each trigger and change it . Not easy , there will be bumps in the road but for the first time in ages It feels progressive , I'm just taking baby steps instead of massive leaps like I have in the past",NEUTRAL,Negative,joy
"Agreed , I'm a hygiene freak , normally shower everyday , brush teeth , keep beard shaped etc etc . Last few years haven't been easy and I can defo identify with the personal hygiene thing . A couple of things I employed to help ... Wash cloths - I bought a multicoloured pack and I ensure that vitals get done every day , so face , pits and nether regions , obviously using different colour cloth for lower parts . I have a set upstairs and a set downstairs Likewise I moved my toothbrush downstairs and always have a bottle of mouthwash nearby ... I've always hated my toothbrush being in the bathroom anyway but I moved it downstairs as I'm more likely to use it . I think depression messes wirh your routine , the procrastination and the anxiety about approaching tasks makes your routine just go crazy , I'm trying my hardest to get routine back but I'm tackling each and everything individually The last few years I've been overwhelmed by having far too much to handle and the last few weeks I've started to just box things off and come to it later and deal with each thing in turn and with my complete attention .",NEUTRAL,Negative,fear
"You shouldn't be embarrassed to tell ppl what you do . You are contributing to the society even if its just in a minor way . These jobs exist for a reason and ppl depend on the workers who work there . Without the workers , it wouldn't be possible . I am sorry to hear you feel this way . Hope this year is better for you . Goodluck ! Its okay if you are a slow learner . It will take time but you will still be excellent at something so go for something you think you wanna do . Dedication and hard work matters more .",NEUTRAL,Positive,joy
I really needed to hear this . Thank you .,NEUTRAL,Positive,joy
I am sorry . Hope things improve for you and you find peace . There are many things in this world . Many that you havent even discovered . There are many opportunities too which sometimes a person might be currently unaware of . Keep fighting man . Seek professional help . It might look like theres no hope but therapists work great . You dont need to fight all of this alone cuz you deserve better .,POSITIVE,Negative,sadness
Sounds horrible . I am truly sorry . Hope you find genuine happiness and peace in life .,NEUTRAL,Negative,sadness
I am really sorry man . Hope this year is better and you find what you seek ! Wishing the best for you .,POSITIVE,Negative,sadness
I am really sorry . Sucks when you try and it doesnt work out . Hope this year you find happiness and peace . Dont give up just yet . There must be something that would work for you . Keep fighting . You made it this far and I am happy you have been trying . Wish the best for you !,POSITIVE,Positive,joy
"You do what you did earlier . You were strong enough to dig yourself out before and you are strong enough to dig yourself out again now . I am so sorry mate but you cant stay there right ? If you stay there , the hole will grow deeper and deeper . You need to find internal peace again . As a fellow human , I care about you and its not just words . You can do it . Assuming you still visit your therapist , tell him about it . If you dont then seek help again . They will have the best advice for you . Its a new year . Give it a new start and a new push and make this year the best for yourself . Theres many people out there who feel the same way so you will not always be lonely . Goodluck !",NEUTRAL,Negative,sadness
