body_alltext,Sentiment_Type,huggingface_sentiment,t5_emot
"I read all of it . Felt like I was reading my life story . My father was not in navy but he was and is same . My father and brother hate each other too and barely talk to each other now cuz of similar things that happened between your brother and father . But they live in the same house . I am glad my brother compromised and doesnt come out of his room when he comes home . Poor mother of yours . Hate how mothers are also always dragged into all of this . I feel sorry for you . Feels like you and me are alike and might be from the same place too . My result was bad this year too due to stupid covid marks distribution . Your brother is 27 and acts the same way as my brother . Took me a while to realize that . He was abused right ? Now hes abusing others with his toxic behaviour . This should not be accepted . He needs to fight it . Think about it . He was abused and its wrong . Now he is the abuser so why is it not wrong ? This cycles gonna continue if he keeps behaving like this and yall will be at fault too if you keep accepting it . Wrong is wrong and theres no excuse for it . I suggest trying to get him to therapy . You are the younger child . I feel bad for your brother but he cant do what hes doing . Therapy is the best for him . The truth is no one can help him except himself . You can try and provide assistance and care but thats all . If hes stubborn and doesnt wanna get better then leave him . Keep checking up on him and show care but theres nothing else you can do . You cant waste your life on him cuz theres no guarantee that hes gonna actually try . You are not required to set yourself on fire to keep other people warm . Its your life . Dont waste it . Move to a college campus and do whats best for you cuz staying isnt gonna do much and its not your responsibility to deal with all of them . You dont need to be so selfless . You dont wanna end up like your brother . Knowing your father , hes reaping what he unfortunately sow . I am again really sorry and you dont need to feel bad for doing whats best for you . Btw your post is very long thats why theres not many people replying . Try making a shorter one if you still want advice . Goodluck !",NEUTRAL,Negative,sadness
"Hey man if you ever just wanna rant about your life and need someone who would listen then I would be willing to be an ear . I am sorry about 2021 but fuck it , its over . I hope 2022 is a lot better for you . Goodluck ! Hope you find happiness .",NEUTRAL,Positive,joy
"Most people who act abusive have been abused earlier in life . Different people react differently to abuse . But theres one thing that took me a lot of time to learn and you should know too . Wrong is wrong and theres no excuse for it . The guy sounds like he didnt love you . He was obsessed with you instead . If a person says no , it means no and anyone who tries further , without the other person showing any signs of attraction , hes the one whos at fault . As much as suicide sounds bad , its not your fault at all . The guy couldn't handle things well that he had ruined with his own hands . You are a human and you have some rights which he violated . I am so sorry . As much as it breaks my heart reading all of this , I am glad you are still here with us and that you made it through . I am sorry about the people who did nothing . But you are not at fault . The guy sounds like a narcissist and he hurt you . I advice you see a therapist cuz all of this sounds horrible and he might be able to help you cope with it . And no , if you were not able to protect yourself , then its understandable too . Most people freeze when situations like these happen . I hope this year is the best one yet for you :purple_heart:",NEUTRAL,Positive,sadness
"Hey man , I ’ m in a similar situation where I have a friend where she and I used to talk for long periods of time and then out of the blue they just starting appearing and disappearing of the radar . And long story short it ’ s just so infuriating to know they didn ’ t value the friendship as much as I did . Plus with shit at home and just constant rumination about life , it just doubles the depression . Honestly I can ’ t feel shit because my happy persona it feels like I left it with them . I don ’ t have any life changing advice but I understand where you ’ re coming from and how important it is for you to vent right now . All I can say is take one things at a time , and you deserve the mental head space from that chick and from your household . All I do is watch anime and listen to ghibli music while in the household and honestly those quiet moments are probably the only happy parts of my day and keep me slightly motivated . But yeah man , if I were in your situation I would never contact that girl again and to the best of my ability walk away / be silent around your folks until you can get out again . I think there ’ s a lot of power in walking away than just going through the motions . Have a good 2022 .",NEUTRAL,Negative,joy
"Already go to therapy every 2 weeks , have been going pretty consistently for the past 2 years now . Does sweet fuck all . And I guess I ’ m having a pretty extreme bout of anhedonia , cause I don ’ t enjoy anything at all , it ’ s actually a huge issue for me right now , but again , therapy doesn ’ t help it and neither does medication .",NEUTRAL,Negative,joy
"You can visit the mental health doctor for treatment , try to do something you like , remember all the positive stuff you got in your life . Life depends on you .",NEUTRAL,Positive,joy
"> to spend this night thinking how nothing has changed , or how everything has only changed for the worst , or mourning the life of your old self that used to be so innocently excited for the future just for all of their dreams to be crushed . My thoughts exactly , it's hard to find a motive to keep going other than being scared of death . I wish I was a kid forever , because if he saw where I am now , he would have been so sad and disappointed . But unfortunately we can't change the past . I still want to make my kid self proud of me . This world has so many new exciting things for us to try before we go , even if it's just a small hobby or interest , or a new recipe to try . I wish you a better year this time OP .",NEUTRAL,Negative,sadness
"Man I attempted suicide twice . I'm numb to everything now . I don't even have the want to die anymore , just letting life take it's course . I can't tell if this is worse than being suicidal or not .",NEGATIVE,Negative,sadness
Yes I get up and feeling energized . I am full of energy in the morning . Never ever having suicidal thought . It is scary . Yes hobbies and activities bring me joy . Enjoying something makes the world looks beautiful and comfortable to be living in . You can feel it too with a proper treatment .,POSITIVE,Positive,joy
"Alright , I have never said this to anyone before because it's hard to say to someone knowing they won't understand but since I've seen something close to it now I'll say it ! Around the end of my Sophomore year in High School I stopped taking care of myself in all aspects . This went on for the rest of my years in High School . I would literally spend an entire week without brushing my teeth or properly cleaning myself . My hygiene was terrible . Junior year I just completely gave up and let myself go . I went from being muscular to 60 pounds overweight . Couldn't even cut wait to join the Air Force . I'm now almost 22 and I have been trying hard to try to correct my life and I can't stay consistent with it at all . My teeth have got to be infested with cavities by now . Probably would take over 10K to fix all of my dental issues . I can't stand how disgusting I've let myself get but yet I can't seem to fix it . I've got a ton of mental issues so I'm becoming numb to everything . That's an entire different thing that I won't go into .",NEUTRAL,Positive,sadness
"I've not been diagnosed , as I've not been to see a gp because I'm scared of what they'll say , do , or not say or do anything . But everything I've read on this post and the comments , I can fully understand and share thoughts and feelings on . I didn't used to be like this . I used to be driven , happy , life was filled with everything , I was always busy . But 2019 happened and ruined everything , and I've been the same for the past 3 years now . Maybe lockdowns stopped me from being distracted enough to get to how I really feel ... But it's energy zapping . I don't brush my teeth for days , don't shower for a week at a time ... I used to exercise , sing , dance , but when I try now , I feel like led weights have been strapped to me physically and mentally .",NEUTRAL,Negative,joy
I made it through the night . Thank you though,NEUTRAL,Positive,joy
"Lol . Thank you concerned poster . Yes , that is 100 % cheesy . I get what you are saying . I have tons of things that I love doing , that ’ s not an issue at all . I ’ m 100 % indulging myself into everything I love and I ’ ve enjoyed those things . It ’ s the changes brought about by this chronic disease , the treatment and the present and the future outlook . It ’ s just dismal . I ’ ve tried to focus on that , but every time I try to turn my lemons to lemonade , I find the lemons are bruised and rotted . I love all my friends and family . They are concerned but the thing I ’ ve learned most about this ordeal , people not in the cancer club don ’ t understand your feelings and how this crap has a cost far beyond life threatening . When I meet someone else in the club , it ’ s nice . They get it . Cancer changes you physically and mentally . I ’ m not the same person I was before diagnosis . And I knew I wouldn ’ t be once the treatment started .",NEUTRAL,Neutral,sadness
"Same here … it ’ s hard to get anything done because everything makes me sad and tired , some days I just can ’ t get out of bed at all",NEGATIVE,Negative,sadness
"Thanks , this helped more than yk",POSITIVE,Positive,joy
What is your dx ? Do you take medication and therapy ?,NEUTRAL,Positive,fear
"Don ’ t blame yourself he was a horrible human , even if he was not mentally okay he knows right from wrong and don ’ t feel bad for him either cause he left you with trauma that you may never forget",NEGATIVE,Negative,sadness
"All I can really say is ditto . I ’ ve had such horrible depression most of my life and anxiety and these episodes of rage and up-and-down and now I guess it ’ s bipolar I don ’ t even know doesn ’ t even really matter I don ’ t think . This last four years have been hell . I ’ ve attempted suicide three times . I ’ d go days and days without bathing and I wouldn ’ t even notice wouldn ’ t eat . I get lost . I think one of the hardest things for me as I believe I ’ m just gonna be alone for the rest of my life . And sometimes I ’ m OK with it but other times I ’ m so sad . For the first time in my life I fell in love . And it turned out to be quite horrible . But I truly feel in love with someone . And before that I never really been in love and so being alone was just normal for me . But now it ’ s not any longer . Can you add everything else on top of it I wish I could go backwards . Just me and my depression and being alone . But I can ’ t I have to keep going forward somehow . Fighting my way out climbing my way out of this crevasse that I ’ ve been in for so long . I hear you all , I feel what you ’ re going through , i ’ ve had to make friends with my demons otherwise one of us would ’ ve killed the other by now . I can ’ t let that happen again and I won ’ t . I will overcome this that is my journey . Blessings take care",NEUTRAL,Neutral,sadness
"For me is my grandmother , she is taking away my freedom , controlling , judging me for everything I do . I know she ’ s old and I don ’ t want to do anything to hurt her but she ’ s hurting me without bleeding . My energy is drain whenever I stay with her .",NEUTRAL,Positive,anger
"I just posted something exactly like this last night but a bit shorter and man yknow what , you're 10000 % fucking right , which each year that goes by , every hour of everyday of every week is just a reminder of our inevitable demise and how the world is going to go to shit one way or another and for people like us fuck yeah it's just continuing to go to shit minute by minute , there is no salvation from this hell",NEUTRAL,Negative,sadness
"Thanks buddy , i feel the same for you too .",NEUTRAL,Positive,joy
"really try , don't give up .",NEUTRAL,Positive,joy
"Please . Hang on . You are not alone . I know this might sound cheesy , but here goes : Find something that makes life worth living again .",NEUTRAL,Positive,anger
I hear you . I'm listening . I care .,NEUTRAL,Positive,joy
"Hey , hey , okay . I understand . Yes . Yes you can do this . It's your life after all , isn't it ? I mean you've made it this far ? You can do this . I promise you can do this . You can take it back . Grab your life by the reins and show it who's boss ! Make your life worth living ! I promise , you can do this .",NEUTRAL,Positive,joy
"Maybe you can hang out with some friends or talk to them over the phone , go on a walk , learn a difficult song . i find that when i feel the urge to self harm , the cold air stings in a similar way ( if that makes sense ) . same thing with hot / cold showers . do your best to stay active and distracted , i'm in the same boat with the shitty memories so we in it together lol . im rooting for you",NEUTRAL,Positive,anger
Thank you all for the support and I hope we can get through this together . Happy New Year .,POSITIVE,Positive,joy
"Really don't blame ya bud . I get to finish off the year with covid because people are fucking stupid and no matter what the ones who aren't have to pay for their bullshit . Lemme be real with ya . Don't underestimate that fucking virus . I just broke my fever today . However , I still feel like omega fucking shit . Then I also had the pleasure of arguing with a member of my family because they're fucking insane and cannot stand it when they dont get attention . My fucking parent . :unamused_face: :unamused_face: :unamused_face: So yeah man or woman , fuck 2021 ...",NEGATIVE,Positive,sadness
"yea , same here",NEUTRAL,Negative,joy
"People were always judged , what do you nowadays ? This is the problem with people who rant about the modern world , they seem to think that everything is worse nowadays .",NEUTRAL,Negative,anger
Okay (:,POSITIVE,Positive,joy
It really is … I always feel like I ’ m fighting a battle I can ’ t win .,POSITIVE,Negative,sadness
I spend most time at home .,POSITIVE,Negative,joy
"Sure , I don ’ t mind talking , whenever you ’ d like . Maybe this feeling has passed for you . Just know there will always be people :smiling_face_with_halo:",POSITIVE,Positive,sadness
"Same here , sometimes I can ’ t even shower , other times it ’ s so hard to get up for work or even eat and it feels like no one around me understands , it ’ s basically living like a robot . I ’ m trying to do new things or force myself to hobbies so I can feel somewhat okay but it ’ s difficult I know . I really hope you ’ ll be okay and don ’ t always think it ’ s an end to things . It won ’ t be if you want to talk to someone I ’ m available to talk",NEUTRAL,Negative,joy
you are not a waste of space . that ’ s all i know . i ’ m sorry you ’ re dealing with this shit . i do as well on the daily and i ’ m 34 . we are not wastes of space . i have to tell myself that . i have to tell us that . we don ’ t deserve death . that ’ s all i know .,NEUTRAL,Negative,sadness
Agreed for frick ’ s sake . I don ’ t brush my teeth for like 2 or 3 days straight and I know I should but I can ’ t even do that simple fricking task,NEUTRAL,Negative,joy
"I have had depression all my life . For the last 10 months or more I've been getting a lot worse , I've been suicidal and this is so different . It's a deeper , darker , depression . It's so much worse than what I've ever battled with .",NEUTRAL,Negative,sadness
Could you try redefine what success is ? I ’ d think that ’ d help greatly .,POSITIVE,Positive,joy
"It also gets very uncomfortable before you can accept that who you were before this is now gone , and who you are right now is someone new . Take notes of new feelings and other important things",NEUTRAL,Positive,joy
"I hope it ’ s some weight off your shoulders that it ’ s a phase , and a recurring one for that matter . Sensitivity is a blessing and a curse , but don ’ t fret . You should really learn to listen to yourself from now on , to what feels right and not , learn to listen to your mind and control it , and not have it run on automatic pilot , learn to recognize your emotions and accept them . Seeing things for what they are without judging them will get you a long way . You ’ ll have to learn to live with loneliness , but there are hotlines to call if you need , and journalling , or any other outlet , can do wonders . You need to go find a life that ’ s fulfilling to you and it might take decades , but you have time , more than anything . Don ’ t rush it , no need to be overwhelmed . There ’ s great potential in the journey . Happy new year my guy",POSITIVE,Positive,joy
"I ’ ve been in and out of my own apartments and now I ’ m right back at someone else ’ s house . It sucks but it ’ s an opportunity . Save like crazy and buy your freedom . Grieve your losses in life but don ’ t let them pull you under . There must be SOMETHING you enjoy . Even if it ’ s a just carton of ice cream , do something nice for yourself today . Life is constant change ! Stick around and wait for the sun to come out again . You don ’ t get another chance .",NEUTRAL,Positive,joy
I appreciate you responding man It means a lot more to me than you think,POSITIVE,Positive,joy
I haven't killed myself because I am my mom's older daughter . We have no money and are on government assistance . If I die then her life was spent struggling for no reason . It sucks I don't know what to do,NEUTRAL,Negative,sadness
Im so sorry for u … dms are always open for anyone to talk,NEUTRAL,Positive,sadness
What's so happy about the new year ? ?,POSITIVE,Positive,joy
"Right there with ya bud , my ex moved on and is living the best life , I'm doing well but when I see pics of her , she looks happy and she was never a boring person . Drives me nuts I can't be with her like I'd want . It doesn't go away till you move on and unfortunately you have to be patient because you can't magically fast forward time where you have money saved up . Hurts letting your guard down to be hurt like this . Find a room In a house for rent 800 $ and get away from your parents",POSITIVE,Negative,sadness
Where are you from ? ... I guess we have quite similar lives .,NEUTRAL,Positive,joy
Welcome to spiritual awakening . It gets dark before it evens out,NEUTRAL,Positive,sadness
I recently watched a documentary about MAPS call magic medicine . In the UK it's difficult to get hold of and is only used in trials medically . Thanks for reaching out . Have a great new year . :party_popper: :sparkler:,NEUTRAL,Positive,joy
"Yeah I also feel lonely sometimes even though I have a broth but he's always talking to his girlfriend , having someone to talk to is really great and i would love to talk to you",POSITIVE,Positive,sadness
"Please call the suicidal hotline in your area . Even if you feel like it ’ s manifested physically , their job is to help you get in somewhere for head to toe help . Don ’ t be afraid of what parents think . So what ’ s right for you but death , I promise … is not the answer , ok ? :crying_face:",NEUTRAL,Positive,fear
"I bet they do but probably completely overwhelmed and exhausted . Are they in their late 30 ’ s or 40 ’ s . I have two kids on the spectrum . Though I lost a lot of weight after I divorced their dad and things got a bit better . My health definitely took a turn . I became so much more fatigued and completely depleted . I do have disk degeneration and fibromyalgia … come to find out . It really put the breaks on my progress with kids health , also my job was not as understanding as I needed them to be . :pensive_face:",NEUTRAL,Negative,fear
"Maybe microdosing ? Look into MAPS clinics . Or DYI , but carefully . I totally understand :smiling_face_with_tear:",NEUTRAL,Positive,joy
"Good luck man , hope things get better for you , even just a little bit , probably doesn't mean much but I wish you all the best",POSITIVE,Positive,joy
"I have been feeling the same . I know that there ’ s people who love me that I could and probably should open up about how I feel . Yet , I always find myself sitting alone at night or hiding in the bathroom so my family won ’ t see my tears . I know I ’ ve got abandonment issues from my childhood and I just can ’ t seem to trust anyone enough to see me so vulnerable . It ’ s a terrible cycle to be in on a daily basis . And when you add Covid and the pandemic to the mix it just makes this world an even colder place . I don ’ t know what you may be over reacting about or over thinking . When I feel this way about myself I have to remind myself if something is on my mind so much so to distract me from my everyday chores then it must be something important to me on a moral or boundary level . It normal to overthink things that try to push us beyond our character . Your not crazy , your feelings are real . And if you ever need a friend to talk openly without judgement , I ’ m a message away . Hope your day gets better friend .",NEUTRAL,Negative,sadness
"This is why it's important to be happy by yourself before you move on to a relationship or even think about dating . Like you said as long as you remain depressed and in a sticky situation your chance of attracting a proper woman is close to zero but you shouldn't necessarily feel broken because of this ; It's a chance for you to figure yourself out better and focus on things that make you happy . Enjoy the time you got with your daughter ... more so now that she needs someone to fill the void left and there's no better person to fill that void than a father . Your physical injuries will heal with time assuming you don't have a condition preventing you from so . Until then focus on your daughter . When you are feeling better it's time to get out there and put your life back on track stability-wise . When the moment is right to start looking for another woman you will know ... or maybe they'll find you before then ! Just don't force it or you will only attract those seeking a quick fling . And please try to make sure that your daughter knows of your adventures and is fully supportive of you getting on with another woman as it could cause a divide between you two . Stay strong , there's hope for you still .",POSITIVE,Positive,sadness
"Try to go to therapy with your daughter .. Also when you find a woman , be SURE that your daughter likes her too and don't say that only for you .. cause it will change her life in a bad way if she doesn't like her",NEUTRAL,Positive,joy
"Damn I feel the same way . I'm all alone except for my trustees i . e , my parents . No friends to spend time with , so I guess I'll be spending the new year or the upcoming year alone so yeah . You're not alone mate .",NEUTRAL,Negative,sadness
"I cant tell you what to do , but don't there is more of there for you . There are people out there that will care for you and love you for you . You can go anywhere in life if you allow yourself to . My dms are always open if you want to talk !",POSITIVE,Positive,love
"It's not stupid at all . You have to take on the little things because there is that possibility they will turn into big things . When the big things happen , you will look back and be heal for the little things like the TV show . Keep finding your little things and keep going !",NEUTRAL,Positive,joy
"I wish I could answer this for you , but I cannot remember a time when I wasn't depressed . It's okay though . I know life feels hard right now and you want to go but it's going to be okay . My dms are always open if you need a friend . I go on because I want to see what's next . I want to figure out how my life is going to go . It's worth it . I wanted to die in 09 . I tried a lot of things and failed miserably . I'm still here but if I succeeded in my attempts , I wouldn't have my beautiful daughter or my dog . I know it seems silly to include my dog , but I love my pup . I not only want to see what's next for me , but for my kid and dog as well . Once again , my dms are open if you ever want to talk . I hope all works out for you .",NEUTRAL,Neutral,sadness
sounds like kind of a big deal . maybe it ’ s affecting you more than you think . you ’ ll probably feel better after some rest .,POSITIVE,Positive,joy
"have you tried RX medication ? it can get you through a rough patch , until you can build the support system you need .",NEUTRAL,Positive,anger
you owe it to your mom to at least try professional help before giving up .,NEUTRAL,Positive,joy
NYE is the last in a series of dumb high pressure events we call ‘ holidays ’ . forget this bogus timeline . join a class club or volunteer to meet people on a regular basis that you can connect with as friends .,NEUTRAL,Positive,sadness
"I'm sure you're better looking than you think , and any womans voice , low or high , is a voice that should be cherished . But seeing as how I've been alone for 5 + years I might not know much anymore ... Anyways , I'll take a shot for you while a drink a 5th to myself for new years . : ° - )",POSITIVE,Positive,joy
