body_alltext,Sentiment_Type,huggingface_sentiment,t5_emot
"I relate to this so much , I had to go up and make sure , it was not my post . WOW . So someone else feels this too .",POSITIVE,Positive,joy
"Fuck I feel you - I had such bad anger when I was depressed . No it ’ s not right that you yell at him but don ’ t blame yourself and don ’ t blame him - It is a symptom of depression and he needs to be understanding of what puts you over the edge and you either need to work together or break up . I ’ m sorry you ’ re both dealing with this . Yes , my boyfriend is amazing and helps calm me down during my anxiety attacks and has just held me while I cried and sometimes I used to get mad at him and try to push him away and he was really great about it . I ’ m now way way better because I ’ ve finally found a medication that works for me ( which I feel so lucky cuz I ’ ve had horrible luck with medication in the past and went almost ten years without taking any ) I ’ ve had boyfriends in the past who were not supportive and / or were the * cause * of my depression . I ’ m not trying to say that you have to wait until you ’ re not depressed to date , but sometimes working on yourself and seeing how you feel without another influence in your life can be really helpful . It helped me a lot . #definitely don ’ t be afraid to tell people HOW you need help ! Your boyfriend may be clueless on how to properly help you - idk how young you guys are . What your financial situation is , or how long you have been together , but if you ’ re young and he wants to go out and be social and you ’ re unable to , he may be resentful . Or if he ’ s paying your bills while you lay in bed depressed I ’ m sure that ’ s really frustrating for him . It usually goes two ways , and you have to understand that you probably aren ’ t acting your best self . Not to say you should blame yourself or be angry at yourself - but that you do need to put in the extra work to make yourself a priority . Get therapy , find support groups , read articles online , start medication if that ’ s something you ’ re interested in ( don ’ t feel like you have to ) , try reading , yoga , walks , taking a bath , or working out . Some days when I was depressed the most I could do was just take a shower or brush my teeth and go back to bed . But the more you try to build a routine no matter how small or maybe even pointless , you ’ re still taking steps in the right direction . Tell him what you need , let him know that you ’ re needing space , needing him to hold you , needing him to play a video game with you , needing him to take you out on a date so you have a reason to get dressed up - literally give him things he can do to help you and ask what you can do in return ( like go on a hangout with him and his friends , go out bowling together , take a walk to the park , do a chore around the house for him ) and see if any of that helps you both soften up a bit and see that the other is trying . Idk I know I just rambled a lot but I feel for you because I have been there .",NEUTRAL,Negative,joy
My wife is amazing and understanding and has helped me through many hard times . She's my rock . There are supportive and good partners in the world OP,POSITIVE,Positive,love
"I would say my husband is , but his view point on the support he gives is from his very limited understanding of what depression is . It's like that popular tiktok sound "" Raining ? Why is it still raining ? I did everything I was supposed to . "" Well unfortunately it feels like that rain will never go away . I've tried explaining it to him , but in the end I just let him do what he does best . Men like to fix things so if it looks like I'm happy with what he is doing , he keeps doing it . I see that as supportive enough . It does make me happy even if this heavy cloud never leaves .",POSITIVE,Negative,joy
"Maybe the new therapist will be more helpful , you should at least give it a go . You don't know until you at least meet the new person . I'm sorry you feel so bad",NEUTRAL,Negative,sadness
Yea I know how you feel . It ’ s hard but you have to do your best to live up to your own potential,POSITIVE,Positive,sadness
"Thank you . I really needed to hear that . I know im depressed , but im not fuckin crazy like he tries to blame me .",NEUTRAL,Negative,sadness
"The one time I let myself have a severely depressed gf I did the best I could to help her , so yes there are people who will help you , maybe not your bf though",POSITIVE,Negative,sadness
"It's good you reached out for help . But words matter . You are contributing to the stigma of the disease you yourself suffer from . Would you be ok with someone referring to you as crazy ? Think about all the people who fear being fired from their jobs if their employers found out they have depression simply because uneducated stigma has created a false notion that depression equals crazy . You are more than welcome to repost your question with the correct terminology - hospitalization , inpatient , voluntarily or involuntarily committed .",NEUTRAL,Positive,joy
"I have been hospitalized multiple times as well . There is enough stigma as it is . And people are already embarrassed discussing it . Jokes only add to it . It's not ok , period .",NEUTRAL,Negative,sadness
"I've been going to a therapist since I started highschool , but it didn't really work , and she quit her job last week . Now , I have an appointment for next week to meet a new therapist .",NEUTRAL,Negative,anger
"27 mom here . Why is your post so relatable ! Living situation and relationship wise with my sons dad . My son is also 6 . & WOW , my sons dad says the same thing about me . I tend to bottle things up to avoid confrontation . I wonder why that is ? Also , I feel like i always have to push myself to be social . ( after all this pandemic thing ) I get a feeling of regret as soon as I make plans with my girls . - thinking i rather should have stayed home with my little one . Glad i ’ m not the only one but it does suck ! !",NEUTRAL,Neutral,joy
"27 here . Imagine me … lol . I started off backwards . Got married at 19 . Had a kid at 21 . My now ex was in the service and i paused my life to be with him . I feel like a HUGE failure at times but i remind myself that no one is perfect & everyone is going at their own pace . If you need time off for your mental health , then take it . My only advice is start off slow . Start doing something small for yourself , whether that be taking a walk or waking up early to drink some tea ? Just do something .",NEUTRAL,Positive,sadness
This right here ! To love yourself is just amazing . 10 years with my highschool sweetheart & we broke it off . I let myself feel EVERYTHING & slowly started getting to know me & fall in love with MYSELF .,POSITIVE,Positive,joy
At least you ’ re alive you ’ re gonna have to give your grandma pills one day too so its like a before payment,NEUTRAL,Negative,joy
"Just keep going some more days of pain and then you'll be with your family . Happiness can be found , even in the darkest of times , if one only remembers to turn on the light . Just thinking you are walking to towards the switch board now in the dark room but in the end you'll have a happy , light , and the joy of living .",POSITIVE,Positive,joy
I don ’ t have any advice I guess you could say but I totally understand how you feel . The world is an ugly place .,NEGATIVE,Negative,sadness
I'm sorry you feel like that . Have you tried therapy ?,NEGATIVE,Negative,sadness
Have you spoken to him about how your feeling ? He might not realize how his jokes are impacting you . If he does realize but does it anyway he is the joke,NEUTRAL,Negative,joy
"You can never move on from a memory it's not a human who was a part of your life and now he is now but memory is something which has happened to you you can't change it the only thing you can do is take lesson from it and be more strong that nothing like that will ever effect you again , start making new memories that way you'll automatically forget the bad one , the more you stay happy the less overthinking , bad memories and come back in your mine , sohan here just a common person , love you and take care of yourself .",NEUTRAL,Negative,joy
"You can never move on from a memory it's not a human who was a part of your life and now he is now but memory is something which has happened to you you can't change it the only thing you can do is take lesson from it and be more strong that nothing like that will ever effect you again , start making new memories that way you'll automatically forget the bad one , the more you stay happy the less overthinking , bad memories and come back in your mine , sohan here just a common person , love you and take care of yourself . :red_heart: ",NEUTRAL,Negative,joy
"Thanks for reaching out and congrats on the teaching job . I just feel very trapped is all . I have bad writers block and it holds me down from coming up with ideas for a film . It doesn ’ t help when tiredness from work and depression interfere to make it worse . Similar with relationships , the depression makes me too scared to reach out and also too lazy which holds me back . I ’ m stuck in hole , and every time I try to crawl out , the powers that be pour some oil down the wall and I slide back down",NEUTRAL,Negative,sadness
"Thanks for the reply . See the issue with “ that special person will come along someday ” is that it ’ s not a guaranteed thing . People tell me “ be patient , it will happen ” but I won ’ t really be happy if “ it will happen ” when I ’ m 50 and about to have sex with a hooker cos I never had any success in the dating game , or when I ’ m 70 and finally achieving some minimal success in my career field . I want to experience life while I ’ m still young but the way the cards were dealt , I ’ m just wasting away . However I appreciate the support and I ’ m glad you reached out .",NEUTRAL,Neutral,joy
"I wish you the best of luck man . I ’ m sure it hurts and I don ’ t know what to say , but I hope things get better for you .",POSITIVE,Positive,joy
i hope u are doing as best as u can I get that its hard but it will get better I'm rubbish at advice but I'm here if u need to talk,POSITIVE,Positive,sadness
I feel this every day,NEUTRAL,Negative,joy
I apologize if it came off that way . Not trying to degrade anyone here . Just trying not to kill myself .,NEUTRAL,Negative,sadness
"Thanks man I really do appreciate it . Glad everything worked out for you , and hopefully soon for me too .",POSITIVE,Positive,joy
I would guess that this joke was made to try and lighten the mood . OP wasn't trying to insult anyone . - someone who has been hospitalized multiple times,NEUTRAL,Negative,anger
Getting over love is pretty easy when you love yourself ! I've been there . And turns out the other person was wrong !,NEUTRAL,Negative,joy
"Joke back , and make it sting . He'll start to know how it feels .",NEUTRAL,Positive,anger
"It's starts with baby steps and than you will be healed , you walked a long way already but there's more . You can handle it , I hope it doesn't take too much time until you feel better enough , you deserve to be happy .",POSITIVE,Positive,joy
"I ’ m very sorry to hear that . I kind of understand where you ’ re coming from … Life feels incredibly worthless at this moment for me too . It is hard to keep up hope too and honestly the only thing keeping me going is that hope . The idea , the slight possibility that I will get through this . I don ’ t really have advice other than taking therapy sessions , that is what I lay my hope in right now . I can tell you it would be a slow process , but it is better than at least my current situation of having to quit studying for the second time because of my depression . I wish you all the best and hold on to that hope and find some help . I hope this didn ’ t sound cliché and too simple , that is the last thing I wanted to achieve . I wish you all the best .",NEUTRAL,Negative,sadness
"hey i ’ m 16 and a junior too , we have a rly similar story . I moved cities and schools so i know how you ’ re feeling , but what you ’ re feeling is valid since it really is hard to be the new kid , especially in the middle of the year . However it ’ s actually really good you still keep in touch with your old friends even if you aren ’ t able to physically be there , because holding on to those friendships will be really valuable when you need someone to talk to ( something i wish i ’ d done ) . I ’ m sorry for your loss , it must seem like life is on a rollercoaster but it will get better . A good thing to do , if you ’ re comfortable , is to speak to a counselor at school . I ’ ve done it and it ’ s helpful to know you have support at school . Even therapy can be useful if you ’ re comfortable to start it . You ’ re going through a lot right now but it will sort itself out by you taking action . Talk to random people at lunch tables , explain you ’ re new , talk to some random kid in class and ask for their number ( that ’ s how i made my closest friends ) , and remember to always keep talking to them , that way they ’ ll ease you into their friend group . Best of luck , keep going !",NEUTRAL,Positive,joy
"> You could also join an online discord for a game that you like , or a Facebook group for whatever subject that you like . I dont play video games that much anymore because cant enjoy them anymore with what I've been through for the past 20 months . I've lost all interest in virtual culture since the riots of May 2020 and I've found most people into the virtual culture have embraced wokeness on Facebook and discord . Virtual life isn't life and its worse than nothing . I've stopped using Facebook because people kept yapping about covid every chance they got . > You could also get vaccinated . Unless you ’ re allergic to it , there is no reason not to take it . The reason why im not vaccinated is because the hysteria won't stop . And its still going . Its the reason why I refuse to comply with covid culture and mask culture that you seem to enjoy . > Also why are you insulting me ? All I did was try to be helpful . You were helpful to yourself by trying .",NEUTRAL,Negative,anger
No problem,NEUTRAL,Positive,joy
"You could also join an online discord for a game that you like , or a Facebook group for whatever subject that you like . You could also get vaccinated . Unless you ’ re allergic to it , there is no reason not to take it . The vaccine has been studied by professionals all over the world . Those same studies have shown that the vaccine is highly effective at combating covid and have a extreme low risk of any lasting side-effects . All of this information is readily available for you if you want to see them yourself . Another thing that you could do is ask your doctor if there are masks that could work around your sensitivity issues .",NEUTRAL,Positive,joy
r / Covid 19 - Support,NEUTRAL,Positive,joy
"That's possible . I've made some serious mistakes but I don't know why . I have learned from them about how to be a better person but I don't understand how I didn't realize all of that kind of stuff in the first place . On paper I do but in person it's different . I'm not always negative or depressed . Just sometimes because life has it's ups and downs . Although I don't know if I'm more positive or negative . If all of my moods were added up and divided to determine the average of my total emotional state it would maybe be balanced ? I dk , I appreciate you commenting though .",NEUTRAL,Negative,joy
You need to just tell them .,NEUTRAL,Positive,fear
"I find this can only be discussed with others who have the same affliction . In my experience , ( as a non medical professional ) some people have these thoughts all the time with no intent on acting on them . However , it's such a big red flag , and no one wants to feel responsible for you harming yourself . That's my 2 cents . Good luck and please seek help , when needed . PS . Maybe try calling it "" Inpatient "" instead ?",NEUTRAL,Positive,joy
"Do not refer to a psych ward mental health in-patient clinic as a "" looney bin . "" It's absolutely unacceptable to degrade people in this way .",NEUTRAL,Negative,sadness
"The pain we experience , brought on by the ones we love more than ourselves , is excruciating . I pray you heal .",POSITIVE,Negative,sadness
"i can only imagine in my dreams what being outcasted like that feels like . 4 years of your life down the drain for a girl that doesn't even remember you . holy shit , dude . get well soon because your own mind is truely a sickness .",NEUTRAL,Negative,joy
"I really do appreciate this reply . It means a lot . I don ’ t like feeling self pity lol so I don ’ t talk about it much . Anyway , glad everything worked out for you , and again , thanks for the kind words .",POSITIVE,Positive,joy
"Though I'm sure you've heard it before , please know that it will get better . You're right . Being alone sucks . I resonate with your not being able to find a seat in the classroom - - during lunch , I would just walk around ... endlessly ... just so people wouldn't think I was sitting alone . Sometimes I'd go to the nurse . Usually , I just walked off of campus for 15 minutes and then walk back to catch my class . I've been around the same people for 12 years now ( hs senior ) and yet , like you , I feel lost . We're not awful people . Just misplaced . I am so sorry for your loss and I truly wish things improve for you . One day you'll make it better for people like us . You go to school to learn , improve , and change the world . I promise you that if you stay strong it will be okay . There will be someone for you . This random internet weirdo currently typing out a comment is also here for you too .",NEUTRAL,Neutral,sadness
"Life is very shitty most of the times but that doesn't mean there aren't people who care about you . Every person you've ever had relations with , be that family , friends , or as I read in your case , a coworker that you send memes to cares about you even that little bit . It really sucks that you were bullied and I'm sorry for that , I wish I was there for you . I'm sure you are an amazing person . As the other person said ( didn't want it to be a reply , I'm sorry if it doesn't make sense in a few days with a bit of comments ) one day you'll find your person that will love you for who you are . Not for how much you make or where you live . If that person loves you they won't care about that . They'll care about you . I hope it helped a bit . I know it's a bit the same . Wish you a happy birthday and hey we might play sometimes if you are interested . Just bare in mind I don't have a lot of like paid games . And no , killing yourself won't be a net positive . I expect to hear from you every month from now on .",NEUTRAL,Positive,sadness
My bad bro if I wrote it a certain way ! I mean no harm bro ! I love you dawg ! & hope all is well ! & I hope your new year will be the best year ! If you wanna ever talk . Inbox me,NEUTRAL,Positive,joy
"I feel that . It's especially difficult when my own spouse is in a good mood and I'm just a lump on a log . I feel guilty for being the downer . I feel envious that they got to experience happiness . I try my best to communicate the way I'm feeling but don't get far with it . Right now my therapist is suggesting Journaling which I use to write a lot of statements about how I feel and why I feel that way . Maybe try writing it down , no matter how it sounds , and see if it helps just to get it out .",NEUTRAL,Negative,sadness
"I get that , I wanted to clarify because I wasn ’ t directly “ mad ” at you . I just always hated that kind of wording while I was doing this with my brother . Much love to you , and hope your new year goes well !",NEUTRAL,Positive,anger
Bro I ’ m on your side . Find what makes you happy .. find inner peace ..,POSITIVE,Positive,joy
"I definitely understand the feeling of bitterness towards a sibling who is thriving in their life while you struggle just to wake up and subsist . It isn ’ t easy and it feels like every success of theirs is a personal attack saying “ you could have this if your head wasn ’ t making you absolutely miserable . ” It ’ s counterproductive though . You ’ ll find yourself only focusing your problems on them and it makes recovery or hope for better impossible . I feel this , I really do . I can say it ’ s gotten better though . I figured out that nobody could expect anything of me except myself . Nobody can project their ideas of a future on me and it freed my mind to find things that actually make me feel content . It ’ s not always happiness and good but I can finally feel different emotions than just sadness , despair and frustration . I hope this can give you some hope that it can change for you too OP !",NEUTRAL,Positive,joy
The fuck kind of help is that ? ?,NEUTRAL,Negative,anger
"It sounds like your cynical views on the world is causing some of your problems . And this is normal , loneliness and anxiety can make people a lot more defensive and on-guard . This could lead to people making bad assumptions about people that end up controlling future interactions . My advice is to do a lot of self-reflection on your views to see if their is more nuance to them that you did not initially recognize . And if there is , then keep that in mind in your next interaction with someone . Another thing that you could do is try to think more positively . And since it ’ s pretty hard to just “ be more positive , ” I recommend that you try to incentivize yourself into doing it . An example of this is to write down 5 things that you are grateful for .",NEUTRAL,Positive,anger
"> This might sound like bullshit bullshit advice , * * Because it is BS where I live * * and you're saying it to make yourself feel better about yourself . I'm in two areas , blue areas ( Washington , DC and prince georges county ) where they still have state of emergencies and mask mandates . I've already skipped two fan conventions ( a anime con and a upcoming video game ) because of their vaccine mandates and mask mandates and I dont go out much because all the social events and clubs are either virtual only or have heavy hygine theater because of the varient hysteria . And I can't deal with mask mandates because I have sensitivity issues with masks . If I lived in a state or city that does not care about covid anymore , I would take your advice . But you're saying this assuming that life is back to normal where I live . How am I supposed to just do it when and where people are obsessed with covid ? You can't you just can't and I do not have the money to move and I have a parent that I caregiver for so I can't abandon her unless I want to go to jail",NEUTRAL,Negative,joy
"This might sound like bullshit bullshit advice , but get yourself out there into society . Go to more social events , join a club , hell even just attempting simple conversation with people around you helps . I think part of the problem with people not finding the right bubble is that they try too hard and expect too much from their interactions . Just go and have fun , don ’ t look into interactions much , and hope for the best . This is what helped me . Once I stopped giving as much of a shit about making friends and how people think of me , I started getting the right friends and a better dating life .",POSITIVE,Positive,joy
"My friend , I feel your struggle . I have thought about how little the world would change if I weren ’ t in it . But there are always people who care about you . You need to keep finding the positive in everything , even if it is just a little thing . You have talents ; I wish I had the ability to make films ! So they didn ’ t win any prizes , but that doesn ’ t mean they aren ’ t successful . I am an artist , and one of the most profound things I have ever heard is that the problem with art ( and singing , and dancing ) is that the world has changed the definition of how to be successful at it . Art is meant to be an expression of yourself , a way to find something inside of you and bring it out ; film making is no different . If you are expressing yourself , you are already successful at it . You just need to keep doing it if it brings you joy . The money will come . It took me 40 + years to get to the place where doing what I love could help me make a living , but just last month I started a job teaching art at a paint studio . I taught my first class on Sunday ! Relationships are another tough one . I ’ m constantly told how I have a great sense of humor , how I am so fun to be around , yet I haven ’ t had a relationship last more than a year , and I didn ’ t have my first girlfriend til I was 21 , and she was SUPER abusive . You just have to keep being yourself . This coworker has opened a door for you , and introduced you to a new friend group who seems to think you ’ re pretty cool , so just keep being you and keep hanging out with them , and a relationship will come out of it ( not necessarily with her , but the best way for shy people like me to make new friends is to keep hanging with the old ones and meet new people together ) . You ’ ve got time , my friend . The only thing that can stop you is you , so please do not give up before you even truly become the man you are meant to be . Keep making films if that makes you happy , one day you ’ ll find an audience who loves them and who knows ? Maybe you ’ ll meet your soulmate at a premier ! Be well , my friend ! Kenn",POSITIVE,Neutral,joy
