body_alltext,Sentiment_Type,huggingface_sentiment,t5_emot
"There is more for you out there . I can ’ t say I have been through what you are going through . You are unique , we all are . However , I can say that I have struggled with depression and had similar thoughts to what you are expressing . Depression is a daily battle against an emotion . You have to fight . The cool thing is that we have the tools to fight . Of course there is medicine and counseling , but there is also things that you can do now that will help . Most people think that it is our emotions that control our actions , but that ’ s not the whole truth . It ’ s a cycle . Our emotions effect our actions and our actions effect our emotions . Smiling makes people feel happy . Performing acts of love makes you feel love . Serving others makes you care about them . The the other side of that is darker . Letting yourself wallow makes you more depressed . Positive actions make positive emotions and we can use that to rewrite our brain . Do this consistently and you can recover . It ’ s not always easy , but you can do it . You are loved . I love you .",POSITIVE,Positive,joy
You're only human friend . Intimacy or lack of is often the difference between happiness and misery .,POSITIVE,Positive,joy
You know it ... got arthritis in every joint ... some from bad genetics and some from stupid behavior from younger days . Something hurts every single day ... the bad days are when everything hurts . But please keep moving ... if you stop moving every joint will lock up and hurt worse ... am I that old that I now bond with strangers over broken body parts ? :loudly_crying_face:,NEGATIVE,Negative,sadness
Ain ’ t that the truth . * cries in chronic knee pain *,NEUTRAL,Negative,sadness
"It ’ s true though . Simply , living life to love someone is the easiest way to go . Honestly , I understand and I hope you find the strength and reason to live independently as you get older , but use this positive energy now to help grow and love yourself as much as you can also . :clinking_beer_mugs:",POSITIVE,Positive,joy
The thing about depression and depressive episodes is that sometimes we are hanging on by a thread and just one good thing can strengthen that thread at least for a while . But it ’ s not dependable . So ride the “ high ” as long as you can and don ’ t feel bad but realize that it ’ s no one else ’ s responsibility to make us want to live . So don ’ t put pressure on her . Other than just enjoy it !,NEUTRAL,Positive,sadness
It's called passive suicidal ideation and it's incredibly common for people with depression .,NEGATIVE,Negative,anger
"It's not fucked . It's literal human nature . We are not bears . We are not snakes . We are homo-sapiens that have lived for thousands of years ... together with each other . In a community . This generation of Americans is the first lonely generation , taught that we're supposed to be individuals rather than ... humans . The secret to happiness will always be a community you feel loved and accepted in . Sadly , though , our ancestors come from a long line of unhealthy communities . We destroyed some of the most healthy and loving human communities one could ever find in order to build the Americas into what they are today . All our ancestors are terrible , bad people who have no idea what it really takes to be happy . It's people . So don't feel bad that you need another human in order to survive . We literally all do . Just be glad you found that someone . Keep finding more . The most common thing found amongst those who live long lives , show that friendships are what kept them going the most .",NEUTRAL,Negative,love
"Small steps for us , just small steps ..",NEUTRAL,Positive,joy
Thank you . I can't say i've tried it . I'll try to try it .,NEUTRAL,Positive,joy
"Just remember how one little thing can change your life and outlook so quick . It ’ s so easy to get in your head and it ’ s impossible to comprehend how different your life may be in the next day , week , month . It ’ s worth sticking around even if it ’ s just a lil serotonin every now and then",NEUTRAL,Positive,joy
Right on dude make the best out of it,POSITIVE,Positive,joy
"And please give yourself time to heal properly . Don't rush yourself or let them rush you . I have a few years on you and learned the hard way ... if you don't let yourself heal properly , significant injuries WILL come back to haunt you !",NEUTRAL,Negative,anger
I completely understand ... it is fucked up how sometimes our joy purely depends on others . It's like we're not enough for ourselves . The dangerous thing is that people are unpredictable and can be very mean at times . Depending on another person can be dangerous,NEUTRAL,Negative,anger
"Yeah I ’ m like that the majority of my time . Consider it a good day when I ’ m not trying to seek out death , but if it happens suddenly , I ’ m not gonna try and stop it .",POSITIVE,Positive,joy
I'm glad it seems things are looking brighter,POSITIVE,Positive,joy
"If there was one thing giving me a little bit passion back , it was working out . I still have my problems , big problems , but it made things a lot better . Getting that workout in even when I ‘ m tired and mentally drained saved me a few times from bad thoughts . Wish you the best",NEUTRAL,Positive,sadness
"Stuck because no matter what i do , nothing will change . The main thing screwing me over is i am emotionally detached . I am honestly unable to form connections , and so i desperately wish i had friends i cared about and they cared about me , but i cant . I legitimately cant understand how people fall in love or how they love friends so deeply . Wish i could , though .",NEUTRAL,Negative,sadness
"I found it on google . Thank you , it was honestly lovely .",POSITIVE,Positive,love
Don ’ t become a story of that person who died it ’ s not who you were meant to be . people will mourn a lot longer than you think it will send a ripple effect of pain through so many people your not alone in your suffering even if you feel like your drowning in it . Please hold on .,POSITIVE,Positive,sadness
"I like the image / idea of the owl handing out sticks , hang in there , it will get better . I have to find that image , it was some motivational shit",NEUTRAL,Positive,joy
man i love computers,POSITIVE,Positive,anger
"Suicide Hotline Numbers If you or anyone you know are struggling , please , PLEASE reach out for help . You are worthy , you are loved and you will always be able to find assistance . Argentina : + 5402234930 430 Australia : 131114 Austria : 01713337 4 Belgium : 106 Bosnia & Herzegovina : 080 05 03 05 Botswana : 3911270 Brazil : 2123391 91 Bulgaria : 0035 9249 17 223 Canada : 5147234000 ( Montreal ); 18662773553 ( outside Montreal ) Croatia : 01483388 8 Denmark : + 4570201201 Egypt : 7621602 Finland : 010 195 202 France : 01453940 00 Germany : 08001810771 Hong Kong : + 852 2382 0000 Hungary : 116123 Iceland : 1717 India : 8888817666 Ireland : + 4408457909 090 Italy : 8008600 22 Japan : + 8103528690 90 Mexico : 5255102550 New Zealand : 05088288 65 The Netherlands : 113 Norway : + 4781533300 Philippines : 02896919 1 Poland : 5270000 Russia : 00782025775 77 Spain : 9145900 50 South Africa : 05144456 91 Sweden : 4631711240 0 Switzerland : 143 United Kingdom : 08006895652 USA : 18002738255 You are not alone . Please reach out . * * * I am a bot , and this action was performed automatically .",POSITIVE,Neutral,sadness
"I feel the same . I try not to talk to them about my mental illnesses because they have their own shit going on . They do ask sometimes which is sweet but I feel bad when I do . That is true about the internet . It has taken me a while to get I over my fear of being judged . I ’ ve realized that I can ’ t control if people judge me so I choose to let it go . I ’ m more comforted by the void now a days :face_with_tears_of_joy: Until now , I never posted much on any social media in fear I would be ridiculed or judged . So Thank you , I really appreciate it :smiling_face:  I ’ ll try and post more often . Literally ! I couldn ’ t eat right for a couple weeks because nothing tasted as good . I had to adjust my routine because the things that were once bearable became unbearable . I have always known I had problems . What took me so long was everyone invalidation of how I felt . They made me feel like I was going insane and I was the issue , just me , so In a sense for a long while I thought that was just my personality . It wasn ’ t until I got my first diagnosis of anxiety that I went on the journey to getting to know me with no judgement . It ’ s taken me a very long time to get to my depression diagnosis because I felt I would be put in a mental institution for wanting to kill myself . It is one of my worst fears because of how people get treated . I even told my current therapist if she called them it wouldn ’ t go well . That ’ s good that it should grow back after treatment . If your derm is sure , then I wouldn ’ t be too worried lol . I like to say I ’ ll burn that bridge when I get to it lmao . Hey if it doesn ’ t grow back I ’ ll fight them with you lol Thank you ! I really appreciate you talking the time to write to me . I ’ m glad that I could help you feel better because you ’ ve done the same for me . Thank you so much ! It ’ s hard , but knowing I ’ m not alone makes it much more bearable .",NEUTRAL,Neutral,sadness
the effects of your death would last forever on your loved ones . even if it doesn ’ t seem like it . you don ’ t deserve to leave the world in such a horrible way . talking to your loved ones about your issues is the best way to get support .,POSITIVE,Positive,sadness
Do you live in an urban or rural area ? It might be easier to find people with similar interests in a larger area . I wonder if you could get a part time job teaching lessons and kind of go from there ? Maybe there is a music store where you could eventually befriend the other workers ?,NEUTRAL,Positive,joy
Guitar and saxophone !,NEUTRAL,Positive,joy
What do you play ?,NEUTRAL,Positive,joy
"Thanks for your reply , I ’ ll just have to break out of my shell a bit more . I ’ m a musician",POSITIVE,Positive,joy
"I ’ ve found looking for people with similar interests can help . My friend has 6 kids , the second to oldest is very awkward and didn ’ t have many friends throughout childhood . He is now 19 and is making friends left and right through a D & D like game place . I really don ’ t know how to describe it other than there is a store where certain nights of the week people gather to play this D & D like game . If you don ’ t have any hobbies or interests maybe you can pick one up and start meeting people through that ?",NEUTRAL,Positive,sadness
Thank you for the advice I really appreciate it,NEUTRAL,Positive,joy
Damn what shitty friends and girlfriend . Sorry they made you feel worse . Hope someone comes along and genuinely shows you what a real friend is .,NEUTRAL,Negative,sadness
"Thanks for the reply lol , and by the way your talking i think we are from the same place since my grades also got shafted due to marks distribution for covid . And yes i suppose my brother was abused in his childhood and he is doing the same thing to my parents since they are the ones who did the abusing at least in his head . So he doesn't feel wrong to let his anger off on them and treat them like shit . And the thing is i wouldnt have been worried that much if i thought it was just a phase since everyone more or less goes through a phase like this in their life where all is lost and you dont know what to do with yourself . But my brother isnt dumb he knows exactly whats going on because before this he used to study a shit ton of phycology and watch motivational videos . So he is doing this knowingly and intentionally trying to trigger people . And since everyone is being considerate and giving him space or letting him do what he pleases hes doing it more and its kind of turning like a lifestyle for him . For example : i told him a few months back to not wear one of my shirts as it is my only shirt to go outside and none of the other shirts fit me , he purposely knowing that wore my shirt for a whole month straight . And he always takes my drinking bottle and puts his whole mouth on while knowing it bothers me , and i have told this soo many times but he never listens . But if i do something which he doesnt like , he will take up his fists . Thats just one of the millions of thing that add up together to make me hate him and i mean i want to kill him sometimes , we had fights before where he beat me quite bad but i never fought back since even while fighting i didnt want to hurt him and my mom said to not hit him . But he really tried to injure me . Now im scared that if he raises his hand at me one more time i will try to kill him and im scared that i wont be able to stop myself ( No Bs ) . So i think its best for me to move out atleast till the situation stabalizes . Otherwise in the next few years or so i have to be self sufficient to live on my own . But i dont really think my father nor my mother can deal with him at this point and they are just getting depressed with him . And at some point they will also start acting the same as my brother . Anyway i guess only time will tell , and sorry about the long writing . I was writting the whole post in the middle of them arguing so i let all the anger out on the post and made it big . Laugh",NEUTRAL,Negative,anger
"Thanks for the reply lol , and by the way your talking i think we are from the same place since my grades also got shafted due to marks distribution for covid . And yes i suppose my brother was abused in his childhood and he is doing the same thing to my parents since they are the ones who did the abusing at least in his head . So he doesn't feel wrong to let his anger off on them and treat them like shit . And the thing is i wouldnt have been worried that much if i thought it was just a phase since everyone more or less goes through a phase like this in their life where all is lost and you dont know what to do with yourself . But my brother isnt dumb he knows exactly whats going on because before this he used to study a shit ton of phycology and watch motivational videos . So he is doing this knowingly and intentionally trying to trigger people . And since everyone is being considerate and giving him space or letting him do what he pleases hes doing it more and its kind of turning like a lifestyle for him . For example : i told him a few months back to not wear one of my shirts as it is my only shirt to go outside and none of the other shirts fit me",NEUTRAL,Negative,anger
"Fair point , gets pretty lonely though",POSITIVE,Negative,sadness
"I think this is just a guy thing , I ’ m not very sociable either . Most of the time I just don ’ t bother with people , less trouble that way .",NEUTRAL,Positive,joy
"Hi dont know if you are going to read this . First , I would really stop using dating apps like tinder , they can be a pain to use . I would advice you to seek a support group for people with a smiliar disability . Not only does this help your mental health but you could meet great people there ! And what is your relation with your parents ?",POSITIVE,Positive,joy
bro that sucks big dong bro my respets my dude big F how is that feet feeling and that coping bro you eating properly bro,NEUTRAL,Negative,joy
Mhm ... It's time to sleep anyhow Let's see what the darl day of tomorrow brings,NEUTRAL,Positive,joy
bro people are dumb bro hhahahahh I dont even trust my mom ( love ya mom ) but it do be like that sometimes . trying a lot is not the same as everything bro but im not you so whatever,NEUTRAL,Positive,sadness
"Passion sure is the best bro , but it comes and goes like many things i guess at least thats my case . also liking things is cool feeling is cool in general bro thats why I hate depression you only feel number depression is such a miserable and pathetic demon in you but thats life i guess & #x200B ; how are you feeling stuck what you mean",NEUTRAL,Positive,joy
What a weird way to say it I've tried so many things Even talking to my friends feels only like a temporary solution,NEUTRAL,Negative,sadness
"that sounds like a resolution bro , I wouldn't recommend it tho . I'm sure there is something you haven't tried yet I bet my hamster on it",POSITIVE,Positive,joy
ever need a friend to listen hmu,NEUTRAL,Positive,anger
Thank you i take vistaril to every night for sleep and to help with nightmares,NEUTRAL,Positive,fear
"I use meltatonin for sleep and even then it ’ s hard , I did take prescription sleeping meds but I kept getting crazy nightmares My best advice is to contact a good psychologist and just get their advice",NEUTRAL,Negative,fear
"Yea I ’ ve tried vitamin d , exercise and meditation I ’ ve been on and off antidepressants since 5th grade but my biggest issue currently is anxiety I ’ m having almost 1 severe panic attack a night and they don ’ t wanan try benzos since I ’ m young and addiction runs in the family addiction is a big fear of mine",NEUTRAL,Negative,fear
"It's always good for three days and then dab for 4 month And some day , another year is gone And I still haven't done anything productive I don't think things will get any better I'm really ready to die , this time for real",POSITIVE,Negative,joy
Stuck . I just wish i was passionate again . I miss liking things .,NEUTRAL,Negative,love
"I ’ m not a medical professional but I tried 6 anti depressants over the course of a year , I still feel depressed but being outside and exercising has helped far more than medicine ever did I ’ m sure you ’ ve already tried this though",NEUTRAL,Positive,sadness
man that sucks for sure bro time passes and theres no stop thats for real . I please my parents a lot too bro its not that great hhaha . You think stuff can get at least like half a measure better or nah,NEUTRAL,Negative,joy
"sure thing bro , people are cool when they are cool and I try to be cool for the sake of chill . Also , I don't want to fall into the counseling loop of try this or that or whatever . So for real you don't have any motivation bro man thats crazy . How are you feeling dude",NEUTRAL,Positive,joy
"well my dude , maybe you should follow a greater moral law than just doing what other people ( who are just as imperfect as you and me ) want you to do . Overcome bro",NEUTRAL,Positive,joy
"Good ? Your asking tough questions here I Haven't been thinking about good things in the future for a while now I wanted to become a Goldsmith , or a Blacksmith , but I ended up in a science school because of my parents I can't change that I guess I'll die next week",NEUTRAL,Negative,joy
"Sadly , no . I've lost pleasure in everything . Really . I'm just a coward hence why i won't do it . Thank you for commenting , though . Been a while since i talked with someone , as pathetic as that sounds .",NEUTRAL,Negative,sadness
"well , how about : what if there was another reason aside from fear that is stoping you ? There has to be one at leeast",NEUTRAL,Positive,fear
"well , it is probably a very stressful situation my dude , but hey , what do you hope for the future that might be good ?",POSITIVE,Positive,joy
"My writing style is to be persuasive because I have seen too many people either ruin their lives or lose their lives to addiction and depression . I have been sober for over 14 years now and have gone from being self-loathing and self-destructive to sober , happy , and productive . That is what I set out to accomplish ; for people to see there is a solid way out of their despair . I will refrain from posting on your subreddit .",POSITIVE,Positive,joy
I can't even drink monster anymore either i get jittery or it just doesn't taste good lmao,POSITIVE,Negative,joy
I hope you the absolute best,POSITIVE,Positive,joy
Seems you're putting too much emphasis on someone else in order to be alive . As long as you're alive you have a chance at finding someone who wants to live for u . You're really thinking of reasons in order to take that chance away ? Also w h a t . I haven't been in any relationships but I thought the first requirement was love or affection . Is this a one sided thing ?,NEUTRAL,Positive,joy
"I respect that , don ’ t let people shit on you . Have a good new year .",NEUTRAL,Positive,joy
Yeah I really do lol I cut them off because they just started crossing the line but thank you and hope you have a good new year,POSITIVE,Positive,joy
Ah ok maybe you need some new friends then . Sorry your having such a rough time of it .,NEUTRAL,Negative,sadness
"of course , I know that it makes me feel better when I know that too . i'm glad I was able to help you feel a little less alone too",POSITIVE,Positive,joy
Thank you so much and yeah it sucks but I had to cut them off shit just sucks so much,NEUTRAL,Negative,anger
"of course man , and thank you v v much",NEUTRAL,Positive,joy
I get what your saying but there ’ s a difference between being an asshole n just making jokes but thanks anyway,NEUTRAL,Positive,anger
Thanks a lot n they already crossed the line so I cut them off but I ’ m still really lonely n stuff but Im just trying to focus on getting better,NEUTRAL,Positive,sadness
<3,NEUTRAL,Negative,anger
very very true . all we can do is keep trying as much as it sucks . thanks - I really do hope you can have a better year too . we all deserve one,NEUTRAL,Positive,joy
"Ugh I ’ m sorry about your accident , Matthew . It ’ s frustrating having your feelings invalidated by the people you need support from . It may not be a big deal to them , but you ’ re the one with two broken feet . I hope you have a speedy recovery and begin to feel better .",NEUTRAL,Negative,sadness
Roger rabbit . Definitely .,NEUTRAL,Positive,joy
"Fuck you sound like me when I was your age . Hang in there , it doesn ’ t get better but you do get used to it .",NEUTRAL,Negative,joy
Soooo underrated ! Those kids were the same ones drinking monster energy drinks during lunch . The real pros know that sleeping is the ultimate relaxation technique . My bed is where I feel the safest and at peace lol,POSITIVE,Positive,joy
"Come on Matt , surely you can see the funny side here . I ’ m sure your buddies were only joking and thought it would cheer you up . But I have heard this can be a very hard injury to recover from and I get why you would be feeling down when your by yourself . Your probably in a lot of pain and that ’ s why you got angry with your friends . I wish you a speedy recovery and I hope next Xmas is better for you .",NEUTRAL,Negative,sadness
"Sounds like your friends and girlfriend are very immature and have yet to grow up enough to interpret other peoples pains and struggles properly , hence the ' Lol that sucks ' mentality . thats shitty man , i would distance from them at least until you get back on your feet and then possibly furthermore . its not cool to laugh at people you supposedly care about when theyre going through a painful life altering event , truly it doesnt get much shittier than that .",NEUTRAL,Positive,sadness
Sleep is honestly so underrated i remember how in highschool everyone would brag about how little they get,NEUTRAL,Negative,sadness
"Wow I appreciate your comment more than you know ! ! I know exactly what you mean about your friends . There was a day when I realized that everyone else is living a life as vivid as my own , and no one ’ s coming to save me . Also , I avoid talking about my mental health with them anyway or any heavy subject for that matter because I don ’ t want to burden them with that information . I think as I got older I realized most people just don ’ t want to hear it . However , one of the perks of the internet is we can be whoever we want to be and express ourselves any way we like . I ’ m essentially speaking into the void :face_with_tears_of_joy: I hope you post more often ! It feels very liberating . I have like four burner accounts I rotate through depending on my mood . Omg I relate to the dull and lackluster comment so hard ! If I don ’ t smoke weed , food doesn ’ t taste as good , colors aren ’ t as bright , and I ’ m not as creative . It makes everything so much more tolerable right . What was the tipping point that made you realize you were depressed ? Did you think that was just your personality ? For a long time I thought it was just my personality . It wasn ’ t until I had a mental breakdown and ended up in the hospital when I realized it indeed was not normal to not want to exist and that ya girl had depression lmao . Thank you for the hair sympathy . Thankfully it isn ’ t too bad and according to my derm , It ’ ll grow back with treatment in about 6 months . I didn ’ t even realize my hair was thinning until like two weeks ago when I realized my bangs were lookin a little sus lol . So I went to the derm on Tuesday and she ’ s like oh yup looks like you had Telogen effluvium ( stress induced hair loss ) , which has then triggered the Androgenic alopecia ( female pattern hairloss ) since I was already predestined to have it . If it doesn ’ t grow back in 6 months I ’ m telling the doctor to fight me lmao . Thank you for taking the time to speak to me . It means a lot and made me feel better knowing I ’ m not alone in this feeling . I hope you navigate life better now knowing there ’ s a diagnosis for why you ’ re feeling the way you do and that there are others who are experiencing the same . There aren ’ t many people who will understand , but others on these subreddits who have experienced the devil that is mental illness , do . We need to lean on each other !",NEUTRAL,Positive,joy
